arXiv:1411.0030, Title: A* Sampling
arXiv:1411.7334, Title: Random Matrix Derived Shrinkage of Spectral Precision Matrices
arXiv:1411.7342, Title: Full Matching Approach to Instrumental Variables Estimation with  Application to the Effect of Malaria on Stunting
arXiv:1411.7405, Title: A note relating ridge regression and OLS p-values to preconditioned  sparse penalized regression
arXiv:1411.7420, Title: Optimal Bayesian estimation in random covariate design with a rescaled  Gaussian process prior
arXiv:1411.7432, Title: Metrics for Probabilistic Geometries
arXiv:1411.7481, Title: Nonparametric Bayesian Inference for Mean Residual Life Functions in  Survival Analysis
arXiv:1411.7508, Title: Forecasting the Colorado River Discharge Using an Artificial Neural  Network (ANN) Approach
arXiv:1411.7565, Title: Exact testing with random permutations
arXiv:1411.7571, Title: A Bayesian Semiparametric Approach to Learning About Gene-Gene  Interactions in Case-Control Studies
arXiv:1411.7581, Title: A new permutation test statistic for complete block designs
arXiv:1411.7601, Title: Saturated locally optimal designs under differentiable optimality  criteria
arXiv:1411.7610, Title: Learning Stochastic Recurrent Networks
arXiv:1411.7650, Title: Nonparametric statistical inference for the context tree of a stationary  ergodic process
arXiv:1411.7687, Title: A fully data-driven method for estimating density level sets
arXiv:1411.7694, Title: On the consistency of a spatial-type interval-valued median for random  intervals
arXiv:1411.7706, Title: A Nonparametric Bayesian Approach to Uncovering Rat Hippocampal  Population Codes During Spatial Navigation
arXiv:1411.7713, Title: Unbiased Monte Carlo: posterior estimation for  intractable/infinite-dimensional models
arXiv:1411.7718, Title: Classification with Noisy Labels by Importance Reweighting
arXiv:1411.7759, Title: On Conditional Prediction Errors in Mixed Models with Application to  Small Area Estimation
arXiv:1411.7782, Title: Combining regional estimation and historical floods: a multivariate  semi-parametric peaks-over-threshold model with censored data
arXiv:1411.7783, Title: From neural PCA to deep unsupervised learning
arXiv:1411.7817, Title: Learning with Algebraic Invariances, and the Invariant Kernel Trick
arXiv:1411.7864, Title: Efficient inference of overlapping communities in complex networks
arXiv:1411.7888, Title: Bayesian model choice via mixture distributions with application to  epidemics and population process models
arXiv:1411.7919, Title: Network-Based Pathway Enrichment Analysis with Incomplete Network  Information
arXiv:1411.7924, Title: Predicting clicks in online display advertising with latent features and  side-information
arXiv:1411.7934, Title: Estimating parameters of a multipartite loglinear graph model via the EM  algorithm
arXiv:1411.7955, Title: Leveraging Cloud Data to Mitigate User Experience from "Breaking Bad"
arXiv:1411.0007, Title: Rapid Adaptation of POS Tagging for Domain Specific Uses
arXiv:1411.0023, Title: Validation of Matching
arXiv:1411.0024, Title: Robust sketching for multiple square-root LASSO problems
arXiv:1411.0161, Title: Entropy of Overcomplete Kernel Dictionaries
arXiv:1411.0169, Title: Near-Optimal Density Estimation in Near-Linear Time Using Variable-Width  Histograms
arXiv:1411.0347, Title: Iterative Hessian sketch: Fast and accurate solution approximation for  constrained least-squares
arXiv:1411.0591, Title: Bayesian feature selection with strongly-regularizing priors maps to the  Ising Model
arXiv:1411.0622, Title: A Subspace Method for Array Covariance Matrix Estimation
arXiv:1411.0972, Title: Convex Optimization for Big Data
arXiv:1411.0997, Title: Iterated geometric harmonics for data imputation and reconstruction of  missing data
arXiv:1411.1045, Title: Deep Gaze I: Boosting Saliency Prediction with Feature Maps Trained on  ImageNet
arXiv:1411.1076, Title: A statistical model for tensor PCA
arXiv:1411.1087, Title: Fast Exact Matrix Completion with Finite Samples
arXiv:1411.1119, Title: Projecting Markov Random Field Parameters for Fast Mixing
arXiv:1411.1134, Title: Global Convergence of Stochastic Gradient Descent for Some Non-convex  Matrix Problems
arXiv:1411.1151, Title: Guaranteed Monte Carlo Methods for Bernoulli Random Variables
arXiv:1411.1158, Title: On the Complexity of Learning with Kernels
arXiv:1411.1375, Title: Heuristic algorithm for 1D and 2D unfolding
arXiv:1411.1472, Title: Why are public health authorities not concerned about Ebola in the US?  Part I. Fat tailed distributions
arXiv:1411.1477, Title: Some binomial sums involving absolute values
arXiv:1411.1488, Title: Analyzing Tensor Power Method Dynamics in Overcomplete Regime
arXiv:1411.1546, Title: Tree decompositions and social graphs
arXiv:1411.1752, Title: Submodular meets Structured: Finding Diverse Subsets in  Exponentially-Large Structured Item Sets
arXiv:1411.1784, Title: Conditional Generative Adversarial Nets
arXiv:1411.1830, Title: Introduction to the R package TDA
arXiv:1411.1971, Title: Power-Law Graph Cuts
arXiv:1411.1990, Title: A totally unimodular view of structured sparsity
arXiv:1411.1993, Title: Network Methods for Pathway Analysis of Genomic Data
arXiv:1411.2003, Title: Efficient Estimation of Mutual Information for Strongly Dependent  Variables
arXiv:1411.2045, Title: Multivariate f-Divergence Estimation With Confidence
arXiv:1411.2305, Title: Model-Parallel Inference for Big Topic Models
arXiv:1411.2316, Title: Zero-Aliasing Correlation Filters for Object Recognition
arXiv:1411.2374, Title: Similarity Learning for High-Dimensional Sparse Data
arXiv:1411.2405, Title: Sparse Estimation with Generalized Beta Mixture and the Horseshoe Prior
arXiv:1411.2547, Title: Statistical distributions of sequencing by synthesis with probabilistic  nucleotide incorporation
arXiv:1411.2548, Title: Length distribution of sequencing by synthesis: fixed flow cycle model
arXiv:1411.2549, Title: Distributions of positive signals in pyrosequencing
arXiv:1411.2668, Title: Statistical distributions of pyrosequencing
arXiv:1411.2820, Title: Supervised Classification of Flow Cytometric Samples via the Joint  Clustering and Matching (JCM) Procedure
arXiv:1411.3128, Title: Deep Multi-Instance Transfer Learning
arXiv:1411.3169, Title: On Coarse Graining of Information and Its Application to Pattern  Recognition
arXiv:1411.3224, Title: On TD(0) with function approximation: Concentration bounds and a  centered variant with exponential convergence
arXiv:1411.3317, Title: Finding Adam in random growing trees
arXiv:1411.3486, Title: Bounding the maximum likelihood degree
arXiv:1411.3488, Title: The subordinated processes controlled by a family of subordinators and  corresponding Fokker-Planck type equations
arXiv:1411.3638, Title: Pattern of tick aggregation on mice: larger than expected distribution  tail enhances the spread of tick-borne pathogens
arXiv:1411.3650, Title: DUM: Diversity-Weighted Utility Maximization for Recommendations
arXiv:1411.3685, Title: A warped kernel improving robustness in Bayesian optimization via random  embeddings
arXiv:1411.3776, Title: Measuring Influence in Twitter Ecosystems using a Counting Process  Modeling Framework
arXiv:1411.3816, Title: Monte Carlo error analyses of Spearman's rank test
arXiv:1411.4000, Title: How to Scale Up Kernel Methods to Be As Good As Deep Neural Nets
arXiv:1411.4005, Title: A convex formulation for hyperspectral image superresolution via  subspace-based regularization
arXiv:1411.4072, Title: Learning Multi-Relational Semantics Using Neural-Embedding Models
arXiv:1411.4199, Title: Revisiting Kernelized Locality-Sensitive Hashing for Improved  Large-Scale Image Retrieval
arXiv:1411.4281, Title: An Improved Hazard Rate Twisting Approach for the Statistic of the Sum  of Subexponential Variates (Extended Version)
arXiv:1411.4314, Title: Hierarchical and Matrix Structures in a Large Organizational Email  Network: Visualization and Modeling Approaches
arXiv:1411.4503, Title: Outlier-Robust Convex Segmentation
arXiv:1411.4648, Title: A unifying framework for relaxations of the causal assumptions in Bell's  theorem
arXiv:1411.4695, Title: Feedback Solution to Optimal Switching Problems with Switching Cost
arXiv:1411.4750, Title: Convergence rates of maximal deviation distribution for projection  estimates of Lévy densities
arXiv:1411.4867, Title: Respondent-driven sampling and an unusual epidemic
arXiv:1411.5159, Title: Large deviations of the realized (co-)volatility vector
arXiv:1411.5172, Title: Learning nonparametric differential equations with operator-valued  kernels and gradient matching
arXiv:1411.5179, Title: A new algorithm for wavelet-based heart rate variability analysis
arXiv:1411.5371, Title: Unification of field theory and maximum entropy methods for learning  probability densities
arXiv:1411.5383, Title: Johnson-Lindenstrauss Compression with Neuroscience-Based Constraints
arXiv:1411.5404, Title: Stochastic Block Transition Models for Dynamic Networks
arXiv:1411.5417, Title: Private Empirical Risk Minimization Beyond the Worst Case: The Effect of  the Constraint Set Geometry
arXiv:1411.5595, Title: Linking GloVe with word2vec
arXiv:1411.5620, Title: Maximum Entropy Kernels for System Identification
arXiv:1411.5625, Title: Two maxentropic approaches to determine the probability density of  compound risk losses
arXiv:1411.5639, Title: N-sphere chord length distribution
arXiv:1411.5731, Title: Visual Sentiment Prediction with Deep Convolutional Neural Networks
arXiv:1411.5732, Title: A Joint Probabilistic Classification Model of Relevant and Irrelevant  Sentences in Mathematical Word Problems
arXiv:1411.5915, Title: Robust EM kernel-based methods for linear system identification
arXiv:1411.5988, Title: Clustering evolving data using kernel-based methods
arXiv:1411.6081, Title: PU Learning for Matrix Completion
arXiv:1411.6156, Title: Efficiently learning Ising models on arbitrary graphs
arXiv:1411.6179, Title: Spatiotemporal Detection of Unusual Human Population Behavior Using  Mobile Phone Data
arXiv:1411.6265, Title: Gaussian Phase Transitions and Conic Intrinsic Volumes: Steining the  Steiner Formula
arXiv:1411.6285, Title: Target Fishing: A Single-Label or Multi-Label Problem?
arXiv:1411.6307, Title: Diversifying Sparsity Using Variational Determinantal Point Processes
arXiv:1411.6370, Title: Big Learning with Bayesian Methods
arXiv:1411.6529, Title: The Optimal Arbitrary-Proportional Finite-Set-Partitioning
arXiv:1411.6591, Title: A Latent Source Model for Online Collaborative Filtering
arXiv:1411.6651, Title: A Greedy, Flexible Algorithm to Learn an Optimal Bayesian Network  Structure
arXiv:1411.6970, Title: Post-acquisition image based compensation for thickness variation in  microscopy section series
arXiv:1411.7245, Title: Heuristics for Exact Nonnegative Matrix Factorization
arXiv:1411.7346, Title: A Chasm Between Identity and Equivalence Testing with Conditional  Queries
arXiv:1411.7414, Title: Signal Recovery on Graphs: Variation Minimization
arXiv:1411.7441, Title: Pattern Decomposition with Complex Combinatorial Constraints:  Application to Materials Discovery
arXiv:1411.7596, Title: Convex Techniques for Model Selection
arXiv:1411.7717, Title: On the Expressive Efficiency of Sum Product Networks
arXiv:1411.7920, Title: Probability Theory without Bayes' Rule
arXiv:1411.7973, Title: Bus Travel Time Predictions Using Additive Models
