arXiv:1505.00829, Title: Inference on the Sharpe ratio via the upsilon distribution
arXiv:1505.00853, Title: Empirical Evaluation of Rectified Activations in Convolutional Network
arXiv:1505.00965, Title: An Introduction to Multilevel Monte Carlo for Option Valuation
arXiv:1505.00990, Title: Identification of stochastic operators
arXiv:1505.01135, Title: Iterative ensemble smoother as an approximate solution to a regularized  minimum-average-cost problem: theory and applications
arXiv:1505.01187, Title: GWGGI: software for genome-wide gene-gene interaction analysis
arXiv:1505.01206, Title: Trees Assembling Mann Whitney Approach for Detecting Genome-wide Joint  Association among Low Marginal Effect loci
arXiv:1505.01300, Title: Cats & Co: Categorical Time Series Coclustering
arXiv:1505.01316, Title: Short Report: Study variability in recent human challenge experiments  with Plasmodium falciparum sporozoites (PfSPZ Challenge)
arXiv:1505.01333, Title: Sharper asset ranking from total drawdown durations
arXiv:1505.01371, Title: Re-scale boosting for regression and classification
arXiv:1505.01462, Title: Estimation from Pairwise Comparisons: Sharp Minimax Bounds with Topology  Dependence
arXiv:1505.01539, Title: Graphical Potential Games
arXiv:1505.01547, Title: Understanding the Heavy Tailed Dynamics in Human Behavior
arXiv:1505.01668, Title: Multi-Target Tracking in Distributed Sensor Networks using Particle PHD  Filters
arXiv:1505.01802, Title: Optimal Decision-Theoretic Classification Using Non-Decomposable  Performance Metrics
arXiv:1505.01866, Title: DART: Dropouts meet Multiple Additive Regression Trees
arXiv:1505.02072, Title: Epidemiology of Latency and Relapse in Plasmodium vivax Malaria
arXiv:1505.02206, Title: Learning image representations tied to ego-motion
arXiv:1505.02227, Title: Regularized Decomposition of High-Dimensional Multistage Stochastic  Programs with Markov Uncertainty
arXiv:1505.02250, Title: Newton Sketch: A Linear-time Optimization Algorithm with  Linear-Quadratic Convergence
arXiv:1505.02288, Title: Should we really use post-hoc tests based on mean-ranks?
arXiv:1505.02324, Title: Simultaneous Clustering and Model Selection for Multinomial  Distribution: A Comparative Study
arXiv:1505.02343, Title: Bayesian Sparse Tucker Models for Dimension Reduction and Tensor  Completion
arXiv:1505.02462, Title: Soft-Deep Boltzmann Machines
arXiv:1505.02674, Title: Unbiasedness of some generalized Adaptive Multilevel Splitting  algorithms
arXiv:1505.02729, Title: Sample complexity of learning Mahalanobis distance metrics
arXiv:1505.02867, Title: The Boundary Forest Algorithm for Online Supervised and Unsupervised  Learning
arXiv:1505.02870, Title: Incorporating Type II Error Probabilities from Independence Tests into  Score-Based Learning of Bayesian Network Structure
arXiv:1505.02948, Title: Expanders from Markov bases
arXiv:1505.03018, Title: Rapid mixing and Markov bases
arXiv:1505.03898, Title: Pinball Loss Minimization for One-bit Compressive Sensing: Convex Models  and Algorithms
arXiv:1505.04097, Title: MCODE: Multivariate Conditional Outlier Detection
arXiv:1505.04137, Title: Consistent Algorithms for Multiclass Classification with a Reject Option
arXiv:1505.04195, Title: Stochastic models of evidence accumulation in changing environments
arXiv:1505.04214, Title: Algorithmic Connections Between Active Learning and Stochastic Convex  Optimization
arXiv:1505.04228, Title: Fundamental limits on the accuracy of demographic inference based on the  sample frequency spectrum
arXiv:1505.04252, Title: Global Convergence of Unmodified 3-Block ADMM for a Class of Convex  Minimization Problems
arXiv:1505.04303, Title: Editorial Comment on the Special Issue of "Information in Dynamical  Systems and Complex Systems"
arXiv:1505.04406, Title: Hinge-Loss Markov Random Fields and Probabilistic Soft Logic
arXiv:1505.04627, Title: Simple regret for infinitely many armed bandits
arXiv:1505.04647, Title: Estimation of the directional parameter of the offset exponential and  normal distributions in three-dimensional space using the sample mean
arXiv:1505.04650, Title: Compressed Nonnegative Matrix Factorization is Fast and Accurate
arXiv:1505.04724, Title: A Hybrid Monte-Carlo Sampling Smoother for Four Dimensional Data  Assimilation
arXiv:1505.04778, Title: On the tightness of an SDP relaxation of k-means
arXiv:1505.04824, Title: An Asynchronous Mini-Batch Algorithm for Regularized Stochastic  Optimization
arXiv:1505.04875, Title: Indirect Rate-Distortion Function of a Binary i.i.d Source
arXiv:1505.04935, Title: Towards Data-Driven Autonomics in Data Centers
arXiv:1505.04984, Title: Risk and Regret of Hierarchical Bayesian Learners
arXiv:1505.05114, Title: Solving Random Quadratic Systems of Equations Is Nearly as Easy as  Solving Linear Systems
arXiv:1505.05184, Title: Multi-Objective Optimization of a Port-of-Entry Inspection Policy
arXiv:1505.05216, Title: Convergence Analysis of Policy Iteration
arXiv:1505.05571, Title: Fast exact summation using small and large superaccumulators
arXiv:1505.05572, Title: The development of an information criterion for Change-Point Analysis
arXiv:1505.05644, Title: Modelling the combined effects of land use and climatic changes:  coupling bioclimatic modelling with markov-chain cellular automata in a case  study in Cyprus
arXiv:1505.05663, Title: Inferring Graphs from Cascades: A Sparse Recovery Framework
arXiv:1505.05816, Title: An empirical approach to demographic inference with genomic data
arXiv:1505.06249, Title: Greedy Biomarker Discovery in the Genome with Applications to  Antimicrobial Resistance
arXiv:1505.06292, Title: Low-Rank Matrix Recovery from Row-and-Column Affine Measurements
arXiv:1505.06416, Title: Robust multiuser detection in impulsive channels based on M-estimation  using a new penalty function
arXiv:1505.06536, Title: The maximum likelihood degree of mixtures of independence models
arXiv:1505.06658, Title: PopED lite: an optimal design software for preclinical pharmacokinetic  and pharmacodynamic studies
arXiv:1505.06770, Title: Sketching for Sequential Change-Point Detection
arXiv:1505.06807, Title: MLlib: Machine Learning in Apache Spark
arXiv:1505.06814, Title: Discrete Independent Component Analysis (DICA) with Belief Propagation
arXiv:1505.06915, Title: Large-scale Machine Learning for Metagenomics Sequence Classification
arXiv:1505.06957, Title: Sequential Dimensionality Reduction for Extracting Localized Features
arXiv:1505.06999, Title: Some Open Problems in Optimal AdaBoost and Decision Stumps
arXiv:1505.07027, Title: A Comparison of Limit Setting Methods for the On-Off Problem
arXiv:1505.07170, Title: Sparse multiway decomposition for analysis and modeling of diffusion  imaging and tractography
arXiv:1505.07343, Title: Approximate Joint Diagonalization and Geometric Mean of Symmetric  Positive Definite Matrices
arXiv:1505.07484, Title: Fitting a distribution to Value-at-Risk and Expected Shortfall, with an  application to covered bonds
arXiv:1505.07526, Title: Energy dissipation in an adaptive molecular circuit
arXiv:1505.08098, Title: CURL: Co-trained Unsupervised Representation Learning for Image  Classification
arXiv:1505.08134, Title: SOCP relaxation bounds for the optimal subset selection problem applied  to robust linear regression
arXiv:1505.05116, Title: Data-driven Distributionally Robust Optimization Using the Wasserstein  Metric: Performance Guarantees and Tractable Reformulations
