arXiv:1505.00003, Title: Estimation of connectivity measures in gappy time series
arXiv:1505.00044, Title: Incorporating Contact Network Structure in Cluster Randomized Trials
arXiv:1505.00045, Title: A stochastic system with infinite interacting components to model the  time evolution of the membrane potentials of a population of neurons
arXiv:1505.00202, Title: On the Flatland Paradox
arXiv:1505.00252, Title: A Generalized Empirical Likelihood Approach for Two-Group Comparisons  Given a U-Statistic Constraint
arXiv:1505.00275, Title: Local Orthogonal Polynomial Expansion for Density Estimation
arXiv:1505.00369, Title: Batched bandit problems
arXiv:1505.00379, Title: Approximation and Estimation of s-Concave Densities via Rényi  Divergences
arXiv:1505.00398, Title: Block Basis Factorization for Scalable Kernel Matrix Evaluation
arXiv:1505.00428, Title: A Linear-Time Particle Gibbs Sampler for Infinite Hidden Markov Models
arXiv:1505.00456, Title: A Remark on Baserunning risk: Waiting Can Cost You the Game
arXiv:1505.00475, Title: On the Forecast Combination Puzzle
arXiv:1505.00482, Title: Risk Bounds For Mode Clustering
arXiv:1505.00553, Title: On Regret-Optimal Learning in Decentralized Multi-player Multi-armed  Bandits
arXiv:1505.00675, Title: The Correlated Jacobi and the Correlated Cauchy-Lorentz ensembles
arXiv:1505.00703, Title: Bayesian inference for Gaussian graphical models beyond decomposable  graphs
arXiv:1505.00821, Title: Identifying Cointegration by Eigenanalysis
arXiv:1505.00864, Title: Accurate estimation of influenza epidemics using Google search data via  ARGO
arXiv:1505.00869, Title: On the Feasibility of Distributed Kernel Regression for Big Data
arXiv:1505.00954, Title: Detecting breaks in the dependence of multivariate extreme-value  distributions
arXiv:1505.00991, Title: Support Vector Machines for Current Status Data
arXiv:1505.01147, Title: Prediction and Quantification of Individual Athletic Performance
arXiv:1505.01163, Title: Stationarity as a Path Property with Applications in Time Series  Analysis
arXiv:1505.01164, Title: Achieving a Hyperlocal Housing Price Index: Overcoming Data Sparsity by  Bayesian Dynamical Modeling of Multiple Data Streams
arXiv:1505.01177, Title: Generalized Yule-Walker Estimation for Spatio-Temporal Models with  Unknown Diagonal Coefficients
arXiv:1505.01179, Title: A Generalized Similarity U Test for Multivariate Analysis of Sequencing  Data
arXiv:1505.01204, Title: A Weighted U Statistic for Genetic Association Analyses of Sequencing  Data
arXiv:1505.01243, Title: Half-Spectral Space-Time Covariance Models
arXiv:1505.01247, Title: The Sparse Poisson Means Model
arXiv:1505.01351, Title: The McDonald Gompertz Distribution: Properties and Applications
arXiv:1505.01394, Title: Coherence for Random Fields
arXiv:1505.01434, Title: Particle Gibbs algorithms for Markov jump processes
arXiv:1505.01461, Title: Online Hyperparameter-Free Sparse Estimation Method
arXiv:1505.01582, Title: Consistency of Spectral Hypergraph Partitioning under Planted Partition  Model
arXiv:1505.01583, Title: Identifiability of directed Gaussian graphical models with one latent  source
arXiv:1505.01585, Title: Optimal Estimation of A Quadratic Functional and Detection of  Simultaneous Signals
arXiv:1505.01627, Title: Bayesian Optimization for Synthetic Gene Design
arXiv:1505.01665, Title: Dirichlet Process Hidden Markov Multiple Change-point Model
arXiv:1505.01687, Title: Scaling It Up: Stochastic Search Structure Learning in Graphical Models
arXiv:1505.01743, Title: Adaptive Monotone Shrinkage for Regression
arXiv:1505.01787, Title: Uniform convergence rates over maximal domains in structural  nonparametric cointegrating regression
arXiv:1505.01886, Title: How to reduce the number of rating scale items without predictability  loss?
arXiv:1505.01918, Title: An Asymptotically Optimal Policy for Uniform Bandits of Unknown Support
arXiv:1505.01922, Title: Two-step estimation of ergodic Lévy driven SDE
arXiv:1505.01949, Title: An adaptive Ridge procedure for L0 regularization
arXiv:1505.01957, Title: An unexpected encounter with Cauchy and Lévy
arXiv:1505.01975, Title: The Statistical Analysis of Pairwise Experiments with Qualitative  Responses
arXiv:1505.01979, Title: The efficiency of the likelihood ratio to choose between a  t-distribution and a normal distribution
arXiv:1505.02005, Title: On the occurrence of boundary solutions in two-way incomplete tables
arXiv:1505.02023, Title: Tests for separability in nonparametric covariance operators of random  surfaces
arXiv:1505.02065, Title: Dense Distributions from Sparse Samples: Improved Gibbs Sampling  Parameter Estimators for LDA
arXiv:1505.02077, Title: Estimating the extremal index through local dependence
arXiv:1505.02097, Title: EigenPrism: Inference for High-Dimensional Signal-to-Noise Ratios
arXiv:1505.02114, Title: Adaptive Higher-order Spectral Estimators
arXiv:1505.02118, Title: Causal analysis of ordinal treatments and binary outcomes under  truncation by death
arXiv:1505.02212, Title: Equitability, interval estimation, and statistical power
arXiv:1505.02213, Title: Measuring dependence powerfully and equitably
arXiv:1505.02214, Title: An Empirical Study of Leading Measures of Dependence
arXiv:1505.02294, Title: Estimation with Norm Regularization
arXiv:1505.02350, Title: Exploring multi-dimensional spaces: a Comparison of Latin Hypercube and  Quasi Monte Carlo Sampling Techniques
arXiv:1505.02390, Title: Fluctuations, stability and instability of a distributed particle filter  with local exchange
arXiv:1505.02417, Title: Towards stability and optimality in stochastic gradient descent
arXiv:1505.02434, Title: Spike and Slab Gaussian Process Latent Variable Models
arXiv:1505.02452, Title: Design and interpretation of studies: relevant concepts from the past  and some extensions
arXiv:1505.02456, Title: Graphical Markov models, unifying results and their interpretation
arXiv:1505.02475, Title: Foundational principles for large scale inference: Illustrations through  correlation mining
arXiv:1505.02488, Title: Optimal two-treatment crossover designs for binary response models
arXiv:1505.02556, Title: Extending Bayesian analysis of circular data to comparison of multiple  groups
arXiv:1505.02570, Title: An Asymptotic Linear Representation for the Breslow Estimator
arXiv:1505.02589, Title: Predictions Based on the Clustering of Heterogeneous Functions via Shape  and Subject-Specific Covariates
arXiv:1505.02590, Title: Bayesian binomial mixture models for estimating abundance in ecological  monitoring studies
arXiv:1505.02605, Title: Comment on Article by Dawid and Musio
arXiv:1505.02607, Title: Comment on Article by Dawid and Musio
arXiv:1505.02611, Title: Rejoinder to "Bayesian Model Selection Based on Proper Scoring Rules"
arXiv:1505.02613, Title: Joint Use of Third and Fourth Cumulants in Independent Component  Analysis
arXiv:1505.02689, Title: Refined Stratified Sampling for efficient Monte Carlo based uncertainty  quantification
arXiv:1505.02725, Title: Asymptotic properties of one-step weighted $M$-estimators and  applications to some regression problems
arXiv:1505.02827, Title: On Markov chain Monte Carlo methods for tall data
arXiv:1505.02865, Title: Asymptotic Behavior of Minimal-Exploration Allocation Policies: Almost  Sure, Arbitrarily Slow Growing Regret
arXiv:1505.02886, Title: Modeling county level breast cancer survival data using a  covariate-adjusted frailty proportional hazards model
arXiv:1505.02910, Title: Permutational Rademacher Complexity: a New Complexity Measure for  Transductive Learning
arXiv:1505.02913, Title: Restricted LASSO and Double Shrinking
arXiv:1505.02965, Title: Gaussian Processes: A Quick Introduction
arXiv:1505.03001, Title: Detecting the large entries of a sparse covariance matrix in  sub-quadratic time
arXiv:1505.03030, Title: On the Exact Simulation of (Jump) Diffusion Bridges
arXiv:1505.03036, Title: Removing systematic errors for exoplanet search via latent causes
arXiv:1505.03118, Title: When causation does not imply correlation: robust violations of the  Faithfulness axiom
arXiv:1505.03131, Title: Bayesian Structure Learning for Stationary Time Series
arXiv:1505.03173, Title: Improving Simulated Annealing through Derandomization
arXiv:1505.03220, Title: Limit Theorems for Empirical Rényi Entropy and Divergence with  Applications to Molecular Diversity Analysis
arXiv:1505.03257, Title: Optimal linear estimation under unknown nonlinear transform
arXiv:1505.03339, Title: Bayesian cluster analysis: Point estimation and credible balls
arXiv:1505.03350, Title: Approximate Bayesian Computation by Modelling Summary Statistics in a  Quasi-likelihood Framework
arXiv:1505.03366, Title: Bayesian model selection in logistic regression for the detection of  adverse drug reactions
arXiv:1505.03372, Title: Bayesian Indirect Inference Using a Parametric Auxiliary Model
arXiv:1505.03410, Title: Mind the duality gap: safer rules for the Lasso
arXiv:1505.03431, Title: Asymptotics and statistical inferences on independent and  non-identically distributed bivariate Gaussian triangular arrays
arXiv:1505.03442, Title: Noncrossing Ordinal Classification
arXiv:1505.03451, Title: A general framework for locating hyperplanes to fitting set of points
arXiv:1505.03481, Title: Relations Between Adjacency and Modularity Graph Partitioning
arXiv:1505.03506, Title: Subset Simulation Method for Rare Event Estimation: An Introduction
arXiv:1505.03511, Title: Bootstrapped Adaptive Threshold Selection for Statistical Model  Selection and Estimation
arXiv:1505.03512, Title: Accelerated Gibbs sampling of normal distributions using matrix  splittings and polynomials
arXiv:1505.03609, Title: A Robust Approach for Identifying Gene-Environment Interactions for  Prognosis
arXiv:1505.03659, Title: Uniform Convergence of Multivariate Spectral Density Estimates
arXiv:1505.03762, Title: Dynamic Bivariate Normal Copula
arXiv:1505.03772, Title: Achieving Optimal Misclassification Proportion in Stochastic Block Model
arXiv:1505.03789, Title: Bounds for maximum likelihood regular and non-regular DoA estimation in  $K$-distributed noise
arXiv:1505.03810, Title: Sensitivity Analysis for Multiple Comparisons in Matched Observational  Studies through Quadratically Constrained Linear Programming
arXiv:1505.03906, Title: Training generative neural networks via Maximum Mean Discrepancy  optimization
arXiv:1505.03908, Title: Efficient adaptive MCMC through precision estimation
arXiv:1505.03914, Title: Estimation and Simulation of a COGARCH(p,q) model in the YUIMA project
arXiv:1505.04008, Title: Delete or merge regressors for linear model selection
arXiv:1505.04015, Title: Stochastic Weighted Graphs: Flexible Model Specification and Simulation
arXiv:1505.04066, Title: Prediction of sustained harmonic walking in the free-living environment  using raw accelerometry data
arXiv:1505.04085, Title: Optimal Low-Rank Tensor Recovery from Separable Measurements: Four  Contractions Suffice
arXiv:1505.04215, Title: An Analysis of Active Learning With Uniform Feature Noise
arXiv:1505.04234, Title: Exploiting the Quantile Optimality Ratio to Obtain Better Confidence  Intervals for Quantiles
arXiv:1505.04242, Title: Bayesian inference for higher order ordinary differential equation  models
arXiv:1505.04243, Title: A New Perspective on Boosting in Linear Regression via Subgradient  Optimization and Relatives
arXiv:1505.04302, Title: Change Points via Probabilistically Pruned Objectives
arXiv:1505.04305, Title: Detecting structural breaks in seasonal time series by regularized  optimization
arXiv:1505.04319, Title: Population counts along elliptical habitat contours: hierarchical  modelling using Poisson-lognormal mixtures with nonstationary spatial  structure
arXiv:1505.04321, Title: Sequential Bayesian inference for implicit hidden Markov models and  current limitations
arXiv:1505.04343, Title: Provably Correct Algorithms for Matrix Column Subset Selection with  Selectively Sampled Data
arXiv:1505.04363, Title: Local identifiability of $l_1$-minimization dictionary learning: a  sufficient and almost necessary condition
arXiv:1505.04379, Title: Functional Analysis of Variance for Hilbert-Valued Multivariate Fixed  Effect Models
arXiv:1505.04413, Title: Harmonic Exponential Families on Manifolds
arXiv:1505.04493, Title: Comparing large covariance matrices under weak conditions on the  dependence structure and its application to gene clustering
arXiv:1505.04629, Title: Construction of alternative hypotheses for randomization tests with  ordinal outcomes
arXiv:1505.04630, Title: Recurrent Neural Network Training with Dark Knowledge Transfer
arXiv:1505.04697, Title: Rebar: Reinforcing a Matching Estimator with Predictions from  High-Dimensional Covariates
arXiv:1505.04722, Title: On the statistical properties and tail risk of violent conflicts
arXiv:1505.04732, Title: Layered Adaptive Importance Sampling
arXiv:1505.04768, Title: Statistical unfolding of elementary particle spectra: Empirical Bayes  estimation and bias-corrected uncertainty quantification
arXiv:1505.04780, Title: Towards Faster Rates and Oracle Property for Low-Rank Matrix Estimation
arXiv:1505.04827, Title: Semi-Markov Arnason-Schwarz models
arXiv:1505.04844, Title: Gini index and angle measure as special cases of a wider family of  measurements
arXiv:1505.04883, Title: A Hierarchical Framework for State Space Matrix Inference and Clustering
arXiv:1505.04898, Title: Heterogeneous Change Point Inference
arXiv:1505.04966, Title: Multi-task additive models with shared transfer functions based on  dictionary learning
arXiv:1505.04983, Title: Posterior propriety in Bayesian extreme value analyses using reference  priors
arXiv:1505.05004, Title: An Experimental Comparison of Hybrid Algorithms for Bayesian Network  Structure Learning
arXiv:1505.05007, Title: Modelling-based experiment retrieval: A case study with gene expression  clustering
arXiv:1505.05068, Title: Meta-analysis of mid-p-values: some new results based on the convex  order
arXiv:1505.05093, Title: Programming with models: writing statistical algorithms for general  model structures with NIMBLE
arXiv:1505.05117, Title: Vector-Space Markov Random Fields via Exponential Families
arXiv:1505.05189, Title: Tail fitting for truncated and non-truncated Pareto-type distributions
arXiv:1505.05208, Title: oASIS: Adaptive Column Sampling for Kernel Matrix Approximation
arXiv:1505.05229, Title: Variable subset selection via GA and information complexity in mixtures  of Poisson and negative binomial regression models
arXiv:1505.05235, Title: Random Consolidations and Fragmentations Cycles Lead to Benford
arXiv:1505.05257, Title: Sparse and Robust Linear Regression: An Optimization Algorithm and Its  Statistical Properties
arXiv:1505.05266, Title: Equivalence of dose response curves
arXiv:1505.05272, Title: Identifiability for Blind Source Separation of Multiple Finite Alphabet  Linear Mixtures
arXiv:1505.05290, Title: Sparsest Error Detection via Sparsity Invariant Transformation based  $\ell_1$ Minimization
arXiv:1505.05310, Title: Supervised Learning for Dynamical System Learning
arXiv:1505.05314, Title: Cross-calibration of probabilistic forecasts
arXiv:1505.05385, Title: The extremogram and the cross-extremogram for a bivariate GARCH(1,1)  process
arXiv:1505.05391, Title: Efficient Multiple Importance Sampling Estimators
arXiv:1505.05424, Title: Weight Uncertainty in Neural Networks
arXiv:1505.05461, Title: Network driven sampling; a critical threshold for design effects
arXiv:1505.05466, Title: Bayesian Estimation of the Kumaraswamy Inverse Weibull Distribution
arXiv:1505.05482, Title: TPRM: Tensor partition regression models with applications in imaging  biomarker detection
arXiv:1505.05557, Title: Improved Component Predictions of Batting Measures
arXiv:1505.05561, Title: Why Regularized Auto-Encoders learn Sparse Representation?
arXiv:1505.05629, Title: Regulating Greed Over Time
arXiv:1505.05639, Title: Analysis of the most important variables which determine innovation  among rural entrepreneurs
arXiv:1505.05654, Title: Slope heuristics and V-Fold model selection in heteroscedastic  regression using strongly localized bases
arXiv:1505.05660, Title: A factor model approach for the joint segmentation with between-series  correlation
arXiv:1505.05668, Title: Locally Adaptive Dynamic Networks
arXiv:1505.05687, Title: Optimally estimating the sample mean from the sample size, median,  mid-range and/or mid-quartile range
arXiv:1505.05691, Title: Tests for high dimensional data based on means, spatial signs and  spatial ranks
arXiv:1505.05705, Title: A model for gene deregulation detection using expression data
arXiv:1505.05770, Title: Variational Inference with Normalizing Flows
arXiv:1505.05901, Title: Randomized Robust Subspace Recovery for High Dimensional Data Matrices
arXiv:1505.05917, Title: Decentralized Sequential Composite Hypothesis Test Based on One-Bit  Communication
arXiv:1505.06101, Title: Hypothesis testing for markovian models with random time observations
arXiv:1505.06129, Title: A Distribution Free Unitary Events Method based on Delayed Coincidence  Count
arXiv:1505.06188, Title: A spatiotemporal analysis of participatory sensing data "tweets" and  extreme climate events toward real-time urban risk management
arXiv:1505.06275, Title: Spatiotemporal Modeling of Node Temperatures in Supercomputers
arXiv:1505.06279, Title: The Benefit of Multitask Representation Learning
arXiv:1505.06298, Title: Learning the dependence structure of rare events: a non-asymptotic study
arXiv:1505.06318, Title: Approximate maximum likelihood estimation using data-cloning ABC
arXiv:1505.06354, Title: Online Updating of Statistical Inference in the Big Data Setting
arXiv:1505.06356, Title: Particle ancestor sampling for near-degenerate or intractable state  transition models
arXiv:1505.06357, Title: Rao-Blackwellized particle smoothers for conditionally linear Gaussian  models
arXiv:1505.06417, Title: Bayesian prediction of minimal repair times of a series system based on  hybrid censored sample of components' lifetimes under Rayleigh distribution
arXiv:1505.06443, Title: Detecting bird sound in unknown acoustic background using crowdsourced  training data
arXiv:1505.06448, Title: Adaptive importance sampling via minimization of estimators of  cross-entropy, mean square, and inefficiency constant
arXiv:1505.06472, Title: Partial Information Framework: Model-Based Aggregation of Estimates from  Diverse Information Sources
arXiv:1505.06473, Title: Three discussions of the paper "sequential quasi-Monte Carlo sampling",  by M. Gerber and N. Chopin
arXiv:1505.06475, Title: A Fast and Flexible Algorithm for the Graph-Fused Lasso
arXiv:1505.06478, Title: Tight Continuous Relaxation of the Balanced $k$-Cut Problem
arXiv:1505.06483, Title: On Nonparametric Inference in the Regression Discontinuity Design
arXiv:1505.06485, Title: Constrained 1-Spectral Clustering
arXiv:1505.06538, Title: Clustering via Content-Augmented Stochastic Blockmodels
arXiv:1505.06549, Title: Familywise Error Rate Control via Knockoffs
arXiv:1505.06614, Title: Electre Tri-Machine Learning Approach to the Record Linkage Problem
arXiv:1505.06644, Title: Optimal Two-Sided Tests for Instrumental Variables Regression with  Heteroskedastic and Autocorrelated Errors
arXiv:1505.06659, Title: Statistical and Algorithmic Perspectives on Randomized Sketching for  Ordinary Least-Squares -- ICML
arXiv:1505.06723, Title: Stochastic Annealing for Variational Inference
arXiv:1505.06794, Title: Optimal Bayesian estimation in stochastic block models
arXiv:1505.06812, Title: Optimizing Non-decomposable Performance Measures: A Tale of Two Classes
arXiv:1505.06813, Title: Surrogate Functions for Maximizing Precision at the Top
arXiv:1505.06832, Title: Searching Multiregression Dynamic Models of Resting-State fMRI Networks  Using Integer Programming
arXiv:1505.06891, Title: Model-Based Geostatistics for Prevalence Mapping in Low-Resource  Settings
arXiv:1505.06925, Title: On weighted measure of inaccuracy for doubly truncated random variables
arXiv:1505.06954, Title: A Geometric Approach to Pairwise Bayesian Alignment of Functional Data  Using Importance Sampling
arXiv:1505.06966, Title: Bootstrap based uncertainty bands for prediction in functional kriging
arXiv:1505.07008, Title: An Overview of the Asymptotic Performance of the Family of the FastICA  Algorithms
arXiv:1505.07067, Title: Belief Flows of Robust Online Learning
arXiv:1505.07072, Title: A Moreau-Yosida approximation scheme for a class of high-dimensional  posterior distributions
arXiv:1505.07082, Title: Multi-Opponent James Functions
arXiv:1505.07087, Title: Propagation of Uncertainty in Risk Analysis and Safety Integrity Level  Composition
arXiv:1505.07178, Title: A note on the strong consistency of M-estimates in linear models
arXiv:1505.07201, Title: A Heuristic Reference Recursive Recipe for the Menacing Problem of  Adaptively Tuning the Kalman Filter Statistics. Part-1. Formulation and  Simulation Studies
arXiv:1505.07208, Title: A Heuristic Reference Recursive Recipe for the Menacing Problem of  Adaptively Tuning the Kalman Filter Statistics. Part-2. Real Data Studies
arXiv:1505.07215, Title: Modelling aggregation on the large scale and regularity on the small  scale in spatial point pattern datasets
arXiv:1505.07228, Title: Graph_sampler: a simple tool for fully Bayesian analyses of DAG-models
arXiv:1505.07260, Title: Bootstrap for U-Statistics: A new approach
arXiv:1505.07281, Title: Beyond Support in Two-Stage Variable Selection
arXiv:1505.07345, Title: Some asymptotic results for the integrated empirical process with  applications to statistical tests
arXiv:1505.07352, Title: Accumulation tests for FDR control in ordered hypothesis testing
arXiv:1505.07369, Title: Heteroscedastic Nested Error Regression Models with Variance Functions
arXiv:1505.07414, Title: Sufficient Forecasting Using Factor Models
arXiv:1505.07415, Title: Two-dimensional Kolmogorov-type Goodness-of-fit Tests Based on  Characterizations and their Asymptotic Efficiencies
arXiv:1505.07517, Title: Within Group Variable Selection through the Exclusive Lasso
arXiv:1505.07519, Title: A Bounded $p$-norm Approximation of Max-Convolution for Sub-Quadratic  Bayesian Inference on Additive Factors
arXiv:1505.07541, Title: Bayesian Endogenous Tobit Quantile Regression
arXiv:1505.07602, Title: Rates of convergence for robust geometric inference
arXiv:1505.07607, Title: Improved minimax estimation of a multivariate normal mean under  heteroscedasticity
arXiv:1505.07649, Title: A trust-region method for stochastic variational inference with  applications to streaming data
arXiv:1505.07661, Title: Reactive point processes: A new approach to predicting power failures in  underground electrical systems
arXiv:1505.07684, Title: The Extreme Risk of Personal Data Breaches & The Erosion of Privacy
arXiv:1505.07710, Title: Bayesian Trend Filtering
arXiv:1505.07752, Title: The Impact of Estimation: A New Method for Clustering and Trajectory  Estimation in Patient Flow Modeling
arXiv:1505.07765, Title: Automatic Relevance Determination For Deep Generative Models
arXiv:1505.07798, Title: Bayesian Spectral Modeling of Microscale Spatial Distributions in a  Multivariate Soil Matrix
arXiv:1505.07818, Title: Domain-Adversarial Training of Neural Networks
arXiv:1505.07915, Title: Estimation of the parameter of a dynamically selected population for two  subclasses of the exponential family
arXiv:1505.07917, Title: Oracally Efficient Estimation of Functional-Coefficient Autoregressive  Models
arXiv:1505.07925, Title: On the Computational Complexity of High-Dimensional Bayesian Variable  Selection
arXiv:1505.07981, Title: Limits of Kalman Filter application in heavy tailed problems
arXiv:1505.08000, Title: The Pointillist Family of Multitarget Tracking Filters
arXiv:1505.08049, Title: Sensing tensors with Gaussian filters
arXiv:1505.08052, Title: Batch Bayesian Optimization via Local Penalization
arXiv:1505.08113, Title: A tractable, parsimonious and flexible model for cylindrical data, with  applications
arXiv:1505.08116, Title: MIMCA: Multiple imputation for categorical variables with multiple  correspondence analysis
arXiv:1505.08120, Title: Alternative Asymptotics and the Partially Linear Model with Many  Regressors
arXiv:1505.08171, Title: An integrative statistical model for inferring strain admixture within  clinical Plasmodium falciparum isolates
arXiv:1505.00055, Title: Chess players' fame versus their merit
arXiv:1505.00115, Title: Do they agree? Bibliometric evaluation vs informed peer review in the  Italian research assessment exercise
arXiv:1505.00261, Title: Strongly Intensive Cumulants: Fluctuation Measures for Systems With  Incompletely Constrained Volumes
arXiv:1505.00274, Title: Stick-Breaking Policy Learning in Dec-POMDPs
arXiv:1505.00294, Title: Monotonous (Semi-)Nonnegative Matrix Factorization
arXiv:1505.00314, Title: Deconstructing Principal Component Analysis Using a Data Reconciliation  Perspective
arXiv:1505.00401, Title: Visualization of Tradeoff in Evaluation: from Precision-Recall & PN to  LIFT, ROC & BIRD
arXiv:1505.00477, Title: Kernel Spectral Clustering and applications
arXiv:1505.00526, Title: An Explicit Sampling Dependent Spectral Error Bound for Column Subset  Selection
arXiv:1505.00562, Title: Approximation of Capacity for ISI Channels with One-bit Output  Quantization
arXiv:1505.00579, Title: Comparison of hit-and-run, slice sampling and random walk Metropolis
arXiv:1505.00662, Title: Optimal Learning via the Fourier Transform for Sums of Independent  Integer Random Variables
arXiv:1505.00824, Title: Self-Expressive Decompositions for Matrix Approximation and Clustering
