arXiv:1604.00772, Title: The CMA Evolution Strategy: A Tutorial
arXiv:1604.00889, Title: Variable length trajectory compressible hybrid Monte Carlo
arXiv:1604.00974, Title: Writer-independent Feature Learning for Offline Signature Verification  using Deep Convolutional Neural Networks
arXiv:1604.01067, Title: Sparse matrices for weighted sparse recovery
arXiv:1604.01105, Title: Distinguishing between Personal Preferences and Social Influence in  Online Activity Feeds
arXiv:1604.01219, Title: Learning to Generate Posters of Scientific Papers
arXiv:1604.01272, Title: Feature extraction using Latent Dirichlet Allocation and Neural  Networks: A case study on movie synopses
arXiv:1604.01316, Title: On normal approximations for the two-sample problem on multidimensional  tori
arXiv:1604.01433, Title: Collaborative Information Bottleneck
arXiv:1604.01446, Title: Quantifying Distributional Model Risk via Optimal Transport
arXiv:1604.01544, Title: Day of the week effect in paper submission/acceptance/rejection to/in/by  peer review journals
arXiv:1604.01575, Title: Clustering implies geometry in networks
arXiv:1604.01952, Title: Deep Online Convex Optimization with Gated Games
arXiv:1604.01999, Title: Online Optimization of Smoothed Piecewise Constant Functions
arXiv:1604.02027, Title: Combinatorial Topic Models using Small-Variance Asymptotics
arXiv:1604.02275, Title: Online Open World Recognition
arXiv:1604.02492, Title: Challenges in Bayesian Adaptive Data Analysis
arXiv:1604.02575, Title: Well-posed Bayesian Inverse Problems: Priors with Exponential Tails
arXiv:1604.02606, Title: A General Retraining Framework for Scalable Adversarial Classification
arXiv:1604.02737, Title: Correlated Equilibria for Approximate Variational Inference in MRFs
arXiv:1604.02883, Title: Analysing health professionals' learning interactions in online social  networks: A social network analysis approach
arXiv:1604.03006, Title: Demystifying Fixed k-Nearest Neighbor Information Estimators
arXiv:1604.03019, Title: EEG in the classroom: Synchronised neural recordings during video  presentation
arXiv:1604.03114, Title: Conversational flow in Oxford-style debates
arXiv:1604.03159, Title: Phase Transitions and a Model Order Selection Criterion for Spectral  Graph Clustering
arXiv:1604.03227, Title: Recurrent Attentional Networks for Saliency Detection
arXiv:1604.03248, Title: The Univariate Flagging Algorithm (UFA): a Fully-Automated Approach for  Identifying Optimal Thresholds in Data
arXiv:1604.03257, Title: Unified Convergence Analysis of Stochastic Momentum Methods for Convex  and Non-convex Optimization
arXiv:1604.03343, Title: Loss Bounds and Time Complexity for Speed Priors
arXiv:1604.03345, Title: Stability of the optimal filter in continuous time: Beyond the beneš  filter
arXiv:1604.03427, Title: In the mood: the dynamics of collective sentiments on Twitter
arXiv:1604.03601, Title: Community Detection with Node Attributes and its Generalization
arXiv:1604.03736, Title: A Differentiable Transition Between Additive and Multiplicative Neurons
arXiv:1604.03744, Title: Variational Bayesian Inference of Line Spectra
arXiv:1604.03853, Title: Hierarchical Compound Poisson Factorization
arXiv:1604.03887, Title: Algorithms for stochastic optimization with expectation constraints
arXiv:1604.03912, Title: Inverse Reinforcement Learning with Simultaneous Estimation of Rewards  and Dynamics
arXiv:1604.03930, Title: Efficient Algorithms for Large-scale Generalized Eigenvector Computation  and Canonical Correlation Analysis
arXiv:1604.03993, Title: Consistency of modularity clustering on random geometric graphs
arXiv:1604.04013, Title: Ergodic Theory for Controlled Markov Chains with Stationary Inputs
arXiv:1604.04182, Title: Consistently Estimating Markov Chains with Noisy Aggregate Data
arXiv:1604.04280, Title: Variational inference for rare variant detection in deep, heterogeneous  next-generation sequencing data
arXiv:1604.04348, Title: Positive Definite Estimation of Large Covariance Matrix Using  Generalized Nonconvex Penalties
arXiv:1604.04434, Title: Bayesian linear regression with Student-t assumptions
arXiv:1604.04451, Title: Delta divergence: A novel decision cognizant measure of classifier  incongruence
arXiv:1604.04484, Title: Enabling Privacy-Preserving GWAS in Heterogeneous Human Populations
arXiv:1604.04562, Title: A Network-based End-to-End Trainable Task-oriented Dialogue System
arXiv:1604.04615, Title: On deterministic conditions for subspace clustering under missing data
arXiv:1604.04661, Title: Parallelizing Word2Vec in Shared and Distributed Memory
arXiv:1604.04706, Title: DS-MLR: Exploiting Double Separability for Scaling up Distributed  Multinomial Logistic Regression
arXiv:1604.04834, Title: Probabilistic Receiver Architecture Combining BP, MF, and EP for  Multi-Signal Detection
arXiv:1604.04967, Title: On recovering missing values for sequences in a pathwise setting
arXiv:1604.05129, Title: Memory shapes time perception and intertemporal choices
arXiv:1604.05180, Title: Cryptographically secure multiparty evaluation of system reliability
arXiv:1604.05198, Title: Locally Imposing Function for Generalized Constraint Neural Networks - A  Study on Equality Constraints
arXiv:1604.05307, Title: Learning Sparse Additive Models with Interactions in High Dimensions
arXiv:1604.05364, Title: Species tree inference from gene splits by Unrooted STAR methods
arXiv:1604.05417, Title: Triplet Probabilistic Embedding for Face Verification and Clustering
arXiv:1604.05453, Title: An entropic characterization of long memory stationary process
arXiv:1604.05878, Title: A Factorization Machine Framework for Testing Bigram Embeddings in  Knowledgebase Completion
arXiv:1604.06057, Title: Hierarchical Deep Reinforcement Learning: Integrating Temporal  Abstraction and Intrinsic Motivation
arXiv:1604.06132, Title: Optimal timing of cross-sectional network samples in longitudinal  network studies
arXiv:1604.06443, Title: Robust Estimators in High Dimensions without the Computational  Intractability
arXiv:1604.06626, Title: The Mean Partition Theorem of Consensus Clustering
arXiv:1604.06664, Title: Optimal scaling of the Random Walk Metropolis algorithm under Lp mean  differentiability
arXiv:1604.06730, Title: Developing an ICU scoring system with interaction terms using a genetic  algorithm
arXiv:1604.06952, Title: Visualization of Jacques Lacan's Registers of the Psychoanalytic Field,  and Discovery of Metaphor and of Metonymy. Analytical Case Study of Edgar  Allan Poe's "The Purloined Letter"
arXiv:1604.06968, Title: Agnostic Estimation of Mean and Covariance
arXiv:1604.06980, Title: On exact and optimal recovering of missing values for sequences
arXiv:1604.07070, Title: Stochastic Variance-Reduced ADMM
arXiv:1604.07088, Title: Effect of User Mobility on the Performance of Device-to-Device Networks  with Distributed Caching
arXiv:1604.07093, Title: Semi-supervised Vocabulary-informed Learning
arXiv:1604.07101, Title: Double Thompson Sampling for Dueling Bandits
arXiv:1604.07178, Title: Weighted Spectral Cluster Ensemble
arXiv:1604.07281, Title: Phase Retrieval Without Small-Ball Probability Assumptions
arXiv:1604.07391, Title: Ubiquity of Benfords law and emergence of the reciprocal distribution
arXiv:1604.07407, Title: Conversational Markers of Constructive Discussions
arXiv:1604.07484, Title: Deep Multi-fidelity Gaussian Processes
arXiv:1604.07554, Title: A New Approach in Persian Handwritten Letters Recognition Using Error  Correcting Output Coding
arXiv:1604.07706, Title: Distributed Clustering of Linear Bandits in Peer to Peer Networks
arXiv:1604.07796, Title: Scale Normalization
arXiv:1604.07878, Title: Evaluating the effect of topic consideration in identifying communities  of rating-based social networks
arXiv:1604.07928, Title: Distributed Flexible Nonlinear Tensor Factorization
arXiv:1604.08045, Title: Estimating psychopathological networks: be careful what you wish for
arXiv:1604.08079, Title: UBL: an R package for Utility-based Learning
arXiv:1604.08153, Title: Classifying Options for Deep Reinforcement Learning
arXiv:1604.08201, Title: Interpretable Deep Neural Networks for Single-Trial EEG Classification
arXiv:1604.08616, Title: Black-box optimization on Hyper-rectangle using Recursive Modified  Pattern Search and Application to Matrix Completion Problem with Non-convex  Regularization
arXiv:1604.08636, Title: Derivative-free Efficient Global Optimization on High-dimensional  Simplex
arXiv:1604.08692, Title: Optimal data recovery and forecasting with dummy long-horizon forecasts
arXiv:1604.08716, Title: Learning Compact Structural Representations for Audio Events Using  Regressor Banks
arXiv:1604.08859, Title: The Z-loss: a shift and scale invariant classification loss belonging to  the Spherical Family
arXiv:1604.08880, Title: Deep, Convolutional, and Recurrent Models for Human Activity Recognition  using Wearables
arXiv:1604.02218, Title: A Low Complexity Algorithm with $O(\sqrt{T})$ Regret and Finite  Constraint Violations for Online Convex Optimization with Long Term  Constraints
arXiv:1604.00268, Title: The deterministic information bottleneck
arXiv:1604.00268, Title: The deterministic information bottleneck
arXiv:1604.06518, Title: Approximation Vector Machines for Large-scale Online Learning
arXiv:1604.03763, Title: A General Distributed Dual Coordinate Optimization Framework for  Regularized Loss Minimization
arXiv:1604.07990, Title: Probabilistic Graphical Models on Multi-Core CPUs using Java 8
