arXiv:1604.00039, Title: Pointwise Adaptive Estimation of the MarginalDensity of a Weakly  Dependent Process
arXiv:1604.00051, Title: A marked renewal process model for the size of a honey bee colony
arXiv:1604.00059, Title: Spatial Clustering of Curves with Functional Covariates: A Bayesian  Partitioning Model with Application to Spectra Radiance in Climate Study
arXiv:1604.00082, Title: A track-before-detect labelled multi-Bernoulli particle filter with  label switching
arXiv:1604.00169, Title: A sequential Monte Carlo approach to Thompson sampling for Bayesian  optimization
arXiv:1604.00306, Title: Parameter recovery in two-component contamination mixtures: the  $\mathbb{L}^2$ strategy
arXiv:1604.00314, Title: On choosing mixture components via non-local priors
arXiv:1604.00362, Title: Fast and exact simulation of complex-valued stationary Gaussian  processes through embedding circulant matrix
arXiv:1604.00376, Title: Inferring network structure in non-normal and mixed discrete-continuous  genomic data
arXiv:1604.00419, Title: Estimating the interaction graph of stochastic neural dynamics
arXiv:1604.00447, Title: Ordering-Free Inference from Locally Dependent Data
arXiv:1604.00539, Title: Non-asymptotic results for Cornish--Fisher expansions
arXiv:1604.00540, Title: Nonparametric Conditional Density Estimation in a High-Dimensional  Regression Setting
arXiv:1604.00561, Title: On the Conditional Distribution of the Multivariate $t$ Distribution
arXiv:1604.00570, Title: Online EM for Functional Data
arXiv:1604.00572, Title: Spatio-temporal Modelling of Temperature Fields in the Pacific Northwest
arXiv:1604.00627, Title: Handling missing data in large healthcare dataset: a case study of  unknown trauma outcomes
arXiv:1604.00647, Title: Multi-Relational Learning at Scale with ADMM
arXiv:1604.00685, Title: A constructive definition of the beta process
arXiv:1604.00695, Title: Diagnosing Suboptimal Cotangent Disintegrations in Hamiltonian Monte  Carlo
arXiv:1604.00698, Title: Asymptotic Theory of Rerandomization in Treatment-Control Experiments
arXiv:1604.00823, Title: SINOMA - A new approach for estimating linear relationships between  noisy serial data streams
arXiv:1604.00860, Title: Bayesian Computing with INLA: A Review
arXiv:1604.00872, Title: Geometrically Tempered Hamiltonian Monte Carlo
arXiv:1604.00912, Title: A multivariate nonlinear mixed effects model for longitudinal image  analysis: Application to amyloid imaging
arXiv:1604.00954, Title: Inference on the tail process with application to financial time series  modelling
arXiv:1604.01055, Title: Towards personalized causal inference of medication response in mobile  health: an instrumental variable approach for randomized trials with  imperfect compliance
arXiv:1604.01064, Title: Bayesian Local Extrema Splines
arXiv:1604.01075, Title: A Dynamic Bayesian Network Model for Inventory Level Estimation in  Retail Marketing
arXiv:1604.01120, Title: Unbiased Monte Carlo estimation for the expected value of partial  perfect information
arXiv:1604.01171, Title: Sparse Recovery from Extreme Eigenvalues Deviation Inequalities
arXiv:1604.01191, Title: Functional mixed effects wavelet estimation for spectra of replicated  time series
arXiv:1604.01210, Title: NEAT: an efficient network enrichment analysis test
arXiv:1604.01233, Title: Construction of Simultaneous Confidence Bands for Multiple Logistic  Regression Models over Restricted Regions
arXiv:1604.01242, Title: Confidence Bands for the Logistic and Probit Regression Models Over  Intervals
arXiv:1604.01250, Title: Fast methods for training Gaussian processes on large data sets
arXiv:1604.01268, Title: Bayesian Estimation of the Threshold of a Generalised Pareto  Distribution for Heavy-Tailed Observations
arXiv:1604.01339, Title: Photo-z Estimation: An Example of Nonparametric Conditional Density  Estimation under Selection Bias
arXiv:1604.01348, Title: Bayesian Optimization with Exponential Convergence
arXiv:1604.01351, Title: Nonparametric Detection of Geometric Structures over Networks
arXiv:1604.01443, Title: Analysis of distributional variation through multi-scale Beta-Binomial  modeling
arXiv:1604.01455, Title: Picking Winners Using Integer Programming
arXiv:1604.01472, Title: Conjugate Processes: Theory and Application to Risk Forecasting
arXiv:1604.01515, Title: Comments on: "A Random Forest Guided Tour" by G. Biau and E. Scornet
arXiv:1604.01541, Title: An Alternative Discrete Skew Logistic Distribution
arXiv:1604.01597, Title: Estimating the treatment effect on the treated under time-dependent  confounding in an application to the Swiss HIV Cohort Study
arXiv:1604.01602, Title: Manifold unwrapping using density ridges
arXiv:1604.01617, Title: BPEC: An R Package for Bayesian Phylogeographic and Ecological  Clustering
arXiv:1604.01662, Title: Towards Bayesian Deep Learning: A Survey
arXiv:1604.01715, Title: A phylogenetic latent feature model for clonal deconvolution
arXiv:1604.01733, Title: A U-statistic Approach to Hypothesis Testing for Structure Discovery in  Undirected Graphical Models
arXiv:1604.01785, Title: Safe Probability
arXiv:1604.01844, Title: Statistical sensitiveness for science
arXiv:1604.01854, Title: Building Ensembles of Adaptive Nested Dichotomies with Random-Pair  Selection
arXiv:1604.01871, Title: When is Nontrivial Estimation Possible for Graphons and Stochastic Block  Models?
arXiv:1604.01874, Title: A projection-based adaptive-to-model test for regressions
arXiv:1604.01919, Title: Robust Modeling Using Non-Elliptically Contoured Multivariate t  Distributions
arXiv:1604.01955, Title: Monitoring Chinese Population Migration in Consecutive Weekly Basis from  Intra-city scale to Inter-province scale by Didi's Bigdata
arXiv:1604.01972, Title: An Adaptive Resample-Move Algorithm for Estimating Normalizing Constants
arXiv:1604.01983, Title: A Property of the Kullback--Leibler Divergence for Location-scale Models
arXiv:1604.01984, Title: Automated Selection of r for the r Largest Order Statistics Approach  with Adjustment for Sequential Testing
arXiv:1604.01992, Title: Adaptive non-parametric instrumental regression in the presence of  dependence
arXiv:1604.01996, Title: CopulaDTA: An R Package for Copula Based Bivariate Beta-Binomial Models  for Diagnostic Test Accuracy Studies in a Bayesian Framework
arXiv:1604.02018, Title: ANOVA model for network meta-analysis of diagnostic test accuracy data
arXiv:1604.02024, Title: Automated Threshold Selection for Extreme Value Analysis via  Goodness-of-Fit Tests with Application to Batched Return Level Mapping
arXiv:1604.02051, Title: Tracking Changes in Resilience and Level of Coordination in Terrorist  Groups
arXiv:1604.02100, Title: Hankel Matrix Nuclear Norm Regularized Tensor Completion for  $N$-dimensional Exponential Signals
arXiv:1604.02123, Title: Multilevel Weighted Support Vector Machine for Classification on  Healthcare Data with Missing Values
arXiv:1604.02130, Title: Quantile Processes for Semi and Nonparametric Regression
arXiv:1604.02158, Title: Structured Correlation Detection with Application to Colocalization  Analysis in Dual-Channel Fluorescence Microscopic Imaging
arXiv:1604.02181, Title: A Unified Framework for Sparse Non-Negative Least Squares using  Multiplicative Updates and the Non-Negative Matrix Factorization Problem
arXiv:1604.02221, Title: Box-Cox symmetric distributions and applications to nutritional data
arXiv:1604.02302, Title: Non-parametric indices of dependence between components for  inhomogeneous multivariate random measures and marked sets
arXiv:1604.02309, Title: Inference in partially identified models with many moment inequalities  using Lasso
arXiv:1604.02318, Title: Bayesian Smooth-and-Match strategy for ordinary differential equations  models that are linear in the parameters
arXiv:1604.02335, Title: Liu-type Negative Binomial Regression: A Comparison of Recent Estimators  and Applications
arXiv:1604.02390, Title: Minimax Optimal Procedures for Locally Private Estimation
arXiv:1604.02573, Title: The Empirical Likelihood Approach to Quantifying Uncertainty in Sample  Average Approximation
arXiv:1604.02576, Title: Hypothesis Testing via Affine Detectors
arXiv:1604.02598, Title: Species richness estimation with high diversity but spurious singletons
arXiv:1604.02631, Title: Grid Based Nonlinear Filtering Revisited: Recursive Estimation &  Asymptotic Optimality
arXiv:1604.02634, Title: Online Nonnegative Matrix Factorization with Outliers
arXiv:1604.02642, Title: Program Evaluation with Right-Censored Data
arXiv:1604.02652, Title: Hypergraphs in the characterization of regular vine copula structures
arXiv:1604.02668, Title: Distance for Functional Data Clustering Based on Smoothing Parameter  Commutation
arXiv:1604.02702, Title: Identifying the Spectral Representation of Hilbertian Time Series
arXiv:1604.02724, Title: A plug-in bandwidth selection procedure for long run covariance  estimation with stationary functional time series
arXiv:1604.02736, Title: Generalized R-squared for Detecting Dependence
arXiv:1604.02855, Title: Active Learning for Online Recognition of Human Activities from  Streaming Videos
arXiv:1604.02917, Title: Gaussian Process Domain Experts for Model Adaptation in Facial Behavior  Analysis
arXiv:1604.02928, Title: Equivariant adjusted least squares estimator in two-line fitting model
arXiv:1604.03053, Title: Variational Latent Gaussian Process for Recovering Single-Trial Dynamics  from Population Spike Trains
arXiv:1604.03186, Title: Estimating an NBA player's impact on his team's chances of winning
arXiv:1604.03192, Title: Scalar-on-Image Regression via the Soft-Thresholded Gaussian Process
arXiv:1604.03269, Title: On the connection between cherry-tree copulas and truncated R-vine  copulas
arXiv:1604.03278, Title: Confidence Decision Trees via Online and Active Learning for Streaming  (BIG) Data
arXiv:1604.03325, Title: Using Extreme Value Theory for Determining the Probability of  Carrington-Like Solar Flares
arXiv:1604.03373, Title: A Convex Surrogate Operator for General Non-Modular Loss Functions
arXiv:1604.03392, Title: A statistical learning strategy for closed-loop control of fluid flows
arXiv:1604.03463, Title: The Matrix Generalized Inverse Gaussian Distribution: Properties and  Applications
arXiv:1604.03480, Title: Optimal Experimental Designs for Estimating Henry's Law Constants via  the Method of Phase Ratio Variation
arXiv:1604.03492, Title: Structured Matrix Recovery via the Generalized Dantzig Selector
arXiv:1604.03558, Title: Error Propagation Through a Network With Non-Uniform Failure
arXiv:1604.03611, Title: Sequential change-point detection based on nearest neighbors
arXiv:1604.03614, Title: The Market for English Premier League (EPL) Odds
arXiv:1604.03615, Title: A Nonparametric Bayesian Technique for High-Dimensional Regression
arXiv:1604.03622, Title: Kronecker STAP and SAR GMTI
arXiv:1604.03638, Title: On the inference about the spectral distribution of high-dimensional  covariance matrix based on high-frequency noisy observations
arXiv:1604.03647, Title: Modeling Inter-Country Connection from Geotagged News Reports: A  Time-Series Analysis
arXiv:1604.03648, Title: Robust regression for optimal individualized treatment rules
arXiv:1604.03742, Title: Asymptotic Optimality of Multiple Hypothesis Testing Procedure in  Equi-correlated Set-up
arXiv:1604.03776, Title: Detecting a Structural Change in Functional Time Series Using Local  Wilcoxon Statistic
arXiv:1604.03802, Title: Robust designs to model uncertainty with high estimation and prediction  efficiency
arXiv:1604.04002, Title: Sparse transition matrix estimation for high-dimensional and locally  stationary vector autoregressive models
arXiv:1604.04054, Title: Optimal Rates For Regularization Of Statistical Inverse Learning  Problems
arXiv:1604.04173, Title: Distribution-Free Predictive Inference For Regression
arXiv:1604.04191, Title: 1-bit Matrix Completion: PAC-Bayesian Analysis of a Variational  Approximation
arXiv:1604.04198, Title: Estimating parameters of nonlinear systems using the elitist particle  filter based on evolutionary strategies
arXiv:1604.04202, Title: Representing sparse Gaussian DAGs as sparse R-vines allowing for  non-Gaussian dependence
arXiv:1604.04211, Title: A comparison of functional summary statistics to detect anisotropy of  three-dimensional point patterns
arXiv:1604.04235, Title: A Sampling Strategy for Projecting to Permutations in the Graph Matching  Problem
arXiv:1604.04242, Title: Consistency Bands for divergences measures
arXiv:1604.04264, Title: A semiparametric mixture method for local false discovery rate  estimation
arXiv:1604.04318, Title: Principal Sub-manifolds
arXiv:1604.04322, Title: Diversion Detection in Partially Observed Nuclear Fuel Cycle Networks
arXiv:1604.04405, Title: Multiscale inference for a multivariate density with applications to  X-ray astronomy
arXiv:1604.04478, Title: Computer model calibration with large non-stationary spatial outputs:  application to the calibration of a climate model
arXiv:1604.04505, Title: A short note on extension theorems and their connection to universal  consistency in machine learning
arXiv:1604.04516, Title: Robust adaptive efficient estimation for semi-Markov nonparametric  regression models
arXiv:1604.04527, Title: Deep Learning for Short-Term Traffic Flow Prediction
arXiv:1604.04582, Title: Simulations on the combinatorial structure of D-optimal designs
arXiv:1604.04600, Title: Estimation of low rank density matrices: bounds in Schatten norms and  other distances
arXiv:1604.04656, Title: Nonparametric Estimation of ROC Surfaces Under Verification Bias
arXiv:1604.04687, Title: Insights from Machine Learning for Evaluating Production Function  Estimators on Manufacturing Survey Data
arXiv:1604.04732, Title: Stable Exponential Random Graph Models with Non-parametric Components  for Large Dense Networks
arXiv:1604.04741, Title: Smoothed Hierarchical Dirichlet Process: A Non-Parametric Approach to  Constraint Measures
arXiv:1604.04768, Title: Median bias reduction of maximum likelihood estimates
arXiv:1604.04793, Title: A double-indexed functional Hill process and applications
arXiv:1604.04899, Title: Phase-Aligned Spectral Filtering for Decomposing Spatiotemporal Dynamics
arXiv:1604.04931, Title: Regularizing Solutions to the MEG Inverse Problem Using Space-Time  Separable Covariance Functions
arXiv:1604.04939, Title: Multi-view Learning as a Nonparametric Nonlinear Inter-Battery Factor  Analysis
arXiv:1604.04942, Title: Identifying global optimality for dictionary learning
arXiv:1604.04960, Title: Gaussian Copula Variational Autoencoders for Mixed Data
arXiv:1604.04980, Title: Potentially Predictive Variance Reducing Subsample Locations in Local  Gaussian Process Regression
arXiv:1604.05224, Title: BFDA: A Matlab Toolbox for Bayesian Functional Data Analysis
arXiv:1604.05251, Title: Kernel Distribution Embeddings: Universal Kernels, Characteristic  Kernels and Kernel Metrics on Distributions
arXiv:1604.05263, Title: Chained Gaussian Processes
arXiv:1604.05266, Title: Finding Common Characteristics Among NBA Playoff and Championship Teams:  A Machine Learning Approach
arXiv:1604.05278, Title: The Nu Class of Low-Degree-Truncated Rational Functions. I. IMSPE in  Design of Computer Experiments: Integrals and Very-Low-N, Single-Factor,  Free-Ranging Designs
arXiv:1604.05375, Title: Optimal Designs for Longitudinal and Functional Data
arXiv:1604.05377, Title: Churn analysis using deep convolutional neural networks and autoencoders
arXiv:1604.05418, Title: Its All on the Square- The Importance of the Sum of Squares and Making  the General Linear Model Simple
arXiv:1604.05449, Title: Streaming Label Learning for Modeling Labels on the Fly
arXiv:1604.05456, Title: Hybrid copula mixed models for combining case-control and cohort studies  in meta-analysis of diagnostic tests
arXiv:1604.05478, Title: Valid parameter space of a bivariate Gaussian Markov random field with a  generalized block-Toeplitz precision matrix
arXiv:1604.05489, Title: K-optimal designs for parameters of shifted Ornstein-Uhlenbeck processes  and sheets
arXiv:1604.05589, Title: Coupling couples with copulas: analysis of assortative matching on risk  attitude
arXiv:1604.05643, Title: A copula-based model for multivariate ordinal panel data: application to  well-being composition
arXiv:1604.05658, Title: Sequential Monte Carlo Smoothing with Parameter Estimation
arXiv:1604.05661, Title: Objective Bayesian Analysis of the Yule-Simon Distribution with  Applications
arXiv:1604.05734, Title: Empirical priors for targeted posterior concentration rates
arXiv:1604.05819, Title: Trading-Off Cost of Deployment Versus Accuracy in Learning Predictive  Models
arXiv:1604.05868, Title: Predicting the intensity of partially observed data from a revisited  kriging for point processes
arXiv:1604.05910, Title: A Tutorial on Libra: R package for the Linearized Bregman Algorithm in  High Dimensional Statistics
arXiv:1604.05927, Title: Some results on the computing of Tukey's halfspace medain
arXiv:1604.05976, Title: Computational Drug Repositioning Using Continuous Self-controlled Case  Series
arXiv:1604.06003, Title: Shape constrained kernel-weighted least squares: Application to  production function estimation for Chilean manufacturing industries
arXiv:1604.06013, Title: Point process models for spatio-temporal distance sampling data from a  large-scale survey of blue whales
arXiv:1604.06020, Title: Constructive Preference Elicitation by Setwise Max-margin Learning
arXiv:1604.06036, Title: Random Projection Estimation of Discrete-Choice Models with Large Choice  Sets
arXiv:1604.06145, Title: Estimating Semi-parametric Panel Multinomial Choice Models using Cyclic  Monotonicity
arXiv:1604.06167, Title: Testing the Quantal Response Hypothesis
arXiv:1604.06170, Title: Adjusted Empirical Likelihood for Long-memory Time Series Models
arXiv:1604.06194, Title: Dynamic matrix factorization with social influence
arXiv:1604.06229, Title: Application of optimal data-based binning method to spatial analysis of  ecological datasets
arXiv:1604.06304, Title: Fast adaptive estimation of log-additive exponential models in  Kullback-Leibler divergence
arXiv:1604.06308, Title: Some estimators of the PDF and CDF of the Lindley Distribution
arXiv:1604.06310, Title: Inference on covariance operators via concentration inequalities:  k-sample tests, classification, and clustering via Rademacher complexities
arXiv:1604.06335, Title: Markov models for ocular fixation locations in the presence and absence  of colour
arXiv:1604.06380, Title: Asymptotic properties of a Nadaraya-Watson type estimator for regression  functions of infinite order
arXiv:1604.06383, Title: Piecewise Empirical Likelihood
arXiv:1604.06398, Title: Mode jumping MCMC for Bayesian variable selection in GLMM
arXiv:1604.06474, Title: On Detection and Structural Reconstruction of Small-World Random  Networks
arXiv:1604.06498, Title: Stabilized Sparse Online Learning for Sparse Data
arXiv:1604.06511, Title: Parameter Estimation of Gaussian Stationary Processes using the  Generalized Method of Moments
arXiv:1604.06515, Title: A weighted edge-count two-sample test for multivariate and object data
arXiv:1604.06568, Title: Graph-based Composite Local Bregman Divergences on Discrete Sample  Spaces
arXiv:1604.06637, Title: Robust and Sparse Regression via $γ$-divergence
arXiv:1604.06651, Title: General and specific utility measures for synthetic data
arXiv:1604.06716, Title: Supplementary Material for "Should we sample a time series more  frequently? Decision support via multirate spectrum estimation (with  discussion)"
arXiv:1604.06727, Title: An improved chromosome formulation for genetic algorithms applied to  variable selection with the inclusion of interaction terms
arXiv:1604.06749, Title: Learning a Tree-Structured Ising Model in Order to Make Predictions
arXiv:1604.06815, Title: Non-convex Global Minimization and False Discovery Rate Control for the  TREX
arXiv:1604.06837, Title: Certifiably Optimal Low Rank Factor Analysis
arXiv:1604.06874, Title: Multiple testing with optimal individual tests in Gaussian graphical  model selection
arXiv:1604.06906, Title: Non-Central Multivariate Chi-Square and Gamma Distributions
arXiv:1604.07027, Title: Approximate Bayesian Computation and Model Validation for Repulsive  Spatial Point Processes
arXiv:1604.07031, Title: Predictive Hierarchical Clustering: Learning clusters of CPT codes for  improving surgical outcomes
arXiv:1604.07039, Title: Finite sample breakdown point of Tukey's halfspace median
arXiv:1604.07080, Title: The Power Inverse Lindley Distribution
arXiv:1604.07087, Title: Optimal Estimation of Slope Vector in High-dimensional Linear  Transformation Model
arXiv:1604.07098, Title: WavmatND: A MATLAB Package for Non-Decimated Wavelet Transform and its  Applications
arXiv:1604.07104, Title: The limit of finite sample breakdown point of Tukey's halfspace median  for general data
arXiv:1604.07125, Title: Approximate Residual Balancing: De-Biased Inference of Average Treatment  Effects in High Dimensions
arXiv:1604.07143, Title: Neural Random Forests
arXiv:1604.07177, Title: On the Use of Penalty MCMC for Differential Privacy
arXiv:1604.07212, Title: Data-Driven Confounder Selection via Markov and Bayesian Networks
arXiv:1604.07264, Title: Scalable Bayesian Variable Selection for Structured High-dimensional  Data
arXiv:1604.07299, Title: Bayesian modelling and quantification of Raman spectroscopy
arXiv:1604.07300, Title: Non-parametric estimation of the spiking rate in systems of interacting  neurons
arXiv:1604.07304, Title: A Note on the Posterior Inference for the Yule-Simon Distribution
arXiv:1604.07311, Title: Stability Selection for Lasso, Ridge and Elastic Net Implemented with  AFT Models
arXiv:1604.07354, Title: Ultrahigh Dimensional Feature Selection via Kernel Canonical Correlation  Analysis
arXiv:1604.07356, Title: Fast nonlinear embeddings via structured matrices
arXiv:1604.07397, Title: Teaching Data Science
arXiv:1604.07449, Title: Distribution-free Detection of a Submatrix
arXiv:1604.07451, Title: Learning Local Dependence In Ordered Data
arXiv:1604.07463, Title: Dynamic Pricing with Demand Covariates
arXiv:1604.07464, Title: Nonparametric Bayesian Negative Binomial Factor Analysis
arXiv:1604.07487, Title: Global-Local Mixtures
arXiv:1604.07520, Title: Distribution-free Multiple Testing
arXiv:1604.07627, Title: Surrogate modelling for stochastic dynamical systems by combining NARX  models and polynomial chaos expansions
arXiv:1604.07689, Title: Testing for voter rigging in small polling stations
arXiv:1604.07711, Title: Condorcet's Jury Theorem for Consensus Clustering and its Implications  for Diversity
arXiv:1604.07750, Title: Extreme value analysis for the sample autocovariance matrices of  heavy-tailed multivariate time series
arXiv:1604.07949, Title: Auxiliary Likelihood-Based Approximate Bayesian Computation in State  Space Models
arXiv:1604.07969, Title: On the Surprising Explanatory Power of Higher Realized Moments in  Practice
arXiv:1604.08016, Title: Adaptive Incremental Mixture Markov chain Monte Carlo
arXiv:1604.08085, Title: Scalable Bayesian nonparametric measures for exploring pairwise  dependence via Dirichlet Process Mixtures
arXiv:1604.08098, Title: Local Uncertainty Sampling for Large-Scale Multi-Class Logistic  Regression
arXiv:1604.08102, Title: An ABC interpretation of the multiple auxiliary variable method
arXiv:1604.08291, Title: Streaming View Learning
arXiv:1604.08294, Title: An Adaptive-to-Model Test for Parametric Single-Index  Errors-in-Variables Models
arXiv:1604.08320, Title: Sequential Bayesian optimal experimental design via approximate dynamic  programming
arXiv:1604.08402, Title: Two Differentially Private Rating Collection Mechanisms for Recommender  Systems
arXiv:1604.08403, Title: Bayesian functional linear regression with sparse step functions
arXiv:1604.08428, Title: Nonparametric regression based on discretely sampled curves
arXiv:1604.08462, Title: Estimating Psychological Networks and their Accuracy: A Tutorial Paper
arXiv:1604.08470, Title: Score matching estimators for directional distributions
arXiv:1604.08524, Title: A Probabilistic Adaptive Search System for Exploring the Face Space
arXiv:1604.08634, Title: Optimal Transport vs. Fisher-Rao distance between Copulas for Clustering  Multivariate Time Series
arXiv:1604.08654, Title: Bayesian Genome- and Epigenome-wide Association Studies with Gene Level  Dependence
arXiv:1604.08697, Title: Sparse Generalized Eigenvalue Problem: Optimal Statistical Rates via  Truncated Rayleigh Flow
arXiv:1604.08720, Title: Individual Treatment Effect Prediction for ALS Patients
arXiv:1604.08772, Title: Towards Conceptual Compression
arXiv:1604.08853, Title: Joint Dispersion Model with a Flexible Link
arXiv:1604.08908, Title: Parameter estimation in a subcritical percolation model with colouring
arXiv:1604.08934, Title: An expressive dissimilarity measure for relational clustering using  neighbourhood trees
arXiv:1604.08943, Title: Minimax optimal convex methods for Poisson inverse problems under  $\ell_q$-ball sparsity
arXiv:1604.00055, Title: Competition and extinction explain the evolution of diversity in  American automobiles
arXiv:1604.00126, Title: Nonparametric Spherical Topic Modeling with Word Embeddings
arXiv:1604.00151, Title: Analysis of gradient descent methods with non-diminishing, bounded  errors
arXiv:1604.00255, Title: Network structure, metadata and the prediction of missing nodes and  annotations
arXiv:1604.00289, Title: Building Machines That Learn and Think Like People
arXiv:1604.00371, Title: A percolation on directed graphs
arXiv:1604.00653, Title: A Characterization of the Non-Uniqueness of Nonnegative Matrix  Factorizations
