arXiv:1607.00021, Title: The Simulator: An Engine to Streamline Simulations
arXiv:1607.00034, Title: Ballpark Learning: Estimating Labels from Rough Group Comparisons
arXiv:1607.00046, Title: A Two-Stage Patient-Focused Study Design for Rare Disease Controlled  Trials
arXiv:1607.00071, Title: An Operator Theoretic Approach to Nonparametric Mixture Models
arXiv:1607.00084, Title: On Mixed Memberships and Symmetric Nonnegative Matrix Factorizations
arXiv:1607.00091, Title: Reducing overfitting in challenge-based competitions
arXiv:1607.00098, Title: Fully Bayesian Classification with Heavy-tailed Priors for Selection in  High-dimensional Features with Grouping Structure
arXiv:1607.00133, Title: Deep Learning with Differential Privacy
arXiv:1607.00215, Title: Why is Posterior Sampling Better than Optimism for Reinforcement  Learning?
arXiv:1607.00274, Title: A new analytical approach to consistency and overfitting in regularized  empirical risk minimization
arXiv:1607.00279, Title: Meaningful Models: Utilizing Conceptual Structure to Improve Machine  Learning Interpretability
arXiv:1607.00286, Title: Quantile Graphical Models: Prediction and Conditional Independence with  Applications to Systemic Risk
arXiv:1607.00292, Title: Bayes factor consistency
arXiv:1607.00393, Title: Frequentist size of Bayesian inequality tests
arXiv:1607.00411, Title: Hybrid optimization and Bayesian inference techniques for a non-smooth  radiation detection problem
arXiv:1607.00485, Title: Group Sparse Regularization for Deep Neural Networks
arXiv:1607.00515, Title: The Multiple Quantile Graphical Model
arXiv:1607.00567, Title: Rademacher Complexity Bounds for a Penalized Multiclass Semi-Supervised  Algorithm
arXiv:1607.00624, Title: Asymptotic Bayesian Theory of Quickest Change Detection for Hidden  Markov Models
arXiv:1607.00669, Title: Understanding the Energy and Precision Requirements for Online Learning
arXiv:1607.00673, Title: Dynamic network models and graphon estimation
arXiv:1607.00674, Title: Estimation of anthracnose dynamics by nonlinear filtering
arXiv:1607.00696, Title: Variational limits of k-NN graph based functionals on data clouds
arXiv:1607.00698, Title: The Econometrics of Randomized Experiments
arXiv:1607.00699, Title: The State of Applied Econometrics - Causality and Policy Evaluation
arXiv:1607.00706, Title: A Semi-supervised learning approach to enhance health care  Community-based Question Answering: A case study in alcoholism
arXiv:1607.00710, Title: Automatic Generation of Probabilistic Programming from Time Series Data
arXiv:1607.00743, Title: A Residual Bootstrap for High-Dimensional Regression with Near Low-Rank  Designs
arXiv:1607.00806, Title: Towards Model Selection for Local Log-Density Estimation. Fisher and  Wilks-type theorems
arXiv:1607.00858, Title: Embracing Data Science
arXiv:1607.00864, Title: A tutorial on estimator averaging in spatial point process models
arXiv:1607.00882, Title: Modelling Ordinal Responses with Uncertainty: a Hierarchical Marginal  Model with Latent Uncertainty components
arXiv:1607.00896, Title: Low frequency estimation of continuous-time moving average Lévy  processes
arXiv:1607.00959, Title: Optimal Design of the Shiryaev-Roberts Chart: Give Your Shiryaev-Roberts  a Headstart
arXiv:1607.00963, Title: Optimal bandwidth selection for semi-recursive kernel regression  estimators
arXiv:1607.01036, Title: Bootstrap Model Aggregation for Distributed Statistical Learning
arXiv:1607.01073, Title: Simple fixed-effects inference for complex functional models
arXiv:1607.01145, Title: Simple structure estimation via prenet penalization
arXiv:1607.01152, Title: How to Evaluate the Quality of Unsupervised Anomaly Detection  Algorithms?
arXiv:1607.01179, Title: Robust clustering tools based on optimal transportation
arXiv:1607.01192, Title: Bounded Influence Propagation τ-Estimation: A New Robust Method for  ARMA Model Estimation
arXiv:1607.01224, Title: Machine Learning for Antimicrobial Resistance
arXiv:1607.01251, Title: Consistency of the MLE under mixture models
arXiv:1607.01312, Title: Mixtures of Bivariate von Mises Distributions with Applications to  Modelling of Protein Dihedral Angles
arXiv:1607.01355, Title: Object Recognition and Identification Using ESM Data
arXiv:1607.01367, Title: A Tutorial on Regularized Partial Correlation Networks
arXiv:1607.01369, Title: On the Consistency of the Likelihood Maximization Vertex Nomination  Scheme: Bridging the Gap Between Maximum Likelihood Estimation and Graph  Matching
arXiv:1607.01371, Title: On the distribution of cross-validated Mahalanobis distances
arXiv:1607.01375, Title: Efficient Estimation in the Tails of Gaussian Copulas
arXiv:1607.01381, Title: One-Shot Session Recommendation Systems with Combinatorial Items
arXiv:1607.01400, Title: An Aggregate and Iterative Disaggregate Algorithm with Proven Optimality  in Machine Learning
arXiv:1607.01417, Title: Algorithms for Generalized Cluster-wise Linear Regression
arXiv:1607.01434, Title: Risk Bounds for High-dimensional Ridge Function Combinations Including  Neural Networks
arXiv:1607.01458, Title: A hybrid adaptive MCMC algorithm in function spaces
arXiv:1607.01462, Title: An optimal learning method for developing personalized treatment regimes
arXiv:1607.01516, Title: A new gene co-expression network analysis based on Core Structure  Detection (CSD)
arXiv:1607.01624, Title: Bayesian nonparametrics for Sparse Dynamic Networks
arXiv:1607.01631, Title: Bayesian emulation for optimization in multi-step portfolio decisions
arXiv:1607.01664, Title: Personalized Optimization for Computer Experiments with Environmental  Inputs
arXiv:1607.01668, Title: Tensor Decomposition for Signal Processing and Machine Learning
arXiv:1607.01718, Title: Graphons, mergeons, and so on!
arXiv:1607.01756, Title: Protocol for an Observational Study on the Effects of Playing High  School Football on Later Life Cognitive Functioning and Mental Health
arXiv:1607.01833, Title: Numerical algorithms on the affine Grassmannian
arXiv:1607.01853, Title: On Gaussian Comparison Inequality and Its Application to Spectral  Analysis of Large Random Matrices
arXiv:1607.01881, Title: Goal-oriented optimal approximations of Bayesian linear inverse problems
arXiv:1607.01892, Title: Uncertainty quantification for the horseshoe
arXiv:1607.01904, Title: Bayesian inverse problems with $l_1$ priors: a Randomize-then-Optimize  approach
arXiv:1607.01981, Title: Nesterov's Accelerated Gradient and Momentum as approximations to  Regularised Update Descent
arXiv:1607.01985, Title: A Common Derivation for Markov Chain Monte Carlo Algorithms with  Tractable and Intractable Targets
arXiv:1607.02011, Title: Kernel Bayesian Inference with Posterior Regularization
arXiv:1607.02017, Title: Detection of periodicity in functional time series
arXiv:1607.02024, Title: Mini-Batch Spectral Clustering
arXiv:1607.02085, Title: A Classification Framework for Partially Observed Dynamical Systems
arXiv:1607.02188, Title: Whole-brain substitute CT generation using Markov random field mixture  models
arXiv:1607.02194, Title: Numerical posterior distribution error control and expected Bayes  Factors in the bayesian Uncertainty Quantification of Inverse Problems
arXiv:1607.02201, Title: Eigenvalue distributions of variance components estimators in  high-dimensional random effects models
arXiv:1607.02245, Title: Moments convergence of powered normal extremes
arXiv:1607.02248, Title: On the Log-Likelihood Ratio Evaluation of CWCU Linear and Widely Linear  MMSE Data Estimators
arXiv:1607.02283, Title: Adaptive seamless design for establishing pharmacokinetics and efficacy  equivalence in developing biosimilars
arXiv:1607.02325, Title: Optimal Bayesian estimators for latent variable cluster models
arXiv:1607.02328, Title: Common and Distinct Components in Data Fusion
arXiv:1607.02387, Title: Convergence rates of Kernel Conjugate Gradient for random design  regression
arXiv:1607.02435, Title: Optimal Rates of Statistical Seriation
arXiv:1607.02450, Title: Proceedings of the 2016 ICML Workshop on #Data4Good: Machine Learning in  Social Good Applications
arXiv:1607.02472, Title: Two Iterative Proximal-Point Algorithms for the Calculus of  Divergence-based Estimators with Application to Mixture Models
arXiv:1607.02516, Title: Pseudo-Marginal Hamiltonian Monte Carlo
arXiv:1607.02531, Title: Proceedings of the 2016 ICML Workshop on Human Interpretability in  Machine Learning (WHI 2016)
arXiv:1607.02538, Title: A data-driven method for improving the correlation estimation in serial  ensemble Kalman filters
arXiv:1607.02566, Title: Robust causal inference with continuous instruments using the local  instrumental variable curve
arXiv:1607.02604, Title: Convergence of Multivariate Quantile Surfaces
arXiv:1607.02623, Title: Beyond the Pearson correlation: heavy-tailed risks, weighted Gini  correlations, and a Gini-type weighted insurance pricing model
arXiv:1607.02630, Title: MAGIC: a general, powerful and tractable method for selective inference
arXiv:1607.02631, Title: Discrete Choice Models for Nonmonotone Nonignorable Missing Data:  Identification and Inference
arXiv:1607.02633, Title: Bayesian inference for stochastic differential equation mixed effects  models of a tumor xenography study
arXiv:1607.02655, Title: Scalable Bayesian modeling, monitoring and analysis of dynamic network  flow data
arXiv:1607.02670, Title: Sparse additive Gaussian process with soft interactions
arXiv:1607.02675, Title: Covariate Regularized Community Detection in Sparse Graphs
arXiv:1607.02676, Title: Bayesian quantile additive regression trees
arXiv:1607.02689, Title: On the Unique Crossing Conjecture of Diaconis and Perlman on  Convolutions of Gamma Random Variables
arXiv:1607.02727, Title: Integral form of the COM-Poisson normalization constant
arXiv:1607.02735, Title: Approximate Bayesian Computation for Lorenz Curves from Grouped Data
arXiv:1607.02738, Title: Magnetic Hamiltonian Monte Carlo
arXiv:1607.02745, Title: How to use the functional empirical process for deriving asymptotic laws  for functions of the sample
arXiv:1607.02758, Title: Improving Population Monte Carlo: Alternative Weighting and Resampling  Schemes
arXiv:1607.02788, Title: Parallel local approximation MCMC for expensive models
arXiv:1607.02804, Title: Estimating the number of species to attain sufficient representation in  a random sample
arXiv:1607.02833, Title: Barycentric Subspace Analysis on Manifolds
arXiv:1607.02883, Title: Non-Concave Penalization in Linear Mixed-Effects Models and Regularized  Selection of Fixed Effects
arXiv:1607.02896, Title: Conjugacy properties of time-evolving Dirichlet and gamma random  measures
arXiv:1607.02957, Title: A low-rank based estimation-testing procedure for matrix-covariate  regression
arXiv:1607.02993, Title: Bayesian variable selection in high dimensional problems without  assumptions on prior model probabilities
arXiv:1607.03026, Title: Retrospective Causal Inference with Machine Learning Ensembles: An  Application to Anti-Recidivism Policies in Colombia
arXiv:1607.03045, Title: Shared Subspace Models for Multi-Group Covariance Estimation
arXiv:1607.03080, Title: Approximate Bayesian computation (ABC) coupled with Bayesian model  averaging method for estimating mean and standard deviation
arXiv:1607.03173, Title: A note on Rényi's "record" problem and Engel's series
arXiv:1607.03188, Title: The Zig-Zag Process and Super-Efficient Sampling for Bayesian Analysis  of Big Data
arXiv:1607.03197, Title: Semiparametric Estimation with Data Missing Not at Random Using an  Instrumental Variable
arXiv:1607.03202, Title: Rapid Prediction of Player Retention in Free-to-Play Mobile Games
arXiv:1607.03204, Title: Information Projection and Approximate Inference for Structured Sparse  Variables
arXiv:1607.03294, Title: Asymptotic Near-Minimaxity of the Randomized Shiryaev-Roberts-Pollak  Change-Point Detection Procedure in Continuous Time
arXiv:1607.03300, Title: From Dependence to Causation
arXiv:1607.03302, Title: Bayesian estimators of the Gamma distribution
arXiv:1607.03313, Title: Predicting the evolution of stationary graph signals
arXiv:1607.03390, Title: Information Splitting for Big Data Analytics
arXiv:1607.03475, Title: Nystrom Method for Approximating the GMM Kernel
arXiv:1607.03534, Title: A Flexible Bayesian Model for Estimating Subnational Mortality
arXiv:1607.03569, Title: Partition structure and the A-hypergeometric distribution associated  with the rational normal curve
arXiv:1607.03574, Title: Effects of Additional Data on Bayesian Clustering
arXiv:1607.03592, Title: Cluster Sampling Filters for Non-Gaussian Data Assimilation
arXiv:1607.03615, Title: Multiple-Instance Logistic Regression with LASSO Penalty
arXiv:1607.03675, Title: Determinantal point process models on the sphere
arXiv:1607.03698, Title: Indirect Maximum Entropy Bandwidth
arXiv:1607.03717, Title: Exploration of heterogeneous treatment effects via concave fusion
arXiv:1607.03730, Title: Learning Shallow Detection Cascades for Wearable Sensor-Based Mobile  Health Applications
arXiv:1607.03752, Title: Nonparametric Depth and Quantile Regression for Functional Data
arXiv:1607.03765, Title: Dynamic recursive tree-based partitioning for malignant melanoma  identification in skin lesion dermoscopic images
arXiv:1607.03775, Title: Causal inference to detect selection bias in road safety epidemiology
arXiv:1607.03792, Title: Kernel Density Estimation for Dynamical Systems
arXiv:1607.03822, Title: Feature Extraction and Automated Classification of Heartbeats by Machine  Learning
arXiv:1607.03842, Title: Safe Policy Improvement by Minimizing Robust Baseline Regret
arXiv:1607.03855, Title: Estimating trends in the global mean temperature record
arXiv:1607.03954, Title: Ensemble preconditioning for Markov chain Monte Carlo simulation
arXiv:1607.03975, Title: Estimating and Controlling the False Discovery Rate for the PC Algorithm  Using Edge-Specific P-Values
arXiv:1607.04039, Title: Comparing cluster-level dynamic treatment regimens using sequential,  multiple assignment, randomized trials: Regression estimation and sample size  considerations
arXiv:1607.04157, Title: The 2008 election: A preregistered replication analysis
arXiv:1607.04204, Title: Differentially Private Model Selection with Penalized and Constrained  Likelihood
arXiv:1607.04209, Title: Dynamic Question Ordering in Online Surveys
arXiv:1607.04215, Title: Semi-Parametric Survival Estimation for pedigrees
arXiv:1607.04327, Title: Closure properties of classes of multiple testing procedures
arXiv:1607.04331, Title: Random projections of random manifolds
arXiv:1607.04367, Title: The semi-parametric Bernstein-von Mises theorem for regression models  with symmetric errors
arXiv:1607.04384, Title: The Derivative of Influence Function, Location Breakdown Point, Group  Leverage and Regression Residuals' Plots
arXiv:1607.04407, Title: Non-area-specific adjustment factor for second-order efficient empirical  Bayes confidence interval
arXiv:1607.04424, Title: Investigations of the effects of random sampling patterns on the  stability of generalized sampling
arXiv:1607.04430, Title: The Empirical Beta Copula
arXiv:1607.04522, Title: Modelling high-dimensional time series efficiently by means of  constrained spatio--temporal models
arXiv:1607.04532, Title: Should I stay or should I go? A latent threshold approach to large-scale  mixture innovation models
arXiv:1607.04543, Title: The gmwm R package: a comprehensive tool for time series analysis from  state-space models to robustness
arXiv:1607.04566, Title: Spectral Echolocation via the Wave Embedding
arXiv:1607.04736, Title: Tail dependence of the Gaussian copula revisited
arXiv:1607.04751, Title: Fast Simulation of Hyperplane-Truncated Multivariate Normal  Distributions
arXiv:1607.04796, Title: Objective Bayesian modelling of insurance risks with the skewed  Student-t distribution
arXiv:1607.04807, Title: Progress on a Conjecture Regarding the Triangular Distribution
arXiv:1607.04848, Title: A note on the asymptotic normality of sums of extreme values
arXiv:1607.04903, Title: Learning Unitary Operators with Help From u(n)
arXiv:1607.04912, Title: Trajectory Fitting Estimators for SPDEs Driven by Additive Noise
arXiv:1607.04993, Title: Quasi-Systematic Sampling From a Continuous Population
arXiv:1607.05002, Title: Geometric Mean Metric Learning
arXiv:1607.05042, Title: An empirical comparison of global and local functional depths
arXiv:1607.05047, Title: A Batch, Off-Policy, Actor-Critic Algorithm for Optimizing the Average  Reward
arXiv:1607.05051, Title: Validity and the foundations of statistical inference
arXiv:1607.05091, Title: Estimator selection: a new method with applications to kernel density  estimation
arXiv:1607.05136, Title: Confidence distributions from likelihoods by median bias correction
arXiv:1607.05150, Title: Statistical Methods in Topological Data Analysis for Complex,  High-Dimensional Data
arXiv:1607.05154, Title: On the Application of Support Vector Machines to the Prediction of  Propagation Losses at 169 MHz for Smart Metering Applications
arXiv:1607.05167, Title: Two-step wavelet-based estimation for mixed Gaussian fractional  processes
arXiv:1607.05169, Title: Sparse Estimation of Generalized Linear Models (GLM) via Approximated  Information Criteria
arXiv:1607.05184, Title: On the Accuracy of Fixed Sampled and Fixed Width Confidence Intervals  Based on the Vertically Weighted Averages
arXiv:1607.05222, Title: Information-theoretic bounds and phase transitions in clustering, sparse  PCA, and submatrix localization
arXiv:1607.05336, Title: Fast Hyperspectral Unmixing in Presence of Nonlinearity or Mismodelling  Effects
arXiv:1607.05376, Title: The Problem of Infra-marginality in Outcome Tests for Discrimination
arXiv:1607.05380, Title: Data-Driven Sensitivity Inference for Thomson Scattering Electron  Density Measurement Systems
arXiv:1607.05415, Title: Variable selection and structure identification for varying coefficient  Cox models
arXiv:1607.05421, Title: On the estimation of the mean of a random vector
arXiv:1607.05424, Title: Assessing the similarity of dose response and target doses in two  non-overlapping subgroups
arXiv:1607.05430, Title: Efficient semiparametric estimation and model selection for  multidimensional mixtures
arXiv:1607.05432, Title: Nested Kriging predictions for datasets with large number of  observations
arXiv:1607.05454, Title: Novel Criteria to Exclude the Surrogate Paradox and Their Optimalities
arXiv:1607.05455, Title: Geodesic Convexity and Regularized Scatter Estimators
arXiv:1607.05506, Title: Distribution-dependent concentration inequalities for tighter  generalization bounds
arXiv:1607.05536, Title: Adaptive Fused LASSO in Grouped Quantile Regression
arXiv:1607.05573, Title: Combining Random Walks and Nonparametric Bayesian Topic Model for  Community Detection
arXiv:1607.05636, Title: Marginal false discovery rates for penalized regression models
arXiv:1607.05709, Title: Multi-category Angle-based Classifier Refit
arXiv:1607.05712, Title: Structure-Blind Signal Recovery
arXiv:1607.05758, Title: Independent Resampling Sequential Monte Carlo Algorithms
arXiv:1607.05832, Title: Personalization Effect on Emotion Recognition from Physiological Data:  An Investigation of Performance on Different Setups and Classifiers
arXiv:1607.05858, Title: Wavelet Variance for Random Fields: an M-Estimation Framework
arXiv:1607.05861, Title: Fast and Robust Parametric Estimation for Time Series and Spatial Models
arXiv:1607.05874, Title: An Innovations Algorithm for the prediction of functional linear  processes
arXiv:1607.05884, Title: On the Identifiability of Latent Models for Dependent Data
arXiv:1607.05896, Title: Multivariate Order Statistics: The Intermediate Case
arXiv:1607.05970, Title: On the Identification and Mitigation of Weaknesses in the Knowledge  Gradient Policy for Multi-Armed Bandits
arXiv:1607.05974, Title: Anomaly Detection and Localisation using Mixed Graphical Models
arXiv:1607.05980, Title: Causal inference in partially linear structural equation models
arXiv:1607.05981, Title: Fitting logistic multilevel models with crossed random effects via  Bayesian Integrated Nested Laplace Approximations: a simulation study
arXiv:1607.06020, Title: An Empirical Study of Customer Spillover Learning about Service Quality
arXiv:1607.06051, Title: Bayesian Aggregation of Rank Data with Covariates and Heterogeneous  Rankers
arXiv:1607.06163, Title: Indirect Inference With(Out) Constraints
arXiv:1607.06280, Title: Explaining Classification Models Built on High-Dimensional Sparse Data
arXiv:1607.06288, Title: Point patterns occurring on complex structures in space and space-time:  An alternative network approach
arXiv:1607.06307, Title: Estimating the unobservable moose - converting index to population size  using a Bayesian Hierarchical state space model
arXiv:1607.06333, Title: Uncovering Causality from Multivariate Hawkes Integrated Cumulants
arXiv:1607.06364, Title: Distributed Supervised Learning using Neural Networks
arXiv:1607.06409, Title: Inference for Multivariate Regression Model based on synthetic data  generated under Fixed-Posterior Predictive Sampling: comparison with Plug-in  Sampling
arXiv:1607.06447, Title: Handling Missing Data in Within-Trial Cost-Effectiveness Analysis: a  Review with Future Guidelines
arXiv:1607.06450, Title: Layer Normalization
arXiv:1607.06534, Title: The Landscape of Empirical Risk for Non-convex Losses
arXiv:1607.06564, Title: On Stochastic Comparisons of Order Statistics from Heterogeneous  Exponential Samples
arXiv:1607.06565, Title: Estimating Causal Peer Influence in Homophilous Social Networks by  Inferring Latent Locations
arXiv:1607.06635, Title: Density Estimation Trees as fast non-parametric modelling tools
arXiv:1607.06685, Title: Structured network regression for spatial point patterns
arXiv:1607.06699, Title: Estimating a class of diffusions from discrete observations via  approximate maximum likelihood method
arXiv:1607.06762, Title: Relational exchangeability
arXiv:1607.06763, Title: Exploring elastic net and multivariate regression
arXiv:1607.06779, Title: Joining and splitting models with Markov melding
arXiv:1607.06801, Title: High-dimensional regression adjustments in randomized experiments
arXiv:1607.06802, Title: Trimmed L-moments For Estimation Multi-parameter Archimedean Copulas
arXiv:1607.06849, Title: Reciprocal Graphical Models for Integrative Gene Regulatory Network  Analysis
arXiv:1607.06903, Title: Asymptotic Properties of Approximate Bayesian Computation
arXiv:1607.06921, Title: Estimation and Prediction using generalized Wendland Covariance  Functions under fixed domain asymptotics
arXiv:1607.06929, Title: Gaussian distributions on Riemannian symmetric spaces: statistical  learning with structured covariance matrices
arXiv:1607.06976, Title: Integrative genetic risk prediction using nonparametric empirical Bayes  classification
arXiv:1607.06993, Title: Community Detection in Degree-Corrected Block Models
arXiv:1607.06996, Title: Scaling Up Sparse Support Vector Machines by Simultaneous Feature and  Sample Reduction
arXiv:1607.07002, Title: Disease Mapping with Generative Models
arXiv:1607.07028, Title: A Statistical Model for the Analysis of Beta Values in DNA Methylation  Studies
arXiv:1607.07083, Title: Graphical modelling of multivariate spatial point processes
arXiv:1607.07195, Title: Higher-Order Factorization Machines
arXiv:1607.07203, Title: Laplace based approximate posterior inference for differential equation  models
arXiv:1607.07260, Title: Boundary crossing probabilities for $(q,d)$-Slepian-processes
arXiv:1607.07343, Title: Gaussian processes and Bayesian moment estimation
arXiv:1607.07414, Title: Quantifying Uncertainties in Fault Slip Distribution during the Tōhoku  Tsunami using Polynomial Chaos
arXiv:1607.07515, Title: Single Stage Prediction with Embedded Topic Modeling of Online Reviews  for Mobile App Management
arXiv:1607.07519, Title: Deepr: A Convolutional Net for Medical Records
arXiv:1607.07521, Title: Propensity score weighting for causal inference with multi-stage  clustered data
arXiv:1607.07549, Title: Concentration of Measure for Radial Distributions and Consequences for  Statistical Modeling
arXiv:1607.07573, Title: Variational Mixture Models with Gamma or inverse-Gamma components
arXiv:1607.07600, Title: An introduction to computational algebraic statistics
arXiv:1607.07664, Title: Bayesian spatial transformation models with applications in neuroimaging  data
arXiv:1607.07771, Title: A Geometric Approach to Confidence Regions and Bands for Functional  Parameters
arXiv:1607.07819, Title: Approximation by Combinations of ReLU and Squared ReLU Ridge Functions  with $ \ell^1 $ and $ \ell^0 $ Controls
arXiv:1607.07844, Title: Uniform limit theorems under random truncation
arXiv:1607.07925, Title: Asymptotic adjustments of Pearson residuals in exponential family  nonlinear models
arXiv:1607.07926, Title: Improved residuals for linear regression models under heteroskedasticity  of unknown form
arXiv:1607.07974, Title: Nonparametric hypothesis testing for equality of means on the simplex
arXiv:1607.07981, Title: On high-frequency limits of $U$-statistics in Besov spaces over compact  manifolds
arXiv:1607.08033, Title: Efficient nonparametric estimation and inference for the volatility  function
arXiv:1607.08096, Title: Combining predictive distributions for statistical post-processing of  ensemble forecasts
arXiv:1607.08110, Title: Comparing the Performance of Graphical Structure Learning Algorithms  with TETRAD
arXiv:1607.08141, Title: Bayesian Nonparametric Modelling of Joint Gap Time Distributions for  Recurrent Event Data
