arXiv:1611.07554, Title: A practical approach to the sensitivity analysis for kinetic Monte Carlo  simulation of heterogeneous catalysis
arXiv:1611.07555, Title: Randomized Distributed Mean Estimation: Accuracy vs Communication
arXiv:1611.07567, Title: Feature Importance Measure for Non-linear Learning Algorithms
arXiv:1611.07609, Title: Adaptive Accelerated Gradient Converging Methods under Holderian Error  Bound Condition
arXiv:1611.07710, Title: Spatio-Temporal Modeling of Users' Check-ins in Location-Based Social  Networks
arXiv:1611.07725, Title: iCaRL: Incremental Classifier and Representation Learning
arXiv:1611.07800, Title: Infinite Variational Autoencoder for Semi-Supervised Learning
arXiv:1611.07801, Title: NMRProcFlow: A graphical and interactive tool dedicated to 1D spectra  processing for NMR-based metabolomics
arXiv:1611.08024, Title: EEGNet: A Compact Convolutional Network for EEG-based Brain-Computer  Interfaces
arXiv:1611.08207, Title: Texture Synthesis with Spatial Generative Adversarial Networks
arXiv:1611.08229, Title: Fast Orthonormal Sparsifying Transforms Based on Householder Reflectors
arXiv:1611.08331, Title: An Overview on Data Representation Learning: From Traditional Feature  Learning to Recent Deep Learning
arXiv:1611.08648, Title: Patient-Driven Privacy Control through Generalized Distillation
arXiv:1611.08761, Title: Ergodicity and Accuracy of Optimal Particle Filters for Bayesian Data  Assimilation
arXiv:1611.08874, Title: A large sample test for the length of memory of stationary symmetric  stable random fields via nonsingular $\mathbb{Z}^d$-actions
arXiv:1611.08942, Title: The BIN_COUNTS Constraint: Filtering and Applications
arXiv:1611.08945, Title: Learning a Natural Language Interface with Neural Programmer
arXiv:1611.09083, Title: Prediction of Video Popularity in the Absence of Reliable Data from  Video Hosting Services: Utility of Traces Left by Users on the Web
arXiv:1611.09167, Title: Long-range properties and data validity for hydrogeological time series:  the case of the Paglia river
arXiv:1611.09207, Title: AutoMOS: Learning a non-intrusive assessor of naturalness-of-speech
arXiv:1611.09328, Title: Accelerated Gradient Temporal Difference Learning
arXiv:1611.09347, Title: Quantum Machine Learning
arXiv:1611.09384, Title: The Emergence of Organizing Structure in Conceptual Representation
arXiv:1611.09510, Title: Graph-Based Manifold Frequency Analysis for Denoising
arXiv:1611.09630, Title: Improving Variational Auto-Encoders using Householder Flow
arXiv:1611.09726, Title: Gossip training for deep learning
arXiv:1611.09791, Title: On the Existence of Synchrostates in Multichannel EEG Signals during  Face-perception Tasks
arXiv:1611.09805, Title: A new primal-dual algorithm for minimizing the sum of three functions  with a linear operator
arXiv:1611.09820, Title: Exploring Strategies for Classification of External Stimuli Using  Statistical Features of the Plant Electrical Response
arXiv:1611.09829, Title: A Statistical Index for Early Diagnosis of Ventricular Arrhythmia from  the Trend Analysis of ECG Phase-portraits
arXiv:1611.09888, Title: Existence of Millisecond-order Stable States in Time-Varying Phase  Synchronization Measure in EEG Signals
arXiv:1611.09891, Title: Using Brain Connectivity Measure of EEG Synchrostates for Discriminating  Typical and Autism Spectrum Disorder
arXiv:1611.09940, Title: Neural Combinatorial Optimization with Reinforcement Learning
arXiv:1611.10041, Title: Subsampled online matrix factorization with convergence guarantees
arXiv:1611.10258, Title: Reliably Learning the ReLU in Polynomial Time
arXiv:1611.10277, Title: Anchored Correlation Explanation: Topic Modeling with Minimal Domain  Knowledge
arXiv:1611.10283, Title: Weighted bandits or: How bandits learn distorted values that are not  expected
arXiv:1611.10289, Title: Quasi-invariance of countable products of Cauchy measures under  non-unitary dilations
arXiv:1611.10305, Title: Influential Node Detection in Implicit Social Networks using Multi-task  Gaussian Copula Models
arXiv:1611.10351, Title: Joint Causal Inference from Multiple Contexts
arXiv:1611.01838, Title: Entropy-SGD: Biasing Gradient Descent Into Wide Valleys
arXiv:1611.09461, Title: Cost-Sensitive Reference Pair Encoding for Multi-Label Learning
