arXiv:1611.00030, Title: A Mixture of Linear-Linear Regression Models for Linear-Circular  Regression
arXiv:1611.00035, Title: Full-Capacity Unitary Recurrent Neural Networks
arXiv:1611.00040, Title: Lasso, fractional norm and structured sparse estimation using a Hadamard  product parametrization
arXiv:1611.00083, Title: Confronting Quasi-Separation in Logistic Mixed Effects for Linguistic  Data: A Bayesian Approach
arXiv:1611.00087, Title: Closed-form REML estimators and sample size determination for mixed  effects models for repeated measures under monotone missingness
arXiv:1611.00113, Title: Checking for prior-data conflict using prior to posterior divergences
arXiv:1611.00203, Title: Orthogonal Gaussian process models
arXiv:1611.00261, Title: Causal Compression
arXiv:1611.00328, Title: Variational Inference via $χ$-Upper Bound Minimization
arXiv:1611.00336, Title: Stochastic Variational Deep Kernel Learning
arXiv:1611.00340, Title: Variational Bayes In Private Settings (VIPS)
arXiv:1611.00398, Title: Orthogonal samples for estimators in time series
arXiv:1611.00400, Title: Minimum Average Deviance Estimation for Sufficient Dimension Reduction
arXiv:1611.00442, Title: Improved multivariate portmanteau test
arXiv:1611.00460, Title: Inferential Approaches for Network Analyses: AMEN for Latent Factor  Models
arXiv:1611.00519, Title: On the Convergence of the EM Algorithm: A Data-Adaptive Analysis
arXiv:1611.00544, Title: A nonparametric HMM for genetic imputation and coalescent inference
arXiv:1611.00555, Title: Sensitivity Maps of the Hilbert-Schmidt Independence Criterion
arXiv:1611.00565, Title: Learning Methods for Dynamic Topic Modeling in Automated Behaviour  Analysis
arXiv:1611.00630, Title: The accumulated persistence function, a new useful functional summary  statistic for topological data analysis, with a view to brain artery trees  and spatial point process applications
arXiv:1611.00683, Title: Improving variational methods via pairwise linear response identities
arXiv:1611.00717, Title: A Pareto scale-inflated outlier model and its Bayesian analysis
arXiv:1611.00798, Title: Cross-validation based Nonlinear Shrinkage
arXiv:1611.00817, Title: Gaussian Processes for Survival Analysis
arXiv:1611.00819, Title: Developments in Maximum Likelihood Unit Root Tests
arXiv:1611.00826, Title: Hyperbolic decay time series
arXiv:1611.00838, Title: Initialization and Coordinate Optimization for Multi-way Matching
arXiv:1611.00843, Title: Sampling and Estimation for (Sparse) Exchangeable Graphs
arXiv:1611.00866, Title: Tensor Decomposition via Variational Auto-Encoder
arXiv:1611.00868, Title: Incentive-Compatible Elicitation of Quantiles
arXiv:1611.00884, Title: Mean likelihood estimators
arXiv:1611.00953, Title: High-dimensional regression over disease subgroups
arXiv:1611.00962, Title: Multitask Protein Function Prediction Through Task Dissimilarity
arXiv:1611.00965, Title: Faster ARMA maximum likelihood estimation
arXiv:1611.01024, Title: Modeling Website Visits
arXiv:1611.01043, Title: Uniformly valid confidence intervals post-model-selection
arXiv:1611.01046, Title: Learning to Pivot with Adversarial Networks
arXiv:1611.01066, Title: Sparse Generalized Eigenvalue Problem with Application to Canonical  Correlation Analysis for Integrative Analysis of Methylation and Gene  Expression Data
arXiv:1611.01069, Title: Maxima Units Search (MUS) algorithm: methodology and applications
arXiv:1611.01096, Title: Spectral community detection in heterogeneous large networks
arXiv:1611.01119, Title: Infinite-sample consistent estimations of parameters of the Wiener  process with drift
arXiv:1611.01125, Title: Bayesian fractional posteriors
arXiv:1611.01129, Title: Cross: Efficient Low-rank Tensor Completion
arXiv:1611.01144, Title: Categorical Reparameterization with Gumbel-Softmax
arXiv:1611.01179, Title: Adaptive Geometric Multiscale Approximations for Intrinsically  Low-dimensional Data
arXiv:1611.01205, Title: Posterior Graph Selection and Estimation Consistency for  High-dimensional Bayesian DAG Models
arXiv:1611.01213, Title: Bayesian and Variational Bayesian approaches for flows in heterogenous  random media
arXiv:1611.01230, Title: Bayesian Optical Flow with Uncertainty Quantification
arXiv:1611.01232, Title: Deep Information Propagation
arXiv:1611.01238, Title: On consistency of model selection for stochastic block models
arXiv:1611.01239, Title: Reparameterization trick for discrete variables
arXiv:1611.01240, Title: Computer Algebra Derivation of the Bias of Burg Estimators
arXiv:1611.01241, Title: Comparing and weighting imperfect models using D-probabilities
arXiv:1611.01310, Title: Achieving Shrinkage in a Time-Varying Parameter Model Framework
arXiv:1611.01351, Title: Improved Pena-Rodriguez Portmanteau Test
arXiv:1611.01353, Title: Information Dropout: Learning Optimal Representations Through Noisy  Computation
arXiv:1611.01360, Title: Portmanteau Tests for ARMA Models with Infinite Variance
arXiv:1611.01362, Title: Flowgraph Models and Analysis for Markov Jump Processes
arXiv:1611.01369, Title: Asymptotic Theory of Dependent Bayesian Multiple Testing Procedures  Under Possible Model Misspecification
arXiv:1611.01370, Title: Partial autocorrelation parameterization for subset autoregression
arXiv:1611.01373, Title: Efficient Monte Carlo Estimation of the Expected Value of Sample  Information using Moment Matching
arXiv:1611.01387, Title: Necessary and Sufficient Condition for Nonsingular Fisher Information  Matrix in ARMA Models
arXiv:1611.01437, Title: Kullback-Leibler Divergence for the Normal-Gamma Distribution
arXiv:1611.01439, Title: Exceedance Probabilities for the Dirichlet Distribution
arXiv:1611.01450, Title: Estimating the marginal likelihood with Integrated nested Laplace  approximation (INLA)
arXiv:1611.01480, Title: Why comparing survival curves between two prognostic subgroups may be  misleading
arXiv:1611.01485, Title: Flexible Bayesian additive joint models with an application to type 1  diabetes research
arXiv:1611.01504, Title: Estimating Causal Direction and Confounding of Two Discrete Variables
arXiv:1611.01506, Title: Isotonized smooth estimators of a monotone baseline hazard in the Cox  model
arXiv:1611.01511, Title: Algorithms for Fitting the Constrained Lasso
arXiv:1611.01535, Title: Parsimony, model adequacy and periodic correlation in forecasting time  series
arXiv:1611.01540, Title: Topology and Geometry of Half-Rectified Network Optimization
arXiv:1611.01541, Title: Classification with Ultrahigh-Dimensional Features
arXiv:1611.01564, Title: Improved spread-location visualization
arXiv:1611.01595, Title: Power Computations for Intervention Analysis
arXiv:1611.01602, Title: Whole-Volume Clustering of Time Series Data from Zebrafish Brain Calcium  Images via Mixture Modeling
arXiv:1611.01675, Title: A simple method for implementing Monte Carlo tests
arXiv:1611.01708, Title: Detecting Dependencies in Sparse, Multivariate Databases Using  Probabilistic Programming and Non-parametric Bayes
arXiv:1611.01722, Title: Learning to Draw Samples: With Application to Amortized MLE for  Generative Adversarial Learning
arXiv:1611.01743, Title: The Quantile Based Flattened Logistic Distribution: Some properties and  Application
arXiv:1611.01831, Title: Longitudinal Dynamic Functional Regression
arXiv:1611.01843, Title: Learning to Perform Physics Experiments via Deep Reinforcement Learning
arXiv:1611.01845, Title: Urban MV and LV Distribution Grid Topology Estimation via Group Lasso
arXiv:1611.01891, Title: Joint Multimodal Learning with Deep Generative Models
arXiv:1611.01900, Title: Optimal rates for the regularized learning algorithms under general  source condition
arXiv:1611.01957, Title: Linear Convergence of SVRG in Statistical Estimation
arXiv:1611.01971, Title: One Class Splitting Criteria for Random Forests
arXiv:1611.02010, Title: Convergence Analysis of Distributed Inference with Vector-Valued  Gaussian Belief Propagation
arXiv:1611.02041, Title: Does Distributionally Robust Supervised Learning Give Robust  Classifiers?
arXiv:1611.02101, Title: Distributed Coordinate Descent for Generalized Linear Models with  Regularization
arXiv:1611.02181, Title: Using Social Dynamics to Make Individual Predictions: Variational  Inference with a Stochastic Kinetic Model
arXiv:1611.02199, Title: Inference for Additive Models in the Presence of Possibly Infinite  Dimensional Nuisance Parameters
arXiv:1611.02213, Title: A Low-rank Control Variate for Multilevel Monte Carlo Simulation of  High-dimensional Uncertain Systems
arXiv:1611.02221, Title: Minimax-optimal semi-supervised regression on unknown manifolds
arXiv:1611.02241, Title: Entropy-based inhomogeneity detection in porous media
arXiv:1611.02258, Title: Learning Time Series Detection Models from Temporally Imprecise Labels
arXiv:1611.02266, Title: Gaussian Attention Model and Its Application to Knowledge Base Embedding  and Question Answering
arXiv:1611.02304, Title: Normalizing Flows on Riemannian Manifolds
arXiv:1611.02314, Title: Robust Hybrid Learning for Estimating Personalized Dynamic Treatment  Regimens
arXiv:1611.02335, Title: Posterior Consistency for a Non-parametric Survival Model under a  Gaussian Process Prior
arXiv:1611.02365, Title: NonSTOP: A NonSTationary Online Prediction Method for Time Series
arXiv:1611.02367, Title: Discussion of: "A Bayesian information criterion for singular models"
arXiv:1611.02403, Title: Examining posterior propriety in the Bayesian analysis of  capture-recapture models
arXiv:1611.02433, Title: Multiply robust dose-response estimation for multivalued causal  inference problems
arXiv:1611.02440, Title: A Bayesian optimization approach to find Nash equilibria
arXiv:1611.02480, Title: Quantile Graphical Models: Bayesian Approaches
arXiv:1611.02492, Title: A rare event approach to high dimensional Approximate Bayesian  computation
arXiv:1611.02530, Title: A Random Dot Product Model for Weighted Networks
arXiv:1611.02571, Title: Robust change-point detection in panel data
arXiv:1611.02583, Title: A logistic regression analysis approach for sample survey data based on  phi-divergence measures
arXiv:1611.02609, Title: A Continuous Threshold Expectile Model
arXiv:1611.02686, Title: Non-classical Berry-Esseen inequality and accuracy of the weighted  bootstrap
arXiv:1611.02690, Title: A Multi-State Conditional Logistic Regression Model for the Analysis of  Animal Movement
arXiv:1611.02754, Title: Gradient-informed basis adaptation for Legendre Chaos expansions
arXiv:1611.02762, Title: Generalized Cluster Trees and Singular Measures
arXiv:1611.02802, Title: Pairwise Sequential Randomization and Its Properties
arXiv:1611.02818, Title: Hierarchical Stochastic Model in Bayesian Inference: Theoretical  Implications and Efficient Approximation
arXiv:1611.02845, Title: A unit-level small area model with misclassified covariates
arXiv:1611.02861, Title: Expected Coverage of Random Walk Mobility Algorithm
arXiv:1611.02869, Title: Gaussian process regression can turn non-uniform and undersampled  diffusion MRI data into diffusion spectrum imaging
arXiv:1611.02874, Title: Asymptotic properties of parallel Bayesian kernel density estimators
arXiv:1611.02910, Title: Heritability estimation of diseases in case-control studies
arXiv:1611.02978, Title: Evaluating Gaussian processes for sparse irregular spatio-temporal data
arXiv:1611.03015, Title: Honest confidence sets in nonparametric IV regression and other  ill-posed models
arXiv:1611.03042, Title: On the product of a singular Wishart matrix and a singular Gaussian  vector in high dimension
arXiv:1611.03063, Title: Prediction Accuracy Measures for a Nonlinear Model and for  Right-Censored Time-to-Event Data
arXiv:1611.03072, Title: Apocalypse Now? Reviving the Doomsday Argument
arXiv:1611.03073, Title: Causal influence in linear response models
arXiv:1611.03112, Title: Multiple imputation of multilevel missing data: An introduction to the R  package pan
arXiv:1611.03146, Title: The Control of the False Discovery Rate in Fixed Sequence Multiple  Testing
arXiv:1611.03155, Title: Adaptive Controls of FWER and FDR Under Block Dependence
arXiv:1611.03177, Title: A Note on Random Walks with Absorbing barriers and Sequential Monte  Carlo Methods
arXiv:1611.03193, Title: Mahalanobis Distance for Class Averaging of Cryo-EM Images
arXiv:1611.03219, Title: Statistical regionalization for estimation of extreme river discharges
arXiv:1611.03227, Title: Feature Selection with the R Package MXM: Discovering  Statistically-Equivalent Feature Subsets
arXiv:1611.03231, Title: Policy Search with High-Dimensional Context Variables
arXiv:1611.03309, Title: Estimation of clusterwise linear regression models with a shrinkage-like  approach
arXiv:1611.03320, Title: Electrocardiogram signal denoising using non-local wavelet transform  domain filtering
arXiv:1611.03328, Title: Distributed Estimation and Learning over Heterogeneous Networks
arXiv:1611.03427, Title: Multi-Task Multiple Kernel Relationship Learning
arXiv:1611.03439, Title: Bonferroni-based gatekeeping procedure with retesting option
arXiv:1611.03456, Title: Uncertainty in phylogenetic tree estimates
arXiv:1611.03531, Title: Estimating Dynamic Treatment Regimes in Mobile Health Using V-learning
arXiv:1611.03545, Title: The Instrumental Variable Method for Estimating Local Average Treatment  Regime Effects
arXiv:1611.03578, Title: Simple and Efficient Parallelization for Probabilistic Temporal Tensor  Factorization
arXiv:1611.03646, Title: Has global warming modified the relationship between sunspot numbers and  global temperatures?
arXiv:1611.03665, Title: Functional Inference on Rotational Curves and Identification of Human  Gait at the Knee Joint
arXiv:1611.03787, Title: Understanding the 2016 US Presidential Election using ecological  inference and distribution regression with census microdata
arXiv:1611.03824, Title: Learning to Learn without Gradient Descent by Gradient Descent
arXiv:1611.03832, Title: Generalized Phase-Type Distribution and Competing Risks for Markov  Mixtures Process
arXiv:1611.03835, Title: A Bayesian adaptive ensemble Kalman filter for sequential state and  parameter estimation
arXiv:1611.03879, Title: Annealing Gaussian into ReLU: a New Sampling Strategy for Leaky-ReLU RBM
arXiv:1611.03969, Title: An Introduction to MM Algorithms for Machine Learning and Statistical
arXiv:1611.03974, Title: On approximations via convolution-defined mixture models
arXiv:1611.03979, Title: Kernel regression, minimax rates and effective dimensionality: beyond  the regular case
arXiv:1611.03993, Title: Riemannian Tensor Completion with Side Information
arXiv:1611.04026, Title: Mixed Data and Classification of Transit Stops
arXiv:1611.04051, Title: GANS for Sequences of Discrete Elements with the Gumbel-softmax  Distribution
arXiv:1611.04067, Title: Error Metrics for Learning Reliable Manifolds from Streaming Data
arXiv:1611.04069, Title: Low-rank and Adaptive Sparse Signal (LASSI) Models for Highly  Accelerated Dynamic Imaging
arXiv:1611.04149, Title: Accelerated Variance Reduced Block Coordinate Descent
arXiv:1611.04158, Title: Tests for scale changes based on pairwise differences
arXiv:1611.04208, Title: Joint mean and covariance estimation with unreplicated matrix-variate  data
arXiv:1611.04218, Title: Preference Completion from Partial Rankings
arXiv:1611.04248, Title: Asymptotic Inference for AR(1) Penal Data
arXiv:1611.04323, Title: Central limit theorem and bootstrap procedure for Wasserstein's  variations with an application to structural relationships between  distributions
arXiv:1611.04333, Title: Fisher Information Framework for Time Series Modeling
arXiv:1611.04365, Title: Maximum likelihood estimation of covariances of elliptically symmetric  distributions
arXiv:1611.04411, Title: Secondary Phenotype Analysis in Ascertained Family Designs: Application  to the Leiden Longevity Study
arXiv:1611.04416, Title: On numerical approximation schemes for expectation propagation
arXiv:1611.04460, Title: Predictive, finite-sample model choice for time series under  stationarity and non-stationarity
arXiv:1611.04473, Title: Simultaneous detection and estimation of trait associations with genomic  phenotypes
arXiv:1611.04488, Title: Generative Models and Model Criticism via Optimized Maximum Mean  Discrepancy
arXiv:1611.04499, Title: Post Training in Deep Learning with Last Kernel
arXiv:1611.04500, Title: Deep Learning with Sets and Point Clouds
arXiv:1611.04505, Title: Marčenko-Pastur Law for Kendall's Tau
arXiv:1611.04513, Title: Strong approximations for the $p$-fold integrated empirical process with  applications to statistical tests
arXiv:1611.04537, Title: Multiscale scanning in inverse problems
arXiv:1611.04538, Title: Recursive partitioning and multi-scale modeling on conditional densities
arXiv:1611.04561, Title: Splitting matters: how monotone transformation of predictor variables  may improve the predictions of decision tree models
arXiv:1611.04619, Title: Two Sample Order Free Trend Inference with an Application in Plant  Physiology
arXiv:1611.04638, Title: Weak Signal Identification and Inference in Penalized Model Selection
arXiv:1611.04696, Title: Genomic Region Detection via Spatial Convex Clustering
arXiv:1611.04701, Title: Errors-in-variables models with dependent measurements
arXiv:1611.04709, Title: Recoverability of Joint Distribution from Missing Data
arXiv:1611.04765, Title: Large deviations for method-of-quantiles estimators of one-dimensional  parameters
arXiv:1611.04790, Title: Improved Particle Filters for Vehicle Localisation
arXiv:1611.04808, Title: The second-order analysis of marked spatio-temporal point processes,  with an application to earthquake data
arXiv:1611.04907, Title: Fitting MA(q) Models in the Closed Invertible Region
arXiv:1611.04908, Title: Asymptotic and bootstrap tests for subspace dimension
arXiv:1611.04913, Title: Total Variation Depth for Functional Data
arXiv:1611.04920, Title: Unsupervised Learning with Truncated Gaussian Graphical Models
arXiv:1611.05010, Title: Anchor-Free Correlated Topic Modeling: Identifiability and Algorithm
arXiv:1611.05117, Title: Estimation Theory Based Robust Phase Offset Estimation in the Presence  of Delay Attacks
arXiv:1611.05126, Title: Localized Coulomb Descriptors for the Gaussian Approximation Potential
arXiv:1611.05147, Title: A Lynden-Bell integral estimator for the tail index of right-truncated  data with a random threshold
arXiv:1611.05201, Title: Multiscale inference for multivariate deconvolution
arXiv:1611.05209, Title: Deep Variational Inference Without Pixel-Wise Reconstruction
arXiv:1611.05224, Title: A New Family of Divergences Originating from Model Adequacy Tests and  Application to Robust Statistical Inference
arXiv:1611.05289, Title: SpatialPack: Computing the Association Between Two Spatial Processes
arXiv:1611.05302, Title: A composite likelihood ratio approach to the analysis of correlated  binary data in genetic association studies
arXiv:1611.05344, Title: On composite likelihood in bivariate meta-analysis of diagnostic test  accuracy studies
arXiv:1611.05401, Title: Bootstrapping and Sample Splitting For High-Dimensional, Assumption-Free  Inference
arXiv:1611.05405, Title: Correcting biased observation model error in data assimilation
arXiv:1611.05407, Title: A Semidefinite Program for Structured Blockmodels
arXiv:1611.05410, Title: Big Outliers Versus Heavy Tails: what to use?
arXiv:1611.05420, Title: Strong approximation for the deviation of kernel copula estimators
arXiv:1611.05433, Title: ROS Regression: Integrating Regularization and Optimal Scaling  Regression
arXiv:1611.05469, Title: Embedding Projector: Interactive Visualization and Interpretation of  Embeddings
arXiv:1611.05487, Title: Algebraic multigrid support vector machines
arXiv:1611.05509, Title: Bayesian Semiparametric Mixed Effects Markov Chains
arXiv:1611.05550, Title: $e$PCA: High Dimensional Exponential Family PCA
arXiv:1611.05559, Title: Boosting Variational Inference
arXiv:1611.05602, Title: Bayesian inference for multivariate extreme value distributions
arXiv:1611.05605, Title: Approximate Negative-Binomial Confidence Intervals: Asbestos Fiber  Counts
arXiv:1611.05668, Title: On Affine Invariant $L_p$ Depth Classifiers based on an Adaptive Choice  of $p$
arXiv:1611.05699, Title: The $β$-model for Random Graphs --- Regression, Cramér-Rao Bounds,  and Hypothesis Testing
arXiv:1611.05722, Title: GENESIM: genetic extraction of a single, interpretable model
arXiv:1611.05780, Title: Gap Safe screening rules for sparsity enforcing penalties
arXiv:1611.05788, Title: Data Science in Service of Performing Arts: Applying Machine Learning to  Predicting Audience Preferences
arXiv:1611.05817, Title: Nothing Else Matters: Model-Agnostic Explanations By Identifying  Prediction Invariance
arXiv:1611.05838, Title: A smooth transition from Wishart to GOE
arXiv:1611.05843, Title: Contributed Discussion to Bayesian Solution Uncertainty Quantification  for Differential Equations
arXiv:1611.05902, Title: Practical heteroskedastic Gaussian process modeling for large simulation  experiments
arXiv:1611.05909, Title: Comparison of Bayesian and Frequentist Multiplicity Correction For  Testing Mutually Exclusive Hypotheses Under Data Dependence
arXiv:1611.05917, Title: Maximum a Posteriori Estimators as a Limit of Bayes Estimators
arXiv:1611.05923, Title: "Influence Sketching": Finding Influential Samples In Large-Scale  Regressions
arXiv:1611.05934, Title: Increasing the Interpretability of Recurrent Neural Networks Using  Hidden Markov Models
arXiv:1611.05940, Title: Finding Alternate Features in Lasso
arXiv:1611.06034, Title: Asymptotic Theory of the Sparse Group LASSO
arXiv:1611.06066, Title: Deriving reproducible biomarkers from multi-site resting-state data: An  Autism-based example
arXiv:1611.06080, Title: A Generalized Stochastic Variational Bayesian Hyperparameter Learning  Framework for Sparse Spectrum Gaussian Process Regression
arXiv:1611.06094, Title: Generalizing diffuse interface methods on graphs: non-smooth potentials  and hypergraphs
arXiv:1611.06129, Title: On a goodness of fit test for the Cauchy distribution
arXiv:1611.06148, Title: Compacting Neural Network Classifiers via Dropout Training
arXiv:1611.06168, Title: On $p$-values
arXiv:1611.06173, Title: Empirical risk minimization and complexity of dynamical models
arXiv:1611.06175, Title: Learning Interpretability for Visualizations using Adapted Cox Models  through a User Experiment
arXiv:1611.06188, Title: Variable Computation in Recurrent Neural Networks
arXiv:1611.06208, Title: Method of Divide-and-Combine in Regularised Generalised Linear Models  for Big Data
arXiv:1611.06213, Title: GaDei: On Scale-up Training As A Service For Deep Learning
arXiv:1611.06217, Title: Specification Tests for the Propensity Score
arXiv:1611.06221, Title: Theoretical Aspects of Cyclic Structural Causal Models
arXiv:1611.06265, Title: Deep Clustering and Conventional Networks for Music Separation: Stronger  Together
arXiv:1611.06304, Title: Testing for unobserved heterogeneous treatment effects
arXiv:1611.06310, Title: Local minima in training of neural networks
arXiv:1611.06350, Title: Multi-study Factor Analysis
arXiv:1611.06353, Title: Cone distribution functions and quantiles for multivariate random  variables
arXiv:1611.06381, Title: Change-point analysis in frequency domain for chronological data
arXiv:1611.06399, Title: Fractional Gaussian noise: Prior specification and model comparison
arXiv:1611.06408, Title: The Classification Permutation Test: A Nonparametric Test for Equality  of Multivariate Distributions
arXiv:1611.06426, Title: Conservative Contextual Linear Bandits
arXiv:1611.06534, Title: Linear Thompson Sampling Revisited
arXiv:1611.06545, Title: Stop the tests: Opinion bias and statistical tests
arXiv:1611.06575, Title: A maximum smoothed likelihood based estimation for two component  semiparametric density mixtures with a known component
arXiv:1611.06585, Title: Variational Boosting: Iteratively Refining Posterior Approximations
arXiv:1611.06649, Title: High-Dimensional Bayesian Regularised Regression with the BayesReg  Package
arXiv:1611.06652, Title: Scalable Adaptive Stochastic Optimization Using Random Projections
arXiv:1611.06653, Title: SIMEX estimation for single-index model with covariate measurement error
arXiv:1611.06655, Title: Sparse Sliced Inverse Regression Via Lasso
arXiv:1611.06670, Title: Error analysis of regularized least-square regression with Fredholm  kernel
arXiv:1611.06686, Title: Scalable Approximations for Generalized Linear Problems
arXiv:1611.06713, Title: Is Gun Violence Contagious?
arXiv:1611.06714, Title: On the Monotonicity of the Copula Entropy
arXiv:1611.06715, Title: Pitfalls in testing with linear regression model by OLS
arXiv:1611.06727, Title: Pseudo-likelihood and bootstrapped pseudo-likelihood inference in  logistic regression model with misclassified responses
arXiv:1611.06739, Title: Simultaneous Control of All False Discovery Proportions in Large-Scale  Multiple Hypothesis Testing
arXiv:1611.06740, Title: Variational Fourier features for Gaussian processes
arXiv:1611.06744, Title: Convergence rate of eigenvector empirical spectral distribution of large  Wigner matrices
arXiv:1611.06752, Title: Asymptotic Behaviour of Truncated Stochastic Approximation Procedures
arXiv:1611.06753, Title: Shrinkage estimation of covariance matrix for portfolio choice with high  frequency data
arXiv:1611.06800, Title: MDL-motivated compression of GLM ensembles increases interpretability  and retains predictive power
arXiv:1611.06818, Title: Functional Data Analysis using a Topological Summary Statistic: the  Smooth Euler Characteristic Transform
arXiv:1611.06828, Title: The Mann-Whitney U-statistic for $α$-dependent sequences
