arXiv:1703.06272, Title: An Automated Auto-encoder Correlation-based Health-Monitoring and  Prognostic Method for Machine Bearings
arXiv:1703.06324, Title: Deep Tensor Encoding
arXiv:1703.06359, Title: Fully symmetric kernel quadrature
arXiv:1703.06367, Title: Optimal and Myopic Information Acquisition
arXiv:1703.06513, Title: Bernoulli Rank-$1$ Bandits for Click Feedback
arXiv:1703.06645, Title: A Preferential Attachment Paradox: How Preferential Attachment Combines  with Growth to Produce Networks with Log-normal In-degree Distributions
arXiv:1703.06670, Title: The Same Analysis Approach: Practical protection against the pitfalls of  novel neuroimaging analysis methods
arXiv:1703.06692, Title: QMDP-Net: Deep Learning for Planning under Partial Observability
arXiv:1703.06700, Title: Independence clustering (without a matrix)
arXiv:1703.06748, Title: Tactics of Adversarial Attack on Deep Reinforcement Learning Agents
arXiv:1703.06777, Title: On the Use of Default Parameter Settings in the Empirical Evaluation of  Classification Algorithms
arXiv:1703.06807, Title: Guaranteed Sufficient Decrease for Variance Reduced Stochastic Gradient  Descent
arXiv:1703.06857, Title: On the Limitation of Convolutional Neural Networks in Recognizing  Negative Images
arXiv:1703.06891, Title: Dance Dance Convolution
arXiv:1703.06933, Title: Fast Radio Map Construction and Position Estimation via Direct Mapping  for WLAN Indoor Localization System
arXiv:1703.06934, Title: Ensemble representation learning: an analysis of fitness and survival  for wrapper-based genetic programming methods
arXiv:1703.06990, Title: Metalearning for Feature Selection
arXiv:1703.07026, Title: Cross-modal Deep Metric Learning with Multi-task Regularization
arXiv:1703.07027, Title: Nonparametric Variational Auto-encoders for Hierarchical Representation  Learning
arXiv:1703.07047, Title: High-Resolution Breast Cancer Screening with Multi-View Deep  Convolutional Neural Networks
arXiv:1703.07131, Title: Knowledge distillation using unlabeled mismatched images
arXiv:1703.07255, Title: ZM-Net: Real-time Zero-shot Image Manipulation Network
arXiv:1703.07303, Title: Sequential Detection of Three-Dimensional Signals under Dependent Noise
arXiv:1703.07309, Title: Phytoplankton Hotspot Prediction With an Unsupervised Spatial Community  Model
arXiv:1703.07345, Title: On The Projection Operator to A Three-view Cardinality Constrained Set
arXiv:1703.07355, Title: An Army of Me: Sockpuppets in Online Discussion Communities
arXiv:1703.07370, Title: REBAR: Low-variance, unbiased gradient estimates for discrete latent  variable models
arXiv:1703.07408, Title: Maximum a posteriori estimation through simulated annealing for binary  asteroid orbit determination
arXiv:1703.07473, Title: Episode-Based Active Learning with Bayesian Neural Networks
arXiv:1703.07607, Title: A probabilistic approach to emission-line galaxy classification
arXiv:1703.07625, Title: Clustering for Different Scales of Measurement - the Gap-Ratio Weighted  K-means Algorithm
arXiv:1703.07698, Title: Characterization of Deterministic and Probabilistic Sampling Patterns  for Finite Completability of Low Tensor-Train Rank Tensor
arXiv:1703.07710, Title: Unifying PAC and Regret: Uniform PAC Bounds for Episodic Reinforcement  Learning
arXiv:1703.07754, Title: Direct Acoustics-to-Word Models for English Conversational Speech  Recognition
arXiv:1703.07809, Title: Empirical Risk Minimization as Parameter Choice Rule for General Linear  Regularization Methods
arXiv:1703.07830, Title: Randomized Kernel Methods for Least-Squares Support Vector Machines
arXiv:1703.07879, Title: How to avoid the curse of dimensionality: scalability of particle  filters with and without importance weights
arXiv:1703.07928, Title: Self corrective Perturbations for Semantic Segmentation and  Classification
arXiv:1703.07940, Title: Unsupervised Basis Function Adaptation for Reinforcement Learning
arXiv:1703.07948, Title: Fast Stochastic Variance Reduced Gradient Method with Momentum  Acceleration for Machine Learning
arXiv:1703.08071, Title: Quantifying and suppressing ranking bias in a large citation network
arXiv:1703.08190, Title: MSE estimates for multitaper spectral estimation and off-grid  compressive sensing
arXiv:1703.08254, Title: Improved NN-JPDAF for Joint Multiple Target Tracking and Feature  Extraction
arXiv:1703.08267, Title: A Nonconvex Splitting Method for Symmetric Nonnegative Matrix  Factorization: Convergence Analysis and Optimality
arXiv:1703.08383, Title: Smart Augmentation - Learning an Optimal Data Augmentation Strategy
arXiv:1703.08403, Title: Asymmetric Learning Vector Quantization for Efficient Nearest Neighbor  Classification in Dynamic Time Warping Spaces
arXiv:1703.08570, Title: Stochastic Methods for Composite and Weakly Convex Optimization Problems
arXiv:1703.08581, Title: Sequence-to-Sequence Models Can Directly Translate Foreign Speech
arXiv:1703.08667, Title: Exploration--Exploitation in MDPs with Options
arXiv:1703.08705, Title: Comparing Rule-Based and Deep Learning Models for Patient Phenotyping
arXiv:1703.08710, Title: Count-ception: Counting by Fully Convolutional Redundant Counting
arXiv:1703.08729, Title: Solving SDPs for synchronization and MaxCut problems via the  Grothendieck inequality
arXiv:1703.08816, Title: Uncertainty quantification in graph-based classification of high  dimensional data
arXiv:1703.08831, Title: Token-based Function Computation with Memory
arXiv:1703.08954, Title: Exact and approximate limit behaviour of the Yule tree's cophenetic  index
arXiv:1703.09074, Title: Randomized CP Tensor Decomposition
arXiv:1703.09244, Title: Adversarial Source Identification Game with Corrupted Training
arXiv:1703.09310, Title: Adaptive Simulation-based Training of AI Decision-makers using Bayesian  Optimization
arXiv:1703.09372, Title: Parameter estimation for fractional Ornstein-Uhlenbeck processes of  general Hurst parameter
arXiv:1703.09477, Title: Convergence of the Forward-Backward Algorithm: Beyond the Worst Case  with the Help of Geometry
arXiv:1703.09570, Title: A Tidy Data Model for Natural Language Processing using cleanNLP
arXiv:1703.09580, Title: Early Stopping without a Validation Set
arXiv:1703.09646, Title: Hybrid Clustering based on Content and Connection Structure using Joint  Nonnegative Matrix Factorization
arXiv:1703.09700, Title: Inverse Reinforcement Learning from Summary Data
arXiv:1703.09710, Title: Fast and scalable Gaussian process modeling with applications to  astronomical time series
arXiv:1703.09947, Title: Efficient Private ERM for Smooth Objectives
arXiv:1703.10034, Title: Probabilistic Line Searches for Stochastic Optimization
arXiv:1703.10127, Title: Priv'IT: Private and Sample Efficient Identity Testing
arXiv:1703.10146, Title: Community detection and stochastic block models: recent developments
arXiv:1703.10342, Title: Efficient Benchmarking of Algorithm Configuration Procedures via  Model-Based Surrogates
arXiv:1703.10355, Title: From Deep to Shallow: Transformations of Deep Rectifier Networks
arXiv:1703.10423, Title: Minimum energy path calculations with Gaussian process regression
arXiv:1703.10444, Title: On Fundamental Limits of Robust Learning
arXiv:1703.10545, Title: FairJudge: Trustworthy User Prediction in Rating Platforms
arXiv:1703.10603, Title: Atomic Convolutional Networks for Predicting Protein-Ligand Binding  Affinity
arXiv:1703.10663, Title: Near Perfect Protein Multi-Label Classification with Deep Neural  Networks
arXiv:1703.10717, Title: BEGAN: Boundary Equilibrium Generative Adversarial Networks
arXiv:1703.10722, Title: Factorization tricks for LSTM networks
arXiv:1703.10740, Title: Fundamental Conditions for Low-CP-Rank Tensor Completion
arXiv:1703.10761, Title: Universal Scalable Robust Solvers from Computational Information Games  and fast eigenspace adapted Multiresolution Analysis
arXiv:1703.10893, Title: Audio-Visual Speech Enhancement Using Multimodal Deep Convolutional  Neural Networks
arXiv:1703.10951, Title: Comparison of multi-task convolutional neural network (MT-CNN) and a few  other methods for toxicity prediction
arXiv:1703.07950, Title: Failures of Gradient-Based Deep Learning
arXiv:1703.00573, Title: Generalization and Equilibrium in Generative Adversarial Nets (GANs)
arXiv:1703.04070, Title: Prediction and Control with Temporal Segment Models
arXiv:1703.00862, Title: Binarized Convolutional Landmark Localizers for Human Pose Estimation  and Face Alignment with Limited Resources
arXiv:1703.08044, Title: Multilinear compressive sensing and an application to convolutional  linear networks
arXiv:1703.00645, Title: TumorNet: Lung Nodule Characterization Using Multi-View Convolutional  Neural Network with Gaussian Process
