arXiv:1706.05350, Title: L2 Regularization versus Batch and Weight Normalization
arXiv:1706.05358, Title: Local Feature Descriptor Learning with Adaptive Siamese Network
arXiv:1706.05402, Title: A Conceptual Model for Holistic Classification of Insider
arXiv:1706.05477, Title: Bayesian Conditional Generative Adverserial Networks
arXiv:1706.05507, Title: Variants of RMSProp and Adagrad with Logarithmic Regret Bounds
arXiv:1706.05552, Title: Performance Bounds for Finite Moving Average Change Detection:  Application to Global Navigation Satellite Systems
arXiv:1706.05563, Title: Fatiguing STDP: Learning from Spike-Timing Codes in the Presence of Rate  Codes
arXiv:1706.05565, Title: Towards Neural Phrase-based Machine Translation
arXiv:1706.05568, Title: On the statistical inconsistency of Maximum Parsimony for $k$-tuple-site  data
arXiv:1706.05585, Title: Accelerating Innovation Through Analogy Mining
arXiv:1706.05598, Title: On the Optimization Landscape of Tensor Decompositions
arXiv:1706.05599, Title: Sample, computation vs storage tradeoffs for classification using tensor  subspace models
arXiv:1706.05683, Title: Sparse Neural Networks Topologies
arXiv:1706.05730, Title: Addressing Item-Cold Start Problem in Recommendation Systems using Model  Based Approach and Deep Learning
arXiv:1706.05736, Title: Fixed-Rank Approximation of a Positive-Semidefinite Matrix from  Streaming Data
arXiv:1706.05738, Title: Fourier-Based Testing for Families of Distributions
arXiv:1706.05800, Title: Componentwise different tail solutions for bivariate stochastic  recurrence equations -- with application to GARCH(1,1) processes --
arXiv:1706.05928, Title: Modified Frank-Wolfe Algorithm for Enhanced Sparsity in Support Vector  Machine Classifiers
arXiv:1706.05966, Title: Deep Counterfactual Networks with Propensity-Dropout
arXiv:1706.06060, Title: Consistent feature attribution for tree ensembles
arXiv:1706.06089, Title: Bayesian multi--dipole localization and uncertainty quantification from  simultaneous EEG and MEG recordings
arXiv:1706.06182, Title: Bernoulli Correlations and Cut Polytopes
arXiv:1706.06195, Title: Unsure When to Stop? Ask Your Semantic Neighbors
arXiv:1706.06216, Title: Dualing GANs
arXiv:1706.06230, Title: A Bayesian algorithm for detecting identity matches and fraud in image  databases
arXiv:1706.06274, Title: Learning Graphical Models Using Multiplicative Weights
arXiv:1706.06341, Title: SPLBoost: An Improved Robust Boosting Algorithm Based on Self-paced  Learning
arXiv:1706.06348, Title: Frank-Wolfe Optimization for Symmetric-NMF under Simplicial Constraint
arXiv:1706.06383, Title: Programmable Agents
arXiv:1706.06428, Title: An online sequence-to-sequence model for noisy speech recognition
arXiv:1706.06491, Title: Data-Efficient Reinforcement Learning with Probabilistic Model  Predictive Control
arXiv:1706.06529, Title: A Divergence Bound for Hybrids of MCMC and Variational Inference and an  Application to Langevin Dynamics and SGVI
arXiv:1706.06549, Title: Inference in Deep Networks in High Dimensions
arXiv:1706.06551, Title: Grounded Language Learning in a Simulated 3D World
arXiv:1706.06569, Title: A Unified Approach to Adaptive Regularization in Online and Stochastic  Optimization
arXiv:1706.06617, Title: Observational Learning by Reinforcement Learning
arXiv:1706.06619, Title: Most Ligand-Based Classification Benchmarks Reward Memorization Rather  than Generalization
arXiv:1706.06664, Title: Arrays of (locality-sensitive) Count Estimators (ACE): High-Speed  Anomaly Detection via Cache Lookups
arXiv:1706.06763, Title: Unlocking datasets by calibrating populations of models to data density:  a study in atrial electrophysiology
arXiv:1706.06838, Title: A giant with feet of clay: on the validity of the data that feed machine  learning in medicine
arXiv:1706.06859, Title: Analysis of dropout learning regarded as ensemble learning
arXiv:1706.06869, Title: Adaptive Multilevel Monte Carlo Approximation of Distribution Functions
arXiv:1706.06941, Title: Concept Drift and Anomaly Detection in Graph Streams
arXiv:1706.06974, Title: The Theory is Predictive, but is it Complete? An Application to Human  Perception of Randomness
arXiv:1706.06996, Title: Statistical Inferences for Polarity Identification in Natural Language
arXiv:1706.07001, Title: Improved Optimization of Finite Sums with Minibatch Stochastic Variance  Reduced Proximal Iterations
arXiv:1706.07147, Title: A Useful Motif for Flexible Task Learning in an Embodied Two-Dimensional  Visual Environment
arXiv:1706.07193, Title: Continuum Limit of Posteriors in Graph Bayesian Inverse Problems
arXiv:1706.07206, Title: Explaining Recurrent Neural Network Predictions in Sentiment Analysis
arXiv:1706.07466, Title: Identification of Credit Risk Based on Cluster Analysis of Account  Behaviours
arXiv:1706.07535, Title: Efficient Approximate Solutions to Mutual Information Based Global  Feature Selection
arXiv:1706.07581, Title: Cross-validation failure: small sample sizes lead to large error bars
arXiv:1706.07584, Title: Global algorithms for maximal eigenpair
arXiv:1706.07650, Title: Semi-discrete optimal transport - the case p=1
arXiv:1706.07841, Title: Time Stretch Inspired Computational Imaging
arXiv:1706.07881, Title: On Sampling Strategies for Neural Network-based Collaborative Filtering
arXiv:1706.07896, Title: Reservoir Computing on the Hypersphere
arXiv:1706.07979, Title: Methods for Interpreting and Understanding Deep Neural Networks
arXiv:1706.08001, Title: Temporal-related Convolutional-Restricted-Boltzmann-Machine capable of  learning relational order via reinforcement learning procedure?
arXiv:1706.08041, Title: Sparsity Enables Estimation of both Subcortical and Cortical Activity  from MEG and EEG
arXiv:1706.08146, Title: Fast and Accurate Low-Rank Factorization of Compressively-Sensed Data
arXiv:1706.08167, Title: Phase retrieval using alternating minimization in a batch setting
arXiv:1706.08470, Title: Efficiency of quantum versus classical annealing in non-convex learning  problems
arXiv:1706.08498, Title: Spectrally-normalized margin bounds for neural networks
arXiv:1706.08500, Title: GANs Trained by a Two Time-Scale Update Rule Converge to a Local Nash  Equilibrium
arXiv:1706.08580, Title: Learning Local Feature Aggregation Functions with Backpropagation
arXiv:1706.08672, Title: Fast and robust tensor decomposition with applications to dictionary  learning
arXiv:1706.08811, Title: Forecasting and Granger Modelling with Non-linear Dynamical Dependencies
arXiv:1706.08839, Title: Preserving Differential Privacy in Convolutional Deep Belief Networks
arXiv:1706.08921, Title: Invariant components of synergy, redundancy, and unique information  among three variables
arXiv:1706.08934, Title: Reexamining Low Rank Matrix Factorization for Trace Norm Regularization
arXiv:1706.09060, Title: Multi-armed Bandit Problems with Strategic Arms
arXiv:1706.09152, Title: Generative Bridging Network in Neural Sequence Prediction
arXiv:1706.09200, Title: Energy-Based Sequence GANs for Recommendation and Their Connection to  Imitation Learning
arXiv:1706.09302, Title: Deep Learning Based Large-Scale Automatic Satellite Crosswalk  Classification
arXiv:1706.09451, Title: (Machine) Learning to Do More with Less
arXiv:1706.09773, Title: Interpretability via Model Extraction
arXiv:1706.09847, Title: Runaway Feedback Loops in Predictive Policing
arXiv:1706.09916, Title: Graph Convolution: A High-Order and Adaptive Approach
arXiv:1706.09993, Title: Phase Retrieval via Randomized Kaczmarz: Theoretical Guarantees
arXiv:1706.10129, Title: Electric propulsion reliability: statistical analysis of on-orbit  anomalies and comparative analysis of electric versus chemical propulsion  failure rates
arXiv:1706.10172, Title: Prepaid or Postpaid? That is the question. Novel Methods of Subscription  Type Prediction in Mobile Phone Services
arXiv:1706.10180, Title: Regret-based Selection for Sparse Dynamic Portfolios
arXiv:1706.10239, Title: Towards Understanding Generalization of Deep Learning: Perspective of  Loss Landscapes
arXiv:1706.10283, Title: Bolt: Accelerated Data Mining with Fast Vector Compression
arXiv:1706.10295, Title: Noisy Networks for Exploration
arXiv:1706.03446, Title: Deep EHR: A Survey of Recent Advances in Deep Learning Techniques for  Electronic Health Record (EHR) Analysis
arXiv:1706.06969, Title: Comparing deep neural networks against humans: object recognition when  the signal gets weaker
