arXiv:1706.00062, Title: A Latent Trait Model for Multivariate Longitudinal Data With Two Sources  of Measurement Error
arXiv:1706.00090, Title: Lower Bounds on Regret for Noisy Gaussian Process Bandit Optimization
arXiv:1706.00098, Title: Bayesian $l_0$ Regularized Least Squares
arXiv:1706.00103, Title: From patterned response dependency to structured covariate dependency:  categorical-pattern-matching
arXiv:1706.00122, Title: Assessment of Future Changes in Intensity-Duration-Frequency Curves for  Southern Ontario using North American (NA)-CORDEX Models with Nonstationary  Methods
arXiv:1706.00136, Title: Scalable Generalized Linear Bandits: Online Computation and Hashing
arXiv:1706.00182, Title: Efficient learning with robust gradient descent
arXiv:1706.00244, Title: Supervised Quantile Normalisation
arXiv:1706.00289, Title: On the Bernstein-Von Mises Theorem for High Dimensional Nonlinear  Bayesian Inverse Problems
arXiv:1706.00292, Title: Learning Generative Models with Sinkhorn Divergences
arXiv:1706.00326, Title: Discriminative k-shot learning using probabilistic models
arXiv:1706.00378, Title: New goodness-of-fit diagnostics for conditional discrete response models
arXiv:1706.00400, Title: Learning Disentangled Representations with Semi-Supervised Deep  Generative Models
arXiv:1706.00473, Title: Deep Learning: A Bayesian Perspective
arXiv:1706.00514, Title: Selective Inference for Change Point Detection in Multi-dimensional  Sequences
arXiv:1706.00544, Title: Bias-Variance Tradeoff of Graph Laplacian Regularizer
arXiv:1706.00599, Title: On a Class of Objective Priors from Scoring Rules
arXiv:1706.00636, Title: WiFi based trajectory alignment, calibration and easy site survey using  smart phones and foot-mounted IMUs
arXiv:1706.00641, Title: Improved high-dimensional prediction with Random Forests by the use of  co-data
arXiv:1706.00666, Title: Tyler shape depth
arXiv:1706.00679, Title: Testing Gaussian Process with Applications to Super-Resolution
arXiv:1706.00689, Title: Fast approximate Bayesian inference for stable differential equation  models
arXiv:1706.00705, Title: Streaming Bayesian inference: theoretical limits and mini-batch  approximate message-passing
arXiv:1706.00729, Title: Parameter identification in Markov chain choice models
arXiv:1706.00824, Title: Comparative Performance Analysis of the Cumulative Sum Chart and the  Shiryaev-Roberts Procedure for Detecting Changes in Autocorrelated Data
arXiv:1706.00850, Title: Minimax Optimal Rates of Estimation in Functional ANOVA Models with  Derivatives
arXiv:1706.00853, Title: Multivariate initial sequence estimators in Markov chain Monte Carlo
arXiv:1706.00857, Title: Homogeneity Pursuit in Single Index Models based Panel Data Analysis
arXiv:1706.00865, Title: Inference for penalized spline regression: Improving confidence  intervals by reducing the penalty
arXiv:1706.00886, Title: Controlling Sources of Inaccuracy in Stochastic Kriging
arXiv:1706.00959, Title: A Bayesian General Linear Modeling Approach to Cortical Surface fMRI  Data Analysis
arXiv:1706.00961, Title: Rates of estimation for determinantal point processes
arXiv:1706.01031, Title: A note on conditional versus joint unconditional weak convergence in  bootstrap consistency results
arXiv:1706.01074, Title: Asymptotic Goodness-of-Fit Tests for Point Processes Based on Scaled  Empirical K-Functions
arXiv:1706.01083, Title: In elections, irrelevant alternatives provide relevant data
arXiv:1706.01099, Title: Latent Estimation of GDP, GDP per capita, and Population from Historic  and Contemporary Sources
arXiv:1706.01109, Title: InfiniteBoost: building infinite ensembles with gradient descent
arXiv:1706.01124, Title: Optimal learning via local entropies and sample compression
arXiv:1706.01151, Title: Deep MIMO Detection
arXiv:1706.01155, Title: High-dimensional GARCH process segmentation with an application to  Value-at-Risk
arXiv:1706.01158, Title: Graphical Nonconvex Optimization for Optimal Estimation in Gaussian  Graphical Models
arXiv:1706.01175, Title: Optimal Rates for Community Estimation in the Weighted Stochastic Block  Model
arXiv:1706.01191, Title: The Likelihood Ratio Test in High-Dimensional Logistic Regression Is  Asymptotically a Rescaled Chi-Square
arXiv:1706.01240, Title: On the Identifiability of Diagnostic Classification Models
arXiv:1706.01242, Title: Bayesian LSTMs in medicine
arXiv:1706.01252, Title: Empirical Bayes Matrix Completion
arXiv:1706.01291, Title: On the sample mean after a group sequential trial
arXiv:1706.01338, Title: Understanding the Learned Iterative Soft Thresholding Algorithm with  matrix factorization
arXiv:1706.01357, Title: Characterization of multivariate Bernoulli distributions with given  margins
arXiv:1706.01389, Title: Mendelian Randomization when Many Instruments are Invalid: Hierarchical  Empirical Bayes Estimation
arXiv:1706.01418, Title: Learning Whenever Learning is Possible: Universal Learning under General  Stochastic Processes
arXiv:1706.01419, Title: Asymptotically normal estimators for Zipf's law
arXiv:1706.01426, Title: Double Sparsity Kernel Learning with Automatic Variable Selection and  Data Extraction
arXiv:1706.01428, Title: A correspondence between thermodynamics and inference
arXiv:1706.01435, Title: Hamiltonian Monte Carlo Methods for Subset Simulation in Reliability  Analysis
arXiv:1706.01445, Title: Batched Large-scale Bayesian Optimization in High-dimensional Spaces
arXiv:1706.01478, Title: An optimal $(ε,δ)$-approximation scheme for the mean of  random variables with bounded relative variance
arXiv:1706.01498, Title: Stochastic Gradient Monomial Gamma Sampler
arXiv:1706.01507, Title: Density Deconvolution for Generalized Skew-Symmetric Distributions
arXiv:1706.01520, Title: The Convergence of Markov chain Monte Carlo Methods: From the Metropolis  method to Hamiltonian Monte Carlo
arXiv:1706.01566, Title: Open Loop Hyperparameter Optimization and Determinantal Point Processes
arXiv:1706.01584, Title: Multiple Object Tracking in Unknown Backgrounds with Labeled Random  Finite Sets
arXiv:1706.01591, Title: Fishnet Statistics for Strength Scaling of Nacreous Imbricated Lamellar  Materials
arXiv:1706.01625, Title: Understanding Betting Strategy
arXiv:1706.01724, Title: Deep Latent Dirichlet Allocation with Topic-Layer-Adaptive Stochastic  Gradient Riemannian MCMC
arXiv:1706.01752, Title: Robust approximate Bayesian inference with an application to linear  mixed models
arXiv:1706.01778, Title: Sampling-based vs. Design-based Uncertainty in Regression Analysis
arXiv:1706.01807, Title: GAN and VAE from an Optimal Transport Point of View
arXiv:1706.01825, Title: Parallel and Distributed Thompson Sampling for Large-scale Accelerated  Exploration of Chemical Space
arXiv:1706.01833, Title: Online Adaptive Machine Learning Based Algorithm for Implied Volatility  Surface Modeling
arXiv:1706.01841, Title: Why Condorcet Consistency is Essential
arXiv:1706.01846, Title: Convergence analysis of the block Gibbs sampler for Bayesian probit  linear mixed models with improper priors
arXiv:1706.01852, Title: Contraction and uniform convergence of isotonic regression
arXiv:1706.01865, Title: Shape Parameter Estimation
arXiv:1706.01954, Title: Sparse causality network retrieval from short time series
arXiv:1706.01968, Title: Inference for heavy tailed stationary time series based on sliding  blocks
arXiv:1706.02046, Title: Conditional independence test for categorical data using Poisson  log-linear model
arXiv:1706.02052, Title: Are Saddles Good Enough for Deep Learning?
arXiv:1706.02093, Title: Cascade Ranking for Operational E-commerce Search
arXiv:1706.02104, Title: Loss Functions in Restricted Parameter Spaces and Their Bayesian  Applications
arXiv:1706.02142, Title: Variance bounding of delayed-acceptance kernels
arXiv:1706.02150, Title: A Bootstrap Lasso + Partial Ridge Method to Construct Confidence  Intervals for Parameters in High-dimensional Sparse Linear Models
arXiv:1706.02178, Title: Finite-dimensional approximation of Gaussian processes with inequality  constraints
arXiv:1706.02257, Title: Driver Action Prediction Using Deep (Bidirectional) Recurrent Neural  Network
arXiv:1706.02263, Title: Graph Convolutional Matrix Completion
arXiv:1706.02283, Title: Propensity score-based estimators with multiple error-prone covariates
arXiv:1706.02326, Title: Improving Variational Auto-Encoders using convex combination linear  Inverse Autoregressive Flow
arXiv:1706.02338, Title: Testing the simplifying assumption in high-dimensional vine copulas
arXiv:1706.02348, Title: Backward Pilot Strategy in Constrained Sampling Problems
arXiv:1706.02353, Title: Sparse Wavelet Estimation in Quantile Regression with Multiple  Functional Predictors
arXiv:1706.02380, Title: Multi-sample Estimation of Bacterial Composition Matrix in Metagenomics  Data
arXiv:1706.02410, Title: Convergence rates of least squares regression estimators with  heavy-tailed errors
arXiv:1706.02412, Title: A Robust Learning Algorithm for Regression Models Using Distributionally  Robust Optimization under the Wasserstein Metric
arXiv:1706.02429, Title: Fast and General Model Selection using Data Depth and Resampling
arXiv:1706.02480, Title: Forward Thinking: Building and Training Neural Networks One Layer at a  Time
arXiv:1706.02492, Title: Consistency Results for Stationary Autoregressive Processes with  Constrained Coefficients
arXiv:1706.02495, Title: The Generalized Cross Validation Filter
arXiv:1706.02496, Title: Context encoders as a simple but powerful extension of word2vec
arXiv:1706.02508, Title: Quantifying the recency of HIV infection using multiple longitudinal  biomarkers
arXiv:1706.02524, Title: Scaling up the Automatic Statistician: Scalable Structure Discovery  using Gaussian Processes
arXiv:1706.02527, Title: Exploiting routinely collected severe case data to monitor and predict  influenza outbreaks
arXiv:1706.02563, Title: Jeffreys priors for mixture estimation: properties and alternatives
arXiv:1706.02592, Title: Inference For High-Dimensional Split-Plot-Designs: A Unified Approach  for Small to Large Numbers of Factor Levels
arXiv:1706.02624, Title: Evidence synthesis for stochastic epidemic models
arXiv:1706.02633, Title: Real-valued (Medical) Time Series Generation with Recurrent Conditional  GANs
arXiv:1706.02649, Title: Kinetic energy choice in Hamiltonian/hybrid Monte Carlo
arXiv:1706.02675, Title: A new approach to hierarchical data analysis: Targeted maximum  likelihood estimation for the causal effect of a cluster-level exposure
arXiv:1706.02692, Title: The True Cost of Stochastic Gradient Langevin Dynamics
arXiv:1706.02744, Title: Avoiding Discrimination through Causal Reasoning
arXiv:1706.02754, Title: Statistically Characterizing the Electrical Parameters of the Grid  Transformers and Transmission Lines
arXiv:1706.02781, Title: Granger Causality Networks for Categorical Time Series
arXiv:1706.02795, Title: A Deep Causal Inference Approach to Measuring the Effects of Forming  Group Loans in Online Non-profit Microfinance Platform
arXiv:1706.02808, Title: A randomized Halton algorithm in R
arXiv:1706.02829, Title: Time Series Using Exponential Smoothing Cells
arXiv:1706.02858, Title: On rumour propagation among sceptics
arXiv:1706.02899, Title: Assessing the Performance of Deep Learning Algorithms for Newsvendor  Problem
arXiv:1706.02940, Title: Bayesian nonparametrics for stochastic epidemic models
arXiv:1706.02946, Title: On the role of the overall effect in exponential families
arXiv:1706.02972, Title: Probability, Statistics and Planet Earth, I: Geotemporal covariances
arXiv:1706.02986, Title: Monte-Carlo Tree Search by Best Arm Identification
arXiv:1706.02999, Title: Symmetry Learning for Function Approximation in Reinforcement Learning
arXiv:1706.03012, Title: Multi-rubric Models for Ordinal Spatial Data with Application to Online  Ratings from Yelp
arXiv:1706.03029, Title: Characterizations of multinormality and corresponding tests of fit,  including for Garch models
arXiv:1706.03078, Title: Group Invariance, Stability to Deformations, and Complexity of Deep  Convolutional Representations
arXiv:1706.03113, Title: DBSCAN: Optimal Rates For Density Based Clustering
arXiv:1706.03149, Title: An Expectation-Maximization Algorithm for the Fractal Inverse Problem
arXiv:1706.03156, Title: Functional principal variance component testing for a genetic  association study of HIV progression
arXiv:1706.03214, Title: A perturbation analysis of some Markov chains models with time-varying  parameters
arXiv:1706.03267, Title: An Alternative to EM for Gaussian Mixture Models: Batch and Stochastic  Riemannian Optimization
arXiv:1706.03277, Title: On the Interval-Based Dose-Finding Designs
arXiv:1706.03278, Title: AAA: Triple-adaptive Bayesian designs for the identification of optimal  dose combinations in dual-agent dose-finding trials
arXiv:1706.03343, Title: Bayesian Model Selection for Misspecified Models in Linear Regression
arXiv:1706.03353, Title: Low Complexity Gaussian Latent Factor Models and a Blessing of  Dimensionality
arXiv:1706.03369, Title: On the Sampling Problem for Kernel Quadrature
arXiv:1706.03373, Title: Multiple Instance Dictionary Learning for Beat-to-Beat Heart Rate  Monitoring from Ballistocardiograms
arXiv:1706.03388, Title: Quantifying statistical uncertainty in the attribution of human  influence on severe weather
arXiv:1706.03400, Title: Some Analysis of the Knockoff Filter and its Variants
arXiv:1706.03409, Title: Wilcoxon Rank-Based Tests for Clustered Data with R Package clusrank
arXiv:1706.03412, Title: Conformal k-NN Anomaly Detector for Univariate Data Streams
arXiv:1706.03415, Title: Inductive Conformal Martingales for Change-Point Detection
arXiv:1706.03423, Title: Image-Based Prognostics Using Penalized Tensor Regression
arXiv:1706.03442, Title: Do Steph Curry and Klay Thompson Have Hot Hands?
arXiv:1706.03461, Title: Meta-learners for Estimating Heterogeneous Treatment Effects using  Machine Learning
arXiv:1706.03462, Title: Efficient Test-based Variable Selection for High-dimensional Linear  Models
arXiv:1706.03471, Title: YellowFin and the Art of Momentum Tuning
arXiv:1706.03472, Title: Kernel method for persistence diagrams via kernel embedding and weight  factor
arXiv:1706.03490, Title: Distance Covariance in Metric Spaces: Non-Parametric Independence  Testing in Metric Spaces (Master's thesis)
arXiv:1706.03492, Title: Random Forests, Decision Trees, and Categorical Predictors: The "Absent  Levels" Problem
arXiv:1706.03533, Title: Recursive Multikernel Filters Exploiting Nonlinear Temporal Structure
arXiv:1706.03537, Title: Decentralized Clustering based on Robust Estimation and Hypothesis  Testing
arXiv:1706.03559, Title: Kernel partial least squares for stationary data
arXiv:1706.03591, Title: Fast Approximate Spectral Clustering for Dynamic Networks
arXiv:1706.03597, Title: Probabilistic partial least squares model: Identifiability, estimation  and application
arXiv:1706.03649, Title: Fractional Langevin Monte Carlo: Exploring Lévy Driven Stochastic  Differential Equations for Markov Chain Monte Carlo
arXiv:1706.03662, Title: Practical Gauss-Newton Optimisation for Deep Learning
arXiv:1706.03665, Title: Statistical properties of sketching algorithms
arXiv:1706.03671, Title: Fully-Automatic Multiresolution Idealization for Filtered Ion Channel  Recordings: Flickering Event Detection
arXiv:1706.03673, Title: Dealing with Integer-valued Variables in Bayesian Optimization with  Gaussian Processes
arXiv:1706.03678, Title: Ivanov-Regularised Least-Squares Estimators over Large RKHSs and Their  Interpolation Spaces
arXiv:1706.03741, Title: Deep reinforcement learning from human preferences
arXiv:1706.03768, Title: Causal Discovery in the Presence of Measurement Error: Identifiability  Conditions
arXiv:1706.03779, Title: General Latent Feature Models for Heterogeneous Datasets
arXiv:1706.03805, Title: Fiducial on a string
arXiv:1706.03850, Title: Adversarial Feature Matching for Text Generation
arXiv:1706.03862, Title: Closed-form mathematical expressions for the exponentiated  Cauchy-Rayleigh distribution
arXiv:1706.03883, Title: Multilevel Clustering via Wasserstein Means
arXiv:1706.03901, Title: Signed Sequential Rank CUSUMs
arXiv:1706.03922, Title: Analyzing the Robustness of Nearest Neighbors to Adversarial Examples
arXiv:1706.03938, Title: Efficient Bayesian inference for multivariate factor stochastic  volatility models with leverage
arXiv:1706.03953, Title: Efficient Bayesian estimation for flexible panel models for multivariate  outcomes: Impact of life events on mental health and excessive alcohol  consumption
arXiv:1706.03955, Title: A Note on the Relationship Between Conditional and Unconditional  Independence, and its Extensions for Markov Kernels
arXiv:1706.04032, Title: Mix & Match Hamiltonian Monte Carlo
arXiv:1706.04059, Title: Approximate Optimal Designs for Multivariate Polynomial Regression
arXiv:1706.04152, Title: Learning to Detect Sepsis with a Multitask Gaussian Process RNN  Classifier
arXiv:1706.04161, Title: Lost Relatives of the Gumbel Trick
arXiv:1706.04182, Title: Sequential rerandomization
arXiv:1706.04229, Title: Picking Winners: A Data Driven Approach to Evaluating the Quality of  Startup Companies
arXiv:1706.04241, Title: On Optimistic versus Randomized Exploration in Reinforcement Learning
arXiv:1706.04276, Title: On the risk of convex-constrained least squares estimators under  misspecification
arXiv:1706.04289, Title: Leveraging Node Attributes for Incomplete Relational Data
arXiv:1706.04336, Title: Predictive modelling of training loads and injury in Australian football
arXiv:1706.04394, Title: Spatio-Temporal Forecasting by Coupled Stochastic Differential  Equations: Applications to Solar Power
arXiv:1706.04416, Title: The ratio of normalizing constants for Bayesian graphical Gaussian model  selection
arXiv:1706.04440, Title: trackr: A Framework for Enhancing Discoverability and Reproducibility of  Data Visualizations and Other Artifacts in R
arXiv:1706.04572, Title: Deep Learning Methods for Efficient Large Scale Video Labeling
arXiv:1706.04632, Title: Stochastic Gradient MCMC Methods for Hidden Markov Models
arXiv:1706.04633, Title: Subjects classification from high-dimensional and small-sample size  datasets using a strategy based on Clustering Variables around Latent  Components (CLV) method
arXiv:1706.04643, Title: Bayesian analysis of accumulated damage models in lumber reliability
arXiv:1706.04651, Title: Spatial Regression and the Bayesian Filter
arXiv:1706.04668, Title: Weak convergence of quantile and expectile processes under general  assumptions
arXiv:1706.04677, Title: Gene Hunting with Knockoffs for Hidden Markov Models
arXiv:1706.04692, Title: Bias and high-dimensional adjustment in observational studies of peer  effects
arXiv:1706.04729, Title: Sequential detection of low-rank changes using extreme eigenvalues
arXiv:1706.04769, Title: Stochastic Training of Neural Networks via Successive Convex  Approximations
arXiv:1706.04780, Title: Average of Recentered Parallel MCMC for Big Data
arXiv:1706.04781, Title: Generalized Bouncy Particle Sampler
arXiv:1706.04857, Title: New bounds for the Probability of Causation in Mediation Analysis
arXiv:1706.04892, Title: Second-Order Kernel Online Convex Optimization with Adaptive Sketching
arXiv:1706.04918, Title: Robust Submodular Maximization: A Non-Uniform Partitioning Approach
arXiv:1706.04919, Title: Convergence diagnostics for MCMC draws of a categorical variable
arXiv:1706.04943, Title: Plus-Minus Player Ratings for Soccer
arXiv:1706.04969, Title: Latent Variable Modeling for the Microbiome
arXiv:1706.04983, Title: FreezeOut: Accelerate Training by Progressively Freezing Layers
arXiv:1706.04987, Title: Variational Approaches for Auto-Encoding Generative Adversarial Networks
arXiv:1706.05003, Title: Regularized Ordinal Regression and the ordinalNet R Package
arXiv:1706.05029, Title: Distance weighted discrimination of face images for gender  classification
arXiv:1706.05030, Title: On optimal tests for rotational symmetry against new classes of  hyperspherical distributions
arXiv:1706.05128, Title: A Quantile Estimate Based on Local Curve Fitting
arXiv:1706.05136, Title: Deep Generative Models for Relational Data with Side Information
arXiv:1706.05173, Title: The distance between a naive cumulative estimator and its least concave  majorant
arXiv:1706.05280, Title: Ancillarity-Sufficiency Interweaving Strategy (ASIS) for Boosting MCMC  Estimation of Stochastic Volatility Models
arXiv:1706.05305, Title: Sequential quasi-Monte Carlo: Introduction for Non-Experts, Dimension  Reduction, Application to Partly Observed Diffusion Processes
arXiv:1706.05331, Title: $\textsf{S}^3T$: An Efficient Score-Statistic for Spatio-Temporal  Surveillance
arXiv:1706.05335, Title: Unsupervised Domain Adaptation with Random Walks on Target Labelings
arXiv:1706.05374, Title: Expected Policy Gradients
arXiv:1706.05378, Title: A framework for Multi-A(rmed)/B(andit) testing with online FDR control
arXiv:1706.05394, Title: A Closer Look at Memorization in Deep Networks
arXiv:1706.05416, Title: Epidemiology of Objectively Measured Bedtime and Chronotype in the US  adolescents and adults: NHANES 2003-2006
arXiv:1706.05439, Title: Control Variates for Stochastic Gradient MCMC
arXiv:1706.05445, Title: A Stochastic Model for Short-Term Probabilistic Forecast of Solar  Photo-Voltaic Power
arXiv:1706.05446, Title: Inferring Tweedie Compound Poisson Mixed Models with Adversarial  Variational Bayes
arXiv:1706.05486, Title: Parametric Inference for Discretely Observed Subordinate Diffusions
arXiv:1706.05499, Title: Joint Mixability of Elliptical Distributions and Related Families
arXiv:1706.05510, Title: Statistical foundations for assessing the difference between the  classical and weighted-Gini betas
arXiv:1706.05528, Title: Adiabatic Quantum Computing for Binary Clustering
arXiv:1706.05544, Title: Rgtsvm: Support Vector Machines on a GPU in R
arXiv:1706.05566, Title: The Probability of Causation
arXiv:1706.05576, Title: Inferential results for a new measure of inequality
arXiv:1706.05612, Title: Kernel Two-Sample Hypothesis Testing Using Kernel Set Classification
arXiv:1706.05661, Title: Adaptive Bayesian Power Spectrum Analysis of Multivariate Nonstationary  Time Series
arXiv:1706.05678, Title: A large-scale analysis of racial disparities in police stops across the  United States
arXiv:1706.05717, Title: Bayesian Analysis of Censored Spatial Data Based on a Non-Gaussian Model
arXiv:1706.05745, Title: Statistical Inference based on Bridge Divergences
arXiv:1706.05749, Title: Dex: Incremental Learning for Complex Environments in Deep Reinforcement  Learning
arXiv:1706.05801, Title: An a Priori Exponential Tail Bound for k-Folds Cross-Validation
arXiv:1706.05806, Title: SVCCA: Singular Vector Canonical Correlation Analysis for Deep Learning  Dynamics and Interpretability
arXiv:1706.05876, Title: Weighted likelihood estimation of multivariate location and scatter
arXiv:1706.05940, Title: Detection of Block-Exchangeable Structure in Large-Scale Correlation  Matrices
arXiv:1706.05982, Title: On Heckits, LATE, and Numerical Equivalence
arXiv:1706.06006, Title: Combining Information from Multiple Forecasters: Inefficiency of Central  Tendency
arXiv:1706.06066, Title: On Quadratic Convergence of DC Proximal Newton Algorithm for Nonconvex  Sparse Learning in High Dimensions
arXiv:1706.06083, Title: Towards Deep Learning Models Resistant to Adversarial Attacks
arXiv:1706.06136, Title: On comparing clusterings: an element-centric framework unifies overlaps  and hierarchy
arXiv:1706.06150, Title: A Comparison of Resampling and Recursive Partitioning Methods in Random  Forest for Estimating the Asymptotic Variance Using the Infinitesimal  Jackknife
arXiv:1706.06159, Title: Causal Dantzig: fast inference in linear structural equation models with  hidden variables under additive interventions
arXiv:1706.06178, Title: Infinite Mixture Model of Markov Chains
arXiv:1706.06185, Title: Flexible High-Dimensional Unsupervised Learning with Missing Data
arXiv:1706.06288, Title: A review and comparative study on functional time series techniques
arXiv:1706.06289, Title: Nonparametric estimation of the kernel function of symmetric stable  moving average random functions
arXiv:1706.06296, Title: Approximate Kernel PCA Using Random Features: Computational vs.  Statistical Trade-off
arXiv:1706.06344, Title: Bayesian model selection for exponential random graph models via  adjusted pseudolikelihoods
arXiv:1706.06351, Title: Testing for Change in Stochastic Volatility with Long Range Dependence
arXiv:1706.06354, Title: Consistency of the plug-in functional predictor of the  Ornstein-Uhlenbeck process in Hilbert and Banach spaces
arXiv:1706.06380, Title: Mixed Effect Dirichlet-Tree Multinomial for Longitudinal Microbiome Data  and Weight Prediction
arXiv:1706.06469, Title: On mitigating the analytical limitations of finely stratified  experiments
arXiv:1706.06498, Title: Asymptotic properties of a componentwise ARH(1) plug-in predictor
arXiv:1706.06516, Title: Unperturbed: spectral analysis beyond Davis-Kahan
arXiv:1706.06544, Title: Robust and Efficient Transfer Learning with Hidden-Parameter Markov  Decision Processes
arXiv:1706.06611, Title: Individualized Treatment Effects with Censored Data via Fully  Nonparametric Bayesian Accelerated Failure Time Models
arXiv:1706.06632, Title: On the joint asymptotic distribution of the restricted estimators in  multivariate regression model
arXiv:1706.06638, Title: On convergence of the sample correlation matrices in high-dimensional  data
arXiv:1706.06657, Title: A Bootstrap Method for Sinusoid Detection in Colored Noise and Uneven  Sampling. Application to Exoplanet Detection
