arXiv:1706.06689, Title: Chemception: A Deep Neural Network with Minimal Chemistry Knowledge  Matches the Performance of Expert-developed QSAR/QSPR Models
arXiv:1706.06691, Title: Interpretable Predictions of Tree-based Ensembles via Actionable Feature  Tweaking
arXiv:1706.06703, Title: New Parsimonious Multivariate Spatial Model: Spatial Envelope
arXiv:1706.06742, Title: Variational inference for coupled Hidden Markov Models applied to the  joint detection of copy number variations
arXiv:1706.06770, Title: Nonlinear probability. A theory with incompatible stochastic variables
arXiv:1706.06774, Title: Optimal modification of the LRT for the equality of two high-dimensional  covariance matrices
arXiv:1706.06878, Title: An Unsupervised Method for Estimating the Global Horizontal Irradiance  from Photovoltaic Power Measurements
arXiv:1706.06889, Title: gk: An R Package for the g-and-k and generalised g-and-h Distributions
arXiv:1706.06908, Title: Sparse and Smooth Prior for Bayesian Linear Regression with Application  to ETEX Data
arXiv:1706.06910, Title: Multi-scale streaming anomalies detection for time series
arXiv:1706.06953, Title: Statistical Mechanics of Node-perturbation Learning with Noisy Baseline
arXiv:1706.06971, Title: Ensembles of Models and Metrics for Robust Ranking of Homologous  Proteins
arXiv:1706.06976, Title: The effect of the spatial domain in FANOVA models with ARH(1) error term
arXiv:1706.06977, Title: A sharp oracle inequality for Graph-Slope
arXiv:1706.06978, Title: Deep Interest Network for Click-Through Rate Prediction
arXiv:1706.06991, Title: Adaptive Huber Regression
arXiv:1706.06995, Title: A latent variable model for survival time prediction with censoring and  diverse covariates
arXiv:1706.07034, Title: Local bandwidth selection for kernel density estimation in bifurcating  Markov chain model
arXiv:1706.07094, Title: Constrained Bayesian Optimization with Noisy Experiments
arXiv:1706.07101, Title: The energy landscape of a simple neural network
arXiv:1706.07136, Title: Multiscale Information Decomposition: Exact Computation for Multivariate  Gaussian Processes
arXiv:1706.07180, Title: Compressive Statistical Learning with Random Feature Moments
arXiv:1706.07194, Title: From here to infinity - sparse finite versus Dirichlet process mixtures  in model-based clustering
arXiv:1706.07237, Title: Convolved subsampling estimation with applications to block bootstrap
arXiv:1706.07258, Title: Scalable Multi-Class Gaussian Process Classification using Expectation  Propagation
arXiv:1706.07328, Title: Targeted Undersmoothing
arXiv:1706.07355, Title: Three-dimensional Cardiovascular Imaging-Genetics: A Mass Univariate  Framework
arXiv:1706.07408, Title: Data-adaptive smoothing for optimal-rate estimation of possibly  non-regular parameters
arXiv:1706.07449, Title: Nonparametric Bayesian estimation of a Hölder continuous diffusion  coefficient
arXiv:1706.07450, Title: Revised Note on Learning Algorithms for Quadratic Assignment with Graph  Neural Networks
arXiv:1706.07467, Title: The Cost of Transportation : Spatial Analysis of US Fuel Prices
arXiv:1706.07502, Title: Causal Inference in Travel Demand Modeling (and the lack thereof)
arXiv:1706.07510, Title: Clustering with Noisy Queries
arXiv:1706.07511, Title: Pathwise Least Angle Regression and a Significance Test for the Elastic  Net
arXiv:1706.07550, Title: Shape-constrained partial identification of a population mean under  unknown probabilities of sample selection
arXiv:1706.07561, Title: A-NICE-MC: Adversarial Training for MCMC
arXiv:1706.07564, Title: Least Squares Polynomial Chaos Expansion: A Review of Sampling  Strategies
arXiv:1706.07586, Title: Multi-sequence segmentation via score and higher-criticism tests
arXiv:1706.07607, Title: Consistent Estimation in General Sublinear Preferential Attachment Trees
arXiv:1706.07642, Title: A Variance Maximization Criterion for Active Learning
arXiv:1706.07664, Title: Estimation and adaptive-to-model testing for regressions with diverging  number of predictors
arXiv:1706.07677, Title: A Bayesian approach to modeling mortgage default and prepayment
arXiv:1706.07681, Title: Multivariate Geometric Skew-Normal Distribution
arXiv:1706.07682, Title: Point and Interval Estimation of Weibull Parameters Based on Joint  Progressively Censored Data
arXiv:1706.07685, Title: Model choice in separate families: A comparison between the FBST and the  Cox test
arXiv:1706.07705, Title: Spatially filtered unconditional quantile regression
arXiv:1706.07712, Title: Asymptotics of ABC
arXiv:1706.07719, Title: Query Complexity of Clustering with Side Information
arXiv:1706.07766, Title: Asymmetric Matrix-Valued Covariances for Multivariate Random Fields on  Spheres
arXiv:1706.07767, Title: Bayesian Penalized Regression
arXiv:1706.07797, Title: A computer algebra system for R: Macaulay2 and the m2r package
arXiv:1706.07834, Title: Cover Tree Compressed Sensing for Fast MR Fingerprint Recovery
arXiv:1706.07840, Title: Time series experiments and causal estimands: exact randomization tests  and trading
arXiv:1706.07880, Title: Collaborative Deep Learning in Fixed Topology Networks
arXiv:1706.07888, Title: Evolving Spatially Aggregated Features from Satellite Imagery for  Regional Modeling
arXiv:1706.07899, Title: High-dimensional Linear Regression for Dependent Observations with  Application to Nowcasting
arXiv:1706.08020, Title: Robust Sparse Covariance Estimation by Thresholding Tyler's M-Estimator
arXiv:1706.08037, Title: Active matrix completion with uncertainty quantification
arXiv:1706.08058, Title: Invariant Causal Prediction for Sequential Data
arXiv:1706.08082, Title: Target contrastive pessimistic risk for robust domain adaptation
arXiv:1706.08110, Title: The Matrix Hilbert Space and Its Application to Matrix Learning
arXiv:1706.08137, Title: A Contemporary Overview of Probabilistic Latent Variable Models
arXiv:1706.08141, Title: A Unified Analysis of Stochastic Optimization Methods Using Jump System  Theory and Quadratic Constraints
arXiv:1706.08170, Title: Image transformations on locally compact spaces
arXiv:1706.08171, Title: Faster independent component analysis by preconditioning with Hessian  approximations
arXiv:1706.08203, Title: Dr.VAE: Drug Response Variational Autoencoder
arXiv:1706.08209, Title: A sequential surrogate method for reliability analysis based on radial  basis function
arXiv:1706.08217, Title: An Effective Way to Improve YouTube-8M Classification Accuracy in Google  Cloud Platform
arXiv:1706.08222, Title: YouTube-8M Video Understanding Challenge Approach and Applications
arXiv:1706.08234, Title: Testing normality for unconditionally heteroscedastic macroeconomic  variables
arXiv:1706.08244, Title: Spatial Risk Measure for Max-Stable and Max-Mixture Processes
arXiv:1706.08250, Title: Improving the Benjamini-Hochberg Procedure for Discrete Tests
arXiv:1706.08263, Title: Efficient Manifold and Subspace Approximations with Spherelets
arXiv:1706.08269, Title: Top-down Transformation Choice
arXiv:1706.08277, Title: State-by-state Minimax Adaptive Estimation for Nonparametric Hidden  Markov Models
arXiv:1706.08281, Title: Estimation of species relative abundances and habitat preferences using  opportunistic data
arXiv:1706.08289, Title: Intrinsic data depth for Hermitian positive definite matrices
arXiv:1706.08320, Title: Unemployment estimation: Spatial point referenced methods and models
arXiv:1706.08327, Title: Informed Sub-Sampling MCMC: Approximate Bayesian Inference for Large  Datasets
arXiv:1706.08344, Title: High-dimensional classification by sparse logistic regression
arXiv:1706.08359, Title: GPU-acceleration for Large-scale Tree Boosting
arXiv:1706.08418, Title: Nonseparable Multinomial Choice Models in Cross-Section and Panel Data
arXiv:1706.08440, Title: Challenges to estimating contagion effects from observational data
arXiv:1706.08457, Title: Iterative Random Forests to detect predictive and stable high-order  interactions
arXiv:1706.08491, Title: Cognitive Subscore Trajectory Prediction in Alzheimer's Disease
arXiv:1706.08495, Title: Uncertainty Decomposition in Bayesian Neural Networks with Latent  Variables
arXiv:1706.08519, Title: On conditional parity as a notion of non-discrimination in machine  learning
arXiv:1706.08557, Title: New insights into non-central beta distributions
arXiv:1706.08561, Title: Group Synchronization on Grids
arXiv:1706.08565, Title: Satellite conjunction analysis and the false confidence theorem
arXiv:1706.08566, Title: SchNet: A continuous-filter convolutional neural network for modeling  quantum interactions
arXiv:1706.08567, Title: Empirical priors and posterior concentration rates for a monotone  density
arXiv:1706.08576, Title: Invariant Causal Prediction for Nonlinear Models
arXiv:1706.08606, Title: Cognitive Psychology for Deep Neural Networks: A Shape Bias Case Study
arXiv:1706.08648, Title: Laplace deconvolution in the presence of indirect long-memory data
arXiv:1706.08699, Title: Two-Stage Hybrid Day-Ahead Solar Forecasting
arXiv:1706.08702, Title: A network flow approach to visualising the roles of covariates in random  forests
arXiv:1706.08757, Title: Extrinsic Gaussian processes for regression and classification on  manifolds
arXiv:1706.08822, Title: archivist: An R Package for Managing, Recording and Restoring Data  Analysis Results
arXiv:1706.08881, Title: Evaluating the hot hand phenomenon using predictive memory selection for  multistep Markov Chains: LeBron James' error correcting free throws
arXiv:1706.08884, Title: When Neurons Fail
arXiv:1706.08894, Title: Unsupervised Feature Selection Based on Space Filling Concept
arXiv:1706.08927, Title: Subspace Clustering with the Multivariate-t Distribution
arXiv:1706.08936, Title: Fast Algorithms for Learning Latent Variables in Graphical Models
arXiv:1706.08938, Title: Robust and Efficient Parametric Spectral Estimation in Atomic Force  Microscopy
arXiv:1706.08984, Title: Unsupervised Learning via Total Correlation Explanation
arXiv:1706.09072, Title: Influence Networks in International Relations
arXiv:1706.09090, Title: An Actor-Critic Contextual Bandit Algorithm for Personalized Mobile  Health Interventions
arXiv:1706.09141, Title: Causal Structure Learning
arXiv:1706.09187, Title: Multiple imputation in Cox regression when there are time-varying  effects of exposures
arXiv:1706.09231, Title: Asymptotic Confidence Regions for High-dimensional Structured Sparsity
arXiv:1706.09233, Title: Modeling Temporally Evolving and Spatially Globally Dependent Data
arXiv:1706.09293, Title: Concentration of tempered posteriors and of their variational  approximations
arXiv:1706.09367, Title: autoBagging: Learning to Rank Bagging Workflows with Metalearning
arXiv:1706.09375, Title: Multilayer Knockoff Filter: Controlled variable selection at multiple  resolutions
arXiv:1706.09395, Title: Recovery of Missing Samples Using Sparse Approximation via a Convex  Similarity Measure
arXiv:1706.09396, Title: Landmark Diffusion Maps (L-dMaps): Accelerated manifold learning  out-of-sample extension
arXiv:1706.09410, Title: Generalized notions of sparsity and restricted isometry property. Part  I: A unified framework
arXiv:1706.09411, Title: Generalized notions of sparsity and restricted isometry property. Part  II: Applications
arXiv:1706.09523, Title: Bayesian regression tree models for causal inference: regularization,  confounding, and heterogeneous effects
arXiv:1706.09574, Title: On the analysis of personalized medication response and classification  of case vs control patients in mobile health studies: the mPower case study
arXiv:1706.09602, Title: A Novel Tool to Evaluate the Accuracy of Predicting Survival in Cystic  Fibrosis
arXiv:1706.09603, Title: A tutorial on evaluating time-varying discrimination accuracy for  survival models used in dynamic decision-making
arXiv:1706.09627, Title: Deep learning bank distress from news and numerical financial data
arXiv:1706.09693, Title: Image classification using local tensor singular value decompositions
arXiv:1706.09751, Title: Bayesian Semisupervised Learning with Deep Generative Models
arXiv:1706.09795, Title: Feature uncertainty bounding schemes for large robust nonlinear SVM  classifiers
arXiv:1706.09796, Title: Selective inference after likelihood- or test-based model selection in  linear models
arXiv:1706.09811, Title: On the Bickel-Rosenblatt test of goodness-of-fit for the residuals of  autoregressive processes
arXiv:1706.09828, Title: Classification of Population Using Voronoi Area Based Density Estimation
arXiv:1706.09839, Title: Election forensic analysis of the Turkish Constitutional Referendum 2017
arXiv:1706.09865, Title: Generalising Random Forest Parameter Optimisation to Include Stability  and Cost
arXiv:1706.09873, Title: Importance sampling correction versus standard averages of reversible  MCMCs in terms of the asymptotic variance
arXiv:1706.09880, Title: A Fixed-Point of View on Gradient Methods for Big Data
arXiv:1706.09888, Title: Fast model-fitting of Bayesian variable selection regression using the  iterative complex factorization algorithm
arXiv:1706.09985, Title: Towards Bursting Filter Bubble via Contextual Risks and Uncertainties
arXiv:1706.10003, Title: Hypothesis Testing For Densities and High-Dimensional Multinomials:  Sharp Local Minimax Rates
arXiv:1706.10029, Title: Collaborative-controlled LASSO for Constructing Propensity Score-based  Estimators in High-Dimensional Data
arXiv:1706.10031, Title: Neural Sequence Model Training via $α$-divergence Minimization
arXiv:1706.10062, Title: Barankin Vector Locally Best Unbiased Estimates
arXiv:1706.10066, Title: Optimal High-Dimensional Shrinkage Covariance Estimation for Elliptical  Distributions
arXiv:1706.10096, Title: Noisy Hamiltonian Monte Carlo for doubly-intractable distributions
arXiv:1706.10125, Title: Inconsistency of Template Estimation by Minimizing of the  Variance/Pre-Variance in the Quotient Space
arXiv:1706.10179, Title: Lasso Meets Horseshoe
arXiv:1706.10207, Title: Optimization Methods for Supervised Machine Learning: From Linear Models  to Deep Learning
arXiv:1706.10208, Title: On Fairness, Diversity and Randomness in Algorithmic Decision Making
arXiv:1706.10234, Title: Probabilistic Active Learning of Functions in Structural Causal Models
arXiv:1706.10272, Title: Nuclear penalized multinomial regression with an application to  predicting at bat outcomes in baseball
arXiv:1706.10273, Title: Community Detection by $L_0$-penalized Graph Laplacian
arXiv:1706.00038, Title: Toward Robustness against Label Noise in Training Deep Discriminative  Neural Networks
arXiv:1706.00051, Title: Deep Generative Adversarial Networks for Compressed Sensing Automates  MRI
arXiv:1706.00061, Title: The Sample Complexity of Online One-Class Collaborative Filtering
arXiv:1706.00119, Title: Bayesian fairness
arXiv:1706.00204, Title: Statistical Analysis and Parameter Selection for Mapper
arXiv:1706.00241, Title: Krylov Subspace Recycling for Fast Iterative Least-Squares in Machine  Learning
arXiv:1706.00290, Title: Transfer Learning for Speech Recognition on a Budget
arXiv:1706.00291, Title: Data Analysis in Multimedia Quality Assessment: Revisiting the  Statistical Tests
arXiv:1706.00308, Title: On the asymptotic approximation to the probability distribution of  extremal precipitation
arXiv:1706.00342, Title: Stable recovery of deep linear networks under sparsity constraints
arXiv:1706.00348, Title: Efficient Low-Order Approximation of First-Passage Time Distributions
arXiv:1706.00476, Title: The Mixing method: low-rank coordinate descent for semidefinite  programming with diagonal constraints
arXiv:1706.00550, Title: On Unifying Deep Generative Models
arXiv:1706.00598, Title: Dynamic Steerable Blocks in Deep Residual Networks
arXiv:1706.00754, Title: Learning causal Bayes networks using interventional path queries in  polynomial time and sample complexity
arXiv:1706.00764, Title: Hyperparameter Optimization: A Spectral Approach
arXiv:1706.00820, Title: Information, Privacy and Stability in Adaptive Data Analysis
arXiv:1706.00856, Title: Multiple Kernel Learning and Automatic Subspace Relevance Determination  for High-dimensional Neuroimaging Data
arXiv:1706.00868, Title: Active learning machine learns to create new quantum experiments
arXiv:1706.01014, Title: Nonconvex penalties with analytical solutions for one-bit compressive  sensing
arXiv:1706.01081, Title: Nearly Optimal Sampling Algorithms for Combinatorial Pure Exploration
arXiv:1706.01108, Title: Stochastic Reformulations of Linear Systems: Algorithms and Convergence  Theory
arXiv:1706.01120, Title: Evolving imputation strategies for missing data in classification  problems with TPOT
arXiv:1706.01214, Title: Inconsistent Node Flattening for Improving Top-down Hierarchical  Classification
arXiv:1706.01238, Title: One look at the rating of scientific publications and corresponding  toy-model
arXiv:1706.01260, Title: The Classical Complexity of Boson Sampling
arXiv:1706.01350, Title: Emergence of Invariance and Disentanglement in Deep Representations
arXiv:1706.01362, Title: The Geometry of Nodal Sets and Outlier Detection
arXiv:1706.01502, Title: UCB Exploration via Q-Ensembles
arXiv:1706.01509, Title: Facial Emotion Detection Using Convolutional Neural Networks and  Representational Autoencoder Units
arXiv:1706.01513, Title: Beyond Volume: The Impact of Complex Healthcare Data on the Machine  Learning Pipeline
arXiv:1706.01534, Title: Hedging in fractional Black-Scholes model with transaction costs
arXiv:1706.01581, Title: Embedding Feature Selection for Large-scale Hierarchical Classification
arXiv:1706.01583, Title: Classifying Documents within Multiple Hierarchical Datasets using  Multi-Task Learning
arXiv:1706.01604, Title: Hyperplane Clustering Via Dual Principal Component Pursuit
arXiv:1706.01629, Title: Markov Chain Monte Carlo Methods for Bayesian Data Analysis in Astronomy
arXiv:1706.01643, Title: Retrosynthetic reaction prediction using neural sequence-to-sequence  models
arXiv:1706.01681, Title: A method and tool for combining differential or inclusive measurements  obtained with simultaneously constrained uncertainties
arXiv:1706.01686, Title: Limitations on Variance-Reduction and Acceleration Schemes for Finite  Sum Optimization
arXiv:1706.01824, Title: Robust Online Multi-Task Learning with Correlative and Personalized  Structures
arXiv:1706.01860, Title: Attributed Network Embedding for Learning in a Dynamic Environment
arXiv:1706.01905, Title: Parameter Space Noise for Exploration
arXiv:1706.01960, Title: Reconciling Bayesian and Total Variation Methods for Binary Inversion
arXiv:1706.01983, Title: Deep Learning: Generalization Requires Deep Compositional Feature Space  Design
arXiv:1706.02216, Title: Inductive Representation Learning on Large Graphs
arXiv:1706.02222, Title: Gated Recurrent Neural Tensor Network
arXiv:1706.02237, Title: Efficient Reinforcement Learning via Initial Pure Exploration
arXiv:1706.02256, Title: A Mention-Ranking Model for Abstract Anaphora Resolution
arXiv:1706.02262, Title: InfoVAE: Information Maximizing Variational Autoencoders
arXiv:1706.02289, Title: Meta-Learning for Resampling Recommendation Systems
arXiv:1706.02332, Title: Low-shot learning with large-scale diffusion
arXiv:1706.02375, Title: Fast Black-box Variational Inference through Stochastic Trust-Region  Optimization
arXiv:1706.02379, Title: Training Quantized Nets: A Deeper Understanding
arXiv:1706.02386, Title: On learning the structure of Bayesian Networks and submodular function  maximization
arXiv:1706.02409, Title: A Convex Framework for Fair Regression
arXiv:1706.02419, Title: Estimating Mixture Entropy with Pairwise Distances
arXiv:1706.02420, Title: Berry-Esséen bounds for parameter estimation of general Gaussian  processes
arXiv:1706.02447, Title: Luck is Hard to Beat: The Difficulty of Sports Prediction
arXiv:1706.02471, Title: Distribution-Free One-Pass Learning
arXiv:1706.02515, Title: Self-Normalizing Neural Networks
arXiv:1706.02542, Title: A Deformable Interface for Human Touch Recognition using Stretchable  Carbon Nanotube Dielectric Elastomer Sensors and Deep Neural Networks
arXiv:1706.02562, Title: Pain-Free Random Differential Privacy with Sensitivity Sampling
arXiv:1706.02582, Title: Clustering with t-SNE, provably
arXiv:1706.02586, Title: DSOS and SDSOS Optimization: More Tractable Alternatives to Sum of  Squares and Semidefinite Optimization
arXiv:1706.02609, Title: Spatio-Temporal Backpropagation for Training High-performance Spiking  Neural Networks
arXiv:1706.02631, Title: Sliced Wasserstein Generative Models
arXiv:1706.02645, Title: Nuclear Discrepancy for Active Learning
arXiv:1706.02690, Title: Enhancing The Reliability of Out-of-distribution Image Detection in  Neural Networks
arXiv:1706.02714, Title: Deep-Learning the Landscape
arXiv:1706.02761, Title: Gated Orthogonal Recurrent Units: On Learning to Forget
arXiv:1706.02776, Title: Optimizing expected word error rate via sampling for speech recognition
arXiv:1706.02803, Title: Scalable Kernel K-Means Clustering with Nystrom Approximation:  Relative-Error Bounds
arXiv:1706.02813, Title: Rigorous statistical analysis of HTTPS reachability
arXiv:1706.02857, Title: A Maximum Matching Algorithm for Basis Selection in Spectral Learning
arXiv:1706.02930, Title: Sesqui-arrays, a generalisation of triple arrays
arXiv:1706.02932, Title: Unsupervised learning of object frames by dense equivariant image  labelling
arXiv:1706.02952, Title: TIP: Typifying the Interpretability of Procedures
arXiv:1706.03100, Title: Decoupling Learning Rules from Representations
arXiv:1706.03151, Title: Adaptive Interference Removal for Un-coordinated Radar/Communication  Co-existence
arXiv:1706.03175, Title: Recovery Guarantees for One-hidden-layer Neural Networks
arXiv:1706.03261, Title: A Bayesian Hyperprior Approach for Joint Image Denoising and  Interpolation, with an Application to HDR Imaging
arXiv:1706.03265, Title: Stepwise regression for unsupervised learning
arXiv:1706.03269, Title: An Online Learning Approach to Generative Adversarial Networks
arXiv:1706.03292, Title: Poseidon: An Efficient Communication Architecture for Distributed Deep  Learning on GPU Clusters
arXiv:1706.03301, Title: Neural networks and rational functions
arXiv:1706.03358, Title: Sliced Wasserstein Kernel for Persistence Diagrams
arXiv:1706.03411, Title: Analysis of order book flows using a nonparametric estimation of the  branching ratio matrix
arXiv:1706.03418, Title: Estimating occupation time functionals
arXiv:1706.03475, Title: Confident Multiple Choice Learning
arXiv:1706.03692, Title: SEVEN: Deep Semi-supervised Verification Networks
arXiv:1706.03736, Title: Large-Scale Plant Classification with Deep Neural Networks
arXiv:1706.03825, Title: SmoothGrad: removing noise by adding noise
arXiv:1706.03842, Title: Approximate Structure Construction Using Large Statistical Swarms
arXiv:1706.03860, Title: Subspace Clustering via Optimal Direction Search
arXiv:1706.03896, Title: A Well-Tempered Landscape for Non-convex Robust Subspace Recovery
arXiv:1706.03946, Title: A Supervised Approach to Extractive Summarisation of Scientific Papers
arXiv:1706.04026, Title: Recurrent Latent Variable Networks for Session-Based Recommendation
arXiv:1706.04038, Title: Meta learning Framework for Automated Driving
arXiv:1706.04074, Title: Convergence analysis of belief propagation for pairwise linear Gaussian  models
arXiv:1706.04081, Title: Interaction-Based Distributed Learning in Cyber-Physical and Social  Networks
arXiv:1706.04097, Title: Provable Alternating Gradient Descent for Non-negative Matrix  Factorization with Strong Correlations
arXiv:1706.04156, Title: Gradient descent GAN optimization is locally stable
arXiv:1706.04370, Title: From Relational Data to Graphs: Inferring Significant Links using  Generalized Hypergeometric Ensembles
arXiv:1706.04397, Title: $ν$-net: Deep Learning for Generalized Biventricular Cardiac Mass and  Function Parameters
arXiv:1706.04410, Title: A strong converse bound for multiple hypothesis testing, with  applications to high-dimensional estimation
arXiv:1706.04499, Title: SEARNN: Training RNNs with Global-Local Losses
arXiv:1706.04546, Title: Reinforcement Learning with Budget-Constrained Nonparametric Function  Approximation for Opportunistic Spectrum Access
arXiv:1706.04601, Title: Provable benefits of representation learning
arXiv:1706.04606, Title: Nudged elastic band calculations accelerated with Gaussian process  regression
arXiv:1706.04635, Title: Information Potential Auto-Encoders
arXiv:1706.04646, Title: Differentially Private Learning of Undirected Graphical Models using  Collective Graphical Models
arXiv:1706.04687, Title: A Practical Method for Solving Contextual Bandit Problems Using Decision  Trees
arXiv:1706.04698, Title: Gradient Descent for Spiking Neural Networks
arXiv:1706.04702, Title: Deep learning-based numerical methods for high-dimensional parabolic  partial differential equations and backward stochastic differential equations
arXiv:1706.04711, Title: Reinforcement Learning under Model Mismatch
arXiv:1706.04792, Title: Mapping higher-order network flows in memory and multilayer networks  with Infomap
arXiv:1706.05069, Title: Generalization for Adaptively-chosen Estimators via Stable Median
arXiv:1706.05084, Title: Topic supervised non-negative matrix factorization
arXiv:1706.05098, Title: An Overview of Multi-Task Learning in Deep Neural Networks
arXiv:1706.05137, Title: One Model To Learn Them All
arXiv:1706.05249, Title: Multispectral and Hyperspectral Image Fusion Using a 3-D-Convolutional  Neural Network
arXiv:1706.05259, Title: Learning with Feature Evolvable Streams
arXiv:1706.05295, Title: Nonbacktracking Bounds on the Influence in Independent Cascade Models
