arXiv:1810.13258, Title: On Fast Leverage Score Sampling and Optimal Learning
arXiv:1810.13296, Title: On Exploration, Exploitation and Learning in Adaptive Importance  Sampling
arXiv:1810.13317, Title: Contrastive Multivariate Singular Spectrum Analysis
arXiv:1810.13321, Title: A General Framework for Multivariate Functional Principal Component  Analysis of Amplitude and Phase Variation
arXiv:1810.13333, Title: Boosting for Comparison-Based Learning
arXiv:1810.13402, Title: Bounding bias due to selection
arXiv:1810.13425, Title: Understanding Deep Neural Networks through Input Uncertainties
arXiv:1810.13427, Title: Unsupervised Dimension Selection using a Blue Noise Spectrum
arXiv:1810.13431, Title: Clustering-Enhanced Stochastic Gradient MCMC for Hidden Markov Models  with Rare States
arXiv:1810.00024, Title: Explainable Black-Box Attacks Against Model-based Authentication
arXiv:1810.00031, Title: Active Fairness in Algorithmic Decision Making
arXiv:1810.00045, Title: Adversarial Domain Adaptation for Stable Brain-Machine Interfaces
arXiv:1810.00068, Title: Differentially Private Contextual Linear Bandits
arXiv:1810.00069, Title: Adversarial Attacks and Defences: A Survey
arXiv:1810.00090, Title: Cell Grid Architecture for Maritime Route Prediction on AIS Data Streams
arXiv:1810.00096, Title: Predicting Destinations by Nearest Neighbor Search on Training Vessel  Routes
arXiv:1810.00110, Title: Open-Ended Content-Style Recombination Via Leakage Filtering
arXiv:1810.00122, Title: On the Convergence and Robustness of Batch Normalization
arXiv:1810.00123, Title: Generalization and Regularization in DQN
arXiv:1810.00139, Title: Knowledge-guided Semantic Computing Network
arXiv:1810.00143, Title: AdaShift: Decorrelation and Convergence of Adaptive Learning Rate  Methods
arXiv:1810.00144, Title: Interpreting Adversarial Robustness: A View from Decision Surface in  Input Space
arXiv:1810.00147, Title: M^3RL: Mind-aware Multi-agent Management Reinforcement Learning
arXiv:1810.00150, Title: Directional Analysis of Stochastic Gradient Descent via von Mises-Fisher  Distributions in Deep learning
arXiv:1810.00211, Title: Why echo chambers form and network interventions fail: Selection  outpaces influence in dynamic networks
arXiv:1810.00240, Title: Reinforcement Learning in R
arXiv:1810.00297, Title: Convergence and perturbation theory for an infinite-dimensional  Metropolis-Hastings algorithm with self-decomposable priors
arXiv:1810.00299, Title: Pruned and Structurally Sparse Neural Networks
arXiv:1810.00319, Title: Modeling Uncertainty with Hedged Instance Embedding
arXiv:1810.00322, Title: A Deep Learning Framework for Single-Sided Sound Speed Inversion in  Medical Ultrasound
arXiv:1810.00337, Title: Learning to Progressively Plan
arXiv:1810.00361, Title: Using State Predictions for Value Regularization in Curiosity Driven  Deep Reinforcement Learning
arXiv:1810.00378, Title: Pseudo-Random Number Generation using Generative Adversarial Networks
arXiv:1810.00383, Title: Privacy-preserving Stochastic Gradual Learning
arXiv:1810.00386, Title: Manifold Alignment with Feature Correspondence
arXiv:1810.00393, Title: Deep, Skinny Neural Networks are not Universal Approximators
arXiv:1810.00396, Title: Benchmarks of ResNet Architecture for Atrial Fibrillation Classification
arXiv:1810.00398, Title: Vector Quantized Spectral Clustering applied to Soybean Whole Genome  Sequences
arXiv:1810.00421, Title: Nth Absolute Root Mean Error
arXiv:1810.00424, Title: Graph Spectral Regularization for Neural Network Interpretability
arXiv:1810.00428, Title: Efficient Sequence Labeling with Actor-Critic Training
arXiv:1810.00466, Title: Interactive Learning with Corrective Feedback for Policies based on Deep  Neural Networks
arXiv:1810.00468, Title: Bayesian Transfer Reinforcement Learning with Prior Knowledge Rules
arXiv:1810.00470, Title: Procedural Noise Adversarial Examples for Black-Box Attacks on Deep  Neural Networks
arXiv:1810.00471, Title: Identifying Bias in AI using Simulation
arXiv:1810.00475, Title: Deep Learning for End-to-End Atrial Fibrillation Recurrence Estimation
arXiv:1810.00482, Title: Few-Shot Goal Inference for Visuomotor Learning and Planning
arXiv:1810.00490, Title: An Empirical Evaluation of Time-Aware LSTM Autoencoder on Chronic Kidney  Disease
arXiv:1810.00500, Title: One Network to Solve All ROIs: Deep Learning CT for Any ROI using  Differentiated Backprojection
arXiv:1810.00506, Title: Simple Algorithms for Learning from Random Counterexamples
arXiv:1810.00510, Title: Interactive Agent Modeling by Learning to Probe
arXiv:1810.00520, Title: FIRE-DES++: Enhanced Online Pruning of Base Classifiers for Dynamic  Ensemble Selection
arXiv:1810.00551, Title: Generative Adversarial Network for Medical Images (MI-GAN)
arXiv:1810.00609, Title: One-Click Annotation with Guided Hierarchical Object Detection
arXiv:1810.00619, Title: Predicted Variables in Programming
arXiv:1810.00656, Title: Perfect Match: A Simple Method for Learning Representations For  Counterfactual Inference With Neural Networks
arXiv:1810.00664, Title: Text Similarity in Vector Space Models: A Comparative Study
arXiv:1810.00668, Title: Wronging a Right: Generating Better Errors to Improve Grammatical Error  Detection
arXiv:1810.00679, Title: Direct optimization of F-measure for retrieval-based personal question  answering
arXiv:1810.00717, Title: Classification Using Link Prediction
arXiv:1810.00737, Title: Risk-Averse Stochastic Convex Bandit
arXiv:1810.00740, Title: Improving the Generalization of Adversarial Training with Domain  Adaptation
arXiv:1810.00760, Title: Riemannian Adaptive Optimization Methods
arXiv:1810.00774, Title: Geometric Constellation Shaping for Fiber Optic Communication Systems  via End-to-end Learning
arXiv:1810.00786, Title: Caulking the Leakage Effect in MEEG Source Connectivity Analysis
arXiv:1810.00810, Title: Multilevel Adaptive Sparse Grid Quadrature for Monte Carlo models
arXiv:1810.00821, Title: Variational Discriminator Bottleneck: Improving Imitation Learning,  Inverse RL, and GANs by Constraining Information Flow
arXiv:1810.00825, Title: Set Transformer
arXiv:1810.00826, Title: How Powerful are Graph Neural Networks?
arXiv:1810.00845, Title: CHET: Compiler and Runtime for Homomorphic Evaluation of Tensor Programs
arXiv:1810.00846, Title: Classification from Positive, Unlabeled and Biased Negative Data
arXiv:1810.00859, Title: Dynamic Sparse Graph for Efficient Deep Learning
arXiv:1810.00861, Title: ProxQuant: Quantized Neural Networks via Proximal Operators
arXiv:1810.00867, Title: Domain-Adversarial Multi-Task Framework for Novel Therapeutic Property  Prediction of Compounds
arXiv:1810.00869, Title: Training Machine Learning Models by Regularizing their Explanations
arXiv:1810.00873, Title: Extending Stan for Deep Probabilistic Programming
arXiv:1810.00946, Title: Non-linear Attributed Graph Clustering by Symmetric NMF with PU Learning
arXiv:1810.00950, Title: Omega-Regular Objectives in Model-Free Reinforcement Learning
arXiv:1810.00953, Title: Improved robustness to adversarial examples using Lipschitz  regularization of the loss
arXiv:1810.00974, Title: Neural Regression Trees
arXiv:1810.00997, Title: A simple parameter-free and adaptive approach to optimization under a  minimal local smoothness assumption
arXiv:1810.01008, Title: Learning Hash Codes via Hamming Distance Targets
arXiv:1810.01018, Title: Simultaneously Optimizing Weight and Quantizer of Ternary Neural Network  using Truncated Gaussian Approximation
arXiv:1810.01021, Title: Large batch size training of neural networks with adversarial training  and second-order information
arXiv:1810.01032, Title: Reinforcement Learning with Perturbed Rewards
arXiv:1810.01075, Title: Implicit Self-Regularization in Deep Neural Networks: Evidence from  Random Matrix Theory and Implications for Learning
arXiv:1810.01097, Title: Quantization-Aware Phase Retrieval
arXiv:1810.01108, Title: Video Imitation GAN: Learning control policies by imitating raw videos  using generative adversarial reward estimation
arXiv:1810.01118, Title: Sinkhorn AutoEncoders
arXiv:1810.01163, Title: An Entropic Optimal Transport Loss for Learning Deep Neural Networks  under Label Noise in Remote Sensing Images
arXiv:1810.01165, Title: Semi-supervised Text Regression with Conditional Generative Adversarial  Networks
arXiv:1810.01176, Title: EMI: Exploration with Mutual Information Maximizing State and Action  Embeddings
arXiv:1810.01187, Title: Thompson Sampling for Cascading Bandits
arXiv:1810.01190, Title: Inference Over Programs That Make Predictions
arXiv:1810.01212, Title: Approximation and sampling of multivariate probability distributions in  the tensor train decomposition
arXiv:1810.01217, Title: Sparse Gaussian Process Temporal Difference Learning for Marine Robot  Navigation
arXiv:1810.01222, Title: CEM-RL: Combining evolutionary and gradient-based methods for policy  search
arXiv:1810.01240, Title: Efficient Seismic fragility curve estimation by Active Learning on  Support Vector Machines
arXiv:1810.01243, Title: A Deep Autoencoder System for Differentiation of Cancer Types Based on  DNA Methylation State
arXiv:1810.01266, Title: Directed-Info GAIL: Learning Hierarchical Policies from Unsegmented  Demonstrations using Directed Information
arXiv:1810.01269, Title: A fast quasi-Newton-type method for large-scale stochastic optimisation
arXiv:1810.01270, Title: META-DES: A Dynamic Ensemble Selection Framework using Meta-Learning
arXiv:1810.01279, Title: Adv-BNN: Improved Adversarial Defense through Robust Bayesian Neural  Network
arXiv:1810.01316, Title: Landmine Detection Using Autoencoders on Multi-polarization GPR  Volumetric Data
arXiv:1810.01322, Title: Learning with Random Learning Rates
arXiv:1810.01344, Title: Unsupervised Emergence of Spatial Structure from Sensorimotor Prediction
arXiv:1810.01363, Title: Energy-Based Hindsight Experience Prioritization
arXiv:1810.01365, Title: On Self Modulation for Generative Adversarial Networks
arXiv:1810.01367, Title: FFJORD: Free-form Continuous Dynamics for Scalable Reversible Generative  Models
arXiv:1810.01370, Title: Covariate Distribution Balance via Propensity Scores
arXiv:1810.01373, Title: Multi-scale Convolution Aggregation and Stochastic Feature Reuse for  DenseNets
arXiv:1810.01395, Title: Phasebook and Friends: Leveraging Discrete Representations for Source  Separation
arXiv:1810.01398, Title: Optimal Completion Distillation for Sequence Learning
arXiv:1810.01400, Title: Sketching for Latent Dirichlet-Categorical Models
arXiv:1810.01403, Title: GLAD: GLocalized Anomaly Detection via Active Feature Space Suppression
arXiv:1810.01406, Title: Super-Resolution via Conditional Implicit Maximum Likelihood Estimation
arXiv:1810.01407, Title: Can Adversarially Robust Learning Leverage Computational Hardness?
arXiv:1810.01414, Title: PromID: human promoter prediction by deep learning
arXiv:1810.01468, Title: Structured Multi-Label Biomedical Text Tagging via Attentive Neural Tree  Decoding
arXiv:1810.01477, Title: Adaptive, Personalized Diversity for Visual Discovery
arXiv:1810.01480, Title: Learning to Segment Inputs for NMT Favors Character-Level Processing
arXiv:1810.01488, Title: Using Machine Learning to Discern Eruption in Noisy Environments: A Case  Study using CO2-driven Cold-Water Geyser in Chimayo, New Mexico
arXiv:1810.01544, Title: Image as Data: Automated Visual Content Analysis for Political Science
arXiv:1810.01566, Title: Learning Particle Dynamics for Manipulating Rigid Bodies, Deformable  Objects, and Fluids
arXiv:1810.01575, Title: Deep Fundamental Matrix Estimation without Correspondences
arXiv:1810.01576, Title: A General Weighted Average Representation of the Ordinary and Two-Stage  Least Squares Estimands
arXiv:1810.01625, Title: Weak Convergence (IIA) - Functional and Random Aspects of the Univariate  Extreme Value Theory
arXiv:1810.01710, Title: Multilevel Monte Carlo Acceleration of Seismic Wave Propagation under  Uncertainty
arXiv:1810.01761, Title: Simulation of elliptic and hypo-elliptic conditional diffusions
arXiv:1810.01765, Title: Predicting Factuality of Reporting and Bias of News Media Sources
arXiv:1810.01807, Title: Disambiguating Music Artists at Scale with Audio Metric Learning
arXiv:1810.01859, Title: Contextual Multi-Armed Bandits for Causal Marketing
arXiv:1810.01860, Title: GINN: Geometric Illustration of Neural Networks
arXiv:1810.01861, Title: Inhibited Softmax for Uncertainty Estimation in Neural Networks
arXiv:1810.01864, Title: Agnostic Sample Compression for Linear Regression
arXiv:1810.01865, Title: Robust identification of thermal models for in-production  High-Performance-Computing clusters with machine learning-based data  selection
arXiv:1810.01866, Title: Learning an internal representation of the end-effector configuration  space
arXiv:1810.01867, Title: A Non-linear Approach to Space Dimension Perception by a Naive Agent
arXiv:1810.01868, Title: Deep processing of structured data
arXiv:1810.01869, Title: Machine Learning Suites for Online Toxicity Detection
arXiv:1810.01870, Title: Grounding Perception: A Developmental Approach to Sensorimotor  Contingencies
arXiv:1810.01871, Title: Grounding the Experience of a Visual Field through Sensorimotor  Contingencies
arXiv:1810.01872, Title: Learning agent's spatial configuration from sensorimotor invariants
arXiv:1810.01873, Title: Combining Natural Gradient with Hessian Free Methods for Sequence  Training
arXiv:1810.01875, Title: Relaxed Quantization for Discretized Neural Networks
arXiv:1810.01876, Title: Spurious samples in deep generative models: bug or feature?
arXiv:1810.01877, Title: Understanding Weight Normalized Deep Neural Networks with Rectified  Linear Units
arXiv:1810.01878, Title: Real-time Clustering Algorithm Based on Predefined Level-of-Similarity
arXiv:1810.01920, Title: Generalized Inverse Optimization through Online Learning
arXiv:1810.01937, Title: LIT: Block-wise Intermediate Representation Training for Model  Compression
arXiv:1810.01940, Title: Comparison of Reinforcement Learning algorithms applied to the Cart Pole  problem
arXiv:1810.01963, Title: Learning Scheduling Algorithms for Data Processing Clusters
arXiv:1810.01965, Title: CRED: A Deep Residual Network of Convolutional and Recurrent Units for  Earthquake Signal Detection
arXiv:1810.02003, Title: From Soft Classifiers to Hard Decisions: How fair can we be?
arXiv:1810.02016, Title: The Four Point Permutation Test for Latent Block Structure in Incidence  Matrices
arXiv:1810.02019, Title: Seq2Slate: Re-ranking and Slate Optimization with RNNs
arXiv:1810.02022, Title: Convergence of the Expectation-Maximization Algorithm Through  Discrete-Time Lyapunov Stability Theory
arXiv:1810.02032, Title: Gradient descent aligns the layers of deep linear networks
arXiv:1810.02054, Title: Gradient Descent Provably Optimizes Over-parameterized Neural Networks
arXiv:1810.02068, Title: Towards Fast and Energy-Efficient Binarized Neural Network Inference on  FPGA
arXiv:1810.02069, Title: Finding Solutions to Generative Adversarial Privacy
arXiv:1810.02071, Title: An Efficient Approach for Removing Look-ahead Bias in the Least Square  Monte Carlo Algorithm: Leave-One-Out
arXiv:1810.02076, Title: Transferring Physical Motion Between Domains for Neural Inertial  Tracking
arXiv:1810.02080, Title: Dual Convolutional Neural Network for Graph of Graphs Link Prediction
arXiv:1810.02112, Title: Monte Carlo Dependency Estimation
arXiv:1810.02125, Title: A Machine Learning-based Recommendation System for Swaptions Strategies
arXiv:1810.02176, Title: Adaptive Policies for Perimeter Surveillance Problems
arXiv:1810.02180, Title: Improved generalization bounds for robust learning
arXiv:1810.02225, Title: Memristor-based Deep Convolution Neural Network: A Case Study
arXiv:1810.02244, Title: Weisfeiler and Leman Go Neural: Higher-order Graph Neural Networks
arXiv:1810.02266, Title: Concept-drifting Data Streams are Time Series; The Case for Continuous  Adaptation
arXiv:1810.02274, Title: Episodic Curiosity through Reachability
arXiv:1810.02281, Title: A Convergence Analysis of Gradient Descent for Deep Linear Neural  Networks
arXiv:1810.02309, Title: Learning Compressed Transforms with Low Displacement Rank
arXiv:1810.02315, Title: DER Allocation and Line Repair Scheduling for Storm-induced Failures in  Distribution Networks
arXiv:1810.02323, Title: Machine learning electron correlation in a disordered medium
arXiv:1810.02334, Title: Unsupervised Learning via Meta-Learning
arXiv:1810.02358, Title: Transfer Learning via Unsupervised Task Discovery for Visual Question  Answering
arXiv:1810.02363, Title: Recurrent Transition Networks for Character Locomotion
arXiv:1810.02419, Title: Towards High Resolution Video Generation with Progressive Growing of  Sliced Wasserstein GANs
arXiv:1810.02422, Title: Zero-Shot Skill Composition and Simulation-to-Real Transfer by Learning  Task Representations
arXiv:1810.02423, Title: Generalizing the theory of cooperative inference
arXiv:1810.02424, Title: Feature prioritization and regularization improve standard accuracy and  adversarial robustness
arXiv:1810.02440, Title: The Dynamics of Differential Learning I: Information-Dynamics and Task  Reachability
arXiv:1810.02442, Title: AutoLoss: Learning Discrete Schedules for Alternate Optimization
arXiv:1810.02453, Title: Correcting the bias in least squares regression with volume-rescaled  sampling
arXiv:1810.02456, Title: Graph-Theoretic Analysis of Belief System Dynamics under Logic  Constraints
arXiv:1810.02513, Title: Learning To Simulate
arXiv:1810.02518, Title: Social Choice Random Utility Models of Intransitive Pairwise Comparisons
arXiv:1810.02525, Title: Where Did My Optimum Go?: An Empirical Analysis of Gradient Descent  Optimization in Policy Gradient Methods
arXiv:1810.02528, Title: Local Stability and Performance of Simple Gradient Penalty  mu-Wasserstein GAN
arXiv:1810.02529, Title: An Introduction to fast-Super Paramagnetic Clustering
arXiv:1810.02541, Title: PPO-CMA: Proximal Policy Optimization with Covariance Matrix Adaptation
arXiv:1810.02555, Title: Differentiable Antithetic Sampling for Variance Reduction in Stochastic  Variational Inference
arXiv:1810.02561, Title: GPdoemd: a python package for design of experiments for model  discrimination
arXiv:1810.02677, Title: Convex Clustering: Model, Theoretical Guarantee and Efficient Algorithm
arXiv:1810.02678, Title: Local Interpretable Model-agnostic Explanations of Bayesian Predictive  Models via Kullback-Leibler Projections
arXiv:1810.02684, Title: Modeling overland flow from local inflows in almost no-time, using Self  Organizing Maps
arXiv:1810.02688, Title: Wikistat 2.0: Educational Resources for Artificial Intelligence
arXiv:1810.02716, Title: Approximate Leave-One-Out for High-Dimensional Non-Differentiable  Learning Problems
arXiv:1810.02717, Title: Clust-LDA: Joint Model for Text Mining and Author Group Inference
arXiv:1810.02797, Title: RCCNet: An Efficient Convolutional Neural Network for Histological  Routine Colon Cancer Nuclei Classification
arXiv:1810.02810, Title: Linear Queries Estimation with Local Differential Privacy
arXiv:1810.02812, Title: Classifying Multi-channel UWB SAR Imagery via Tensor Sparsity Learning  Techniques
arXiv:1810.02837, Title: Scaling Submodular Optimization Approaches for Control Applications in  Networked Systems
arXiv:1810.02845, Title: Deep Probabilistic Video Compression
arXiv:1810.02880, Title: Physics Guided Recurrent Neural Networks For Modeling Dynamical Systems:  Application to Monitoring Water Temperature And Quality In Lakes
arXiv:1810.02897, Title: CDF Transform-Shift: An effective way to deal with inhomogeneous density  datasets
arXiv:1810.02905, Title: Bounding Optimality Gap in Stochastic Optimization via Bagging:  Statistical Efficiency and Stability
arXiv:1810.02912, Title: Actor-Attention-Critic for Multi-Agent Reinforcement Learning
arXiv:1810.02927, Title: Q-map: a Convolutional Approach for Goal-Oriented Reinforcement Learning
arXiv:1810.02950, Title: Mining Novel Multivariate Relationships in Time Series Data Using  Correlation Networks
arXiv:1810.02955, Title: Consistency and Computation of Regularized MLEs for Multivariate Hawkes  Processes
arXiv:1810.02966, Title: Understanding Recurrent Neural Architectures by Analyzing and  Synthesizing Long Distance Dependencies in Benchmark Sequential Datasets
arXiv:1810.02976, Title: Anytime Stochastic Gradient Descent: A Time to Hear from all the Workers
arXiv:1810.03024, Title: Learning to Optimize under Non-Stationarity
arXiv:1810.03037, Title: Over-parameterization Improves Generalization in the XOR Detection  Problem
arXiv:1810.03044, Title: Artificial Intelligence for Diabetes Case Management: The Intersection  of Physical and Mental Health
arXiv:1810.03048, Title: Bayes-CPACE: PAC Optimal Exploration in Continuous Space Bayes-Adaptive  Markov Decision Processes
arXiv:1810.03051, Title: Subspace Tracking from Missing and Outlier Corrupted Data
arXiv:1810.03052, Title: Deep convolutional Gaussian processes
arXiv:1810.03064, Title: CSI-Net: Unified Human Body Characterization and Action Recognition
arXiv:1810.03068, Title: Graph Classification with Geometric Scattering
arXiv:1810.03078, Title: Graphlet Count Estimation via Convolutional Neural Networks
arXiv:1810.03105, Title: ASVRG: Accelerated Proximal SVRG
arXiv:1810.03115, Title: European Court of Human Right Open Data project
arXiv:1810.03124, Title: Accelerating Stochastic Gradient Descent Using Antithetic Sampling
arXiv:1810.03145, Title: Real-Time Workload Classification during Driving using HyperNetworks
arXiv:1810.03198, Title: Reinforcement Evolutionary Learning Method for self-learning
arXiv:1810.03218, Title: Principled Deep Neural Network Training through Linear Programming
arXiv:1810.03262, Title: Modelling brain-wide neuronal morphology via rooted Cayley trees
arXiv:1810.03264, Title: Toward Understanding the Impact of Staleness in Distributed Machine  Learning
arXiv:1810.03278, Title: Optimizing Waiting Thresholds Within A State Machine
arXiv:1810.03292, Title: Sanity Checks for Saliency Maps
arXiv:1810.03307, Title: Local Explanation Methods for Deep Neural Networks Lack Sensitivity to  Parameter Values
arXiv:1810.03370, Title: Empirical Bounds on Linear Regions of Deep Rectifier Networks
arXiv:1810.03372, Title: Detecting Memorization in ReLU Networks
arXiv:1810.03382, Title: Deep learning cardiac motion analysis for human survival prediction
arXiv:1810.03389, Title: On Breiman's Dilemma in Neural Networks: Phase Transitions of Margin  Dynamics
arXiv:1810.03393, Title: Hierarchical clustering that takes advantage of both density-peak and  density-connectivity
arXiv:1810.03417, Title: POLO: a POLicy-based Optimization library
arXiv:1810.03435, Title: Simultaneous Measurement Imputation and Outcome Prediction for Achilles  Tendon Rupture Rehabilitation
arXiv:1810.03442, Title: Towards the Latent Transcriptome
arXiv:1810.03445, Title: Building a language evolution tree based on word vector combination  model
arXiv:1810.03480, Title: Text Classification of the Precursory Accelerating Seismicity Corpus:  Inference on some Theoretical Trends in Earthquake Predictability Research  from 1988 to 2018
arXiv:1810.03505, Title: CINIC-10 is not ImageNet or CIFAR-10
arXiv:1810.03527, Title: CHOPT : Automated Hyperparameter Optimization Framework for Cloud-Based  Machine Learning Platforms
arXiv:1810.03530, Title: Effective Parallelisation for Machine Learning
arXiv:1810.03538, Title: Combinatorial Attacks on Binarized Neural Networks
arXiv:1810.03548, Title: Meta-Learning: A Survey
arXiv:1810.03586, Title: Hierarchical segmentation using equivalence test (HiSET): Application to  DCE image sequences
arXiv:1810.03587, Title: Algorithmic Aspects of Inverse Problems Using Generative Models
arXiv:1810.03594, Title: Proximal Online Gradient is Optimum for Dynamic Regret
arXiv:1810.03611, Title: Understanding the Origins of Bias in Word Embeddings
arXiv:1810.03642, Title: CAML: Fast Context Adaptation via Meta-Learning
arXiv:1810.03679, Title: Multi-agent Deep Reinforcement Learning for Zero Energy Communities
arXiv:1810.03711, Title: A Hybrid Approach for Trajectory Control Design
arXiv:1810.03714, Title: Design by adaptive sampling
arXiv:1810.03728, Title: Probabilistic Semantic Inpainting with Pixel Constrained CNNs
arXiv:1810.03730, Title: Efficient Non-parametric Bayesian Hawkes Processes
arXiv:1810.03739, Title: Efficient Two-Step Adversarial Defense for Deep Neural Networks
arXiv:1810.03744, Title: Neural Networks Models for Analyzing Magic: the Gathering Cards
arXiv:1810.03745, Title: Deep residual networks for automatic sleep stage classification of raw  polysomnographic waveforms
arXiv:1810.03763, Title: Cubic Regularization with Momentum for Nonconvex Optimization
arXiv:1810.03764, Title: Generalized Latent Variable Recovery for Generative Adversarial Networks
arXiv:1810.03773, Title: Average Margin Regularization for Classifiers
arXiv:1810.03779, Title: Reinforcement Learning for Improving Agent Design
arXiv:1810.03798, Title: The Outer Product Structure of Neural Network Derivatives
arXiv:1810.03805, Title: What made you do this? Understanding black-box decisions with sufficient  input subsets
arXiv:1810.03806, Title: The Adversarial Attack and Detection under the Fisher Information Metric
arXiv:1810.03817, Title: Learning Bounds for Greedy Approximation with Explicit Feature Maps from  Multiple Kernels
arXiv:1810.03855, Title: Neural activity classification with machine learning models trained on  interspike interval series data
arXiv:1810.03880, Title: Continual State Representation Learning for Reinforcement Learning using  Generative Replay
arXiv:1810.03913, Title: Analyzing the Noise Robustness of Deep Neural Networks
