arXiv:1810.06397, Title: A Priori Estimates of the Generalization Error for Two-layer Neural  Networks
arXiv:1810.06410, Title: Measuring religious morality using very limited poll responses:  Implementing "big-data analytics" to small data
arXiv:1810.06433, Title: Calibration procedures for approximate Bayesian credible sets
arXiv:1810.06474, Title: Population Symbolic Covariance Matrices for Interval Data
arXiv:1810.06587, Title: Evaluating Sensitivity to the Stick Breaking Prior in Bayesian  Nonparametrics
arXiv:1810.06608, Title: Computer model calibration based on image warping metrics: an  application for sea ice deformation
arXiv:1810.06655, Title: Rank Dynamics for Functional Data
arXiv:1810.06702, Title: Learning by Unsupervised Nonlinear Diffusion
arXiv:1810.06707, Title: Building Representative Matched Samples with Multi-valued Treatments in  Large Observational Studies: Analysis of the Impact of an Earthquake on  Educational Attainment
arXiv:1810.06738, Title: Random clique covers for graphs with local density and global sparsity
arXiv:1810.06758, Title: Discriminator Rejection Sampling
arXiv:1810.06787, Title: Supplementary Material for "Estimation of a Multiplicative Correlation  Structure in the Large Dimensional Case"
arXiv:1810.06803, Title: Co-manifold learning with missing data
arXiv:1810.06838, Title: Finite-sample Analysis of M-estimators using Self-concordance
arXiv:1810.06940, Title: Estimation of the Spatial Weighting Matrix for Spatiotemporal Data under  the Presence of Structural Breaks
arXiv:1810.06943, Title: The Deep Weight Prior
arXiv:1810.06966, Title: Biologically Plausible Online Principal Component Analysis Without  Recurrent Neural Dynamics
arXiv:1810.06983, Title: Covariate Gaussian Process Latent Variable Models
arXiv:1810.06989, Title: Clustering in statistical ill-posed linear inverse problems
arXiv:1810.07016, Title: Density Deconvolution with Small Berkson Errors
arXiv:1810.07066, Title: Very Short Term Time-Series Forecasting of Solar Irradiance Without  Exogenous Inputs
arXiv:1810.07126, Title: Compatibility and attainability of matrices of correlation-based  measures of concordance
arXiv:1810.07128, Title: High-dimensional Varying Index Coefficient Models via Stein's Identity
arXiv:1810.07138, Title: Integral Transform Methods in Goodness-of-Fit Testing, I: The Gamma  Distributions
arXiv:1810.07147, Title: Joint Nonparametric Precision Matrix Estimation with Confounding
arXiv:1810.07151, Title: Metropolis-Hastings view on variational inference and adversarial  training
arXiv:1810.07158, Title: Multimodal Deep Gaussian Processes
arXiv:1810.07240, Title: Statistical classification for partially observed functional data via  filtering
arXiv:1810.07245, Title: Assessing the distribution of discrete survival time in presence of  recall error
arXiv:1810.07260, Title: Statistical Estimation of Malware Detection Metrics in the Absence of  Ground Truth
arXiv:1810.07280, Title: Gender Bias in Nobel Prizes
arXiv:1810.07283, Title: Optimal locally private estimation under $\ell_p$ loss for $1\le p\le 2$
arXiv:1810.07287, Title: Refining interaction search through signed iterative Random Forests
arXiv:1810.07318, Title: Improved return level estimation via a weighted likelihood, latent  spatial extremes model
arXiv:1810.07371, Title: Simple Regret Minimization for Contextual Bandits
arXiv:1810.07403, Title: Optimal Covariance Estimation for Condition Number Loss in the Spiked  Model
arXiv:1810.07435, Title: EMHMM Simulation Study
arXiv:1810.07468, Title: Hierarchical Methods of Moments
arXiv:1810.07496, Title: Combine Statistical Thinking With Scientific Practice: A Protocol of a  Bayesian Thesis Project For Undergraduate Students
arXiv:1810.07509, Title: Mean survival by ordered fractions of population with censored data
arXiv:1810.07654, Title: Shrinkage estimation of rate statistics
arXiv:1810.07668, Title: Bayesian wavelet de-noising with the caravan prior
arXiv:1810.07677, Title: Structural Equation Modeling and simultaneous clustering through the  Partial Least Squares algorithm
arXiv:1810.07716, Title: The loss surface of deep linear networks viewed through the algebraic  geometry lens
arXiv:1810.07738, Title: A natural 4-parameter family of covariance functions for stationary  Gaussian processes
arXiv:1810.07750, Title: On mean decomposition for summarizing conditional distributions
arXiv:1810.07858, Title: Identification of Causal Diffusion Effects Using Stationary Causal  Directed Acyclic Graphs
arXiv:1810.07876, Title: Hierarchical Network Item Response Modeling for Discovering Differences  Between Innovation and Regular School Systems in Korea
arXiv:1810.07897, Title: Two-component Mixture Model in the Presence of Covariates
arXiv:1810.07902, Title: Structured gene-environment interaction analysis
arXiv:1810.07913, Title: Distributionally Robust Reduced Rank Regression and Principal Component  Analysis in High Dimensions
arXiv:1810.07924, Title: Entropic Variable Boosting for Explainability and Interpretability in  Machine Learning
arXiv:1810.07954, Title: HierLPR: Decision making in hierarchical multi-label classification with  local precision rates
arXiv:1810.08010, Title: Variational Noise-Contrastive Estimation
arXiv:1810.08029, Title: Challenging nostalgia and performance metrics in baseball
arXiv:1810.08032, Title: Augmenting Adjusted Plus-Minus in Soccer with FIFA Ratings
arXiv:1810.08033, Title: Adaptivity of deep ReLU network for learning in Besov and mixed smooth  Besov spaces: optimal rate and curse of dimensionality
arXiv:1810.08057, Title: On estimation of biconvex sets
arXiv:1810.08083, Title: Good Initializations of Variational Bayes for Deep Models
arXiv:1810.08104, Title: Determining the Number of Components in PLS Regression on Incomplete  Data
arXiv:1810.08140, Title: Impact of model misspecification in shared frailty survival models
arXiv:1810.08164, Title: Exploiting Correlation in Finite-Armed Structured Bandits
arXiv:1810.08219, Title: Asymptotic Properties for Methods Combining Minimum Hellinger Distance  Estimates and Bayesian Nonparametric Density Estimates
arXiv:1810.08240, Title: Uniform, nonparametric, non-asymptotic confidence sequences
arXiv:1810.08255, Title: Removing the influence of a group variable in high-dimensional  predictive modelling
arXiv:1810.08259, Title: A systematic investigation of classical causal inference strategies  under mis-specification due to network interference
arXiv:1810.08264, Title: Quantile Regression Under Memory Constraint
arXiv:1810.08278, Title: Interpolating between Optimal Transport and MMD using Sinkhorn  Divergences
arXiv:1810.08285, Title: Log-symmetric regression models for correlated errors with an  application to mortality data
arXiv:1810.08292, Title: A similarity measure for second order properties of non-stationary  functional time series with applications to clustering and testing
arXiv:1810.08316, Title: Heteroskedastic PCA: Algorithm, Optimality, and Applications
arXiv:1810.08361, Title: AdaPtive Noisy Data Augmentation (PANDA) for Simultaneous Construction  Multiple Graph Models
arXiv:1810.08389, Title: Harmonizing Fully Optimal Designs with Classic Randomization in Fixed  Trial Experiments
arXiv:1810.08417, Title: Characterizations of indicator functions of fractional factorial designs
arXiv:1810.08480, Title: Data analysis from empirical moments and the Christoffel function
arXiv:1810.08516, Title: The exponentiated xgammma distribution: Estimation and its application
arXiv:1810.08537, Title: Bayesian Distance Clustering
arXiv:1810.08553, Title: Federated Learning in Distributed Medical Databases: Meta-Analysis of  Large-Scale Subcortical Brain Data
arXiv:1810.08564, Title: Nonparametric Bayesian Lomax delegate racing for survival analysis with  competing risks
arXiv:1810.08588, Title: Remote sensing to reduce the effects of spatial autocorrelation on  design-based inference for forest inventory using systematic samples
arXiv:1810.08595, Title: False Discovery and Its Control in Low Rank Estimation
arXiv:1810.08635, Title: Population and Empirical PR Curves for Assessment of Ranking Algorithms
arXiv:1810.08683, Title: Taking Advantage of Multitask Learning for Fair Classification
arXiv:1810.08693, Title: The total variation distance between high-dimensional Gaussians
arXiv:1810.08714, Title: Estimation of a functional single index model with dependent errors and  unknown error density
arXiv:1810.08750, Title: Learning Models with Uniform Performance via Distributionally Robust  Optimization
arXiv:1810.08778, Title: Marginal models with individual-specific effects for the analysis of  longitudinal bipartite networks
arXiv:1810.08791, Title: A defensive marginal particle filtering method for data assimilation
arXiv:1810.08805, Title: Asymptotic efficiency in the Autoregressive process driven by a  stationary Gaussian noise
arXiv:1810.08807, Title: Investigating Voice as a Biomarker for leucine-rich repeat kinase  2-Associated Parkinson's Disease
arXiv:1810.08826, Title: Wasserstein-based methods for convergence complexity analysis of MCMC  with application to Albert and Chib's algorithm
arXiv:1810.08829, Title: Data-Driven Tight Frame for Cryo-EM Image Denoising and Conformational  Classification
arXiv:1810.08880, Title: High-dimensional Two-sample Precision Matrices Test: An Adaptive  Approach through Multiplier Bootstrap
arXiv:1810.08918, Title: Multiple Scaled Contaminated Normal Distribution and Its Application in  Clustering
arXiv:1810.09004, Title: Signal Adaptive Variable Selector for the Horseshoe Prior
arXiv:1810.09022, Title: Correcting an estimator of a multivariate monotone function with  isotonic regression
arXiv:1810.09038, Title: Depth with Nonlinearity Creates No Bad Local Minima in ResNets
arXiv:1810.09098, Title: Stochastic Gradient MCMC for State Space Models
arXiv:1810.09116, Title: Surrogate modeling based on resampled polynomial chaos expansions
arXiv:1810.09133, Title: Unsupervised Detection of Anomalous Sound based on Deep Learning and the  Neyman-Pearson Lemma
arXiv:1810.09136, Title: Do Deep Generative Models Know What They Don't Know?
arXiv:1810.09137, Title: DNN-based Source Enhancement to Increase Objective Sound Quality  Assessment Score
arXiv:1810.09138, Title: Bayesian Modelling of Lexis Mortality Data
arXiv:1810.09165, Title: A Maximum Likelihood-Based Minimum Mean Square Error Separation and  Estimation of Stationary Gaussian Sources from Noisy Mixtures
arXiv:1810.09184, Title: Learning sparse transformations through backpropagation
arXiv:1810.09192, Title: Subtleties in the interpretation of hazard ratios
arXiv:1810.09207, Title: Halfspace depth does not characterize probability distributions
arXiv:1810.09214, Title: Weighted asymmetric least squares regression for longitudinal data using  GEE
arXiv:1810.09229, Title: Approximations of the boundary crossing probabilities for the maximum of  moving sums
arXiv:1810.09291, Title: A Bayesian Nonparametrics based Robust Particle Filter Algorithm
arXiv:1810.09298, Title: Sparse constrained projection approximation subspace tracking
arXiv:1810.09317, Title: Assessing the Impact of Gamification on Self-Directed Learning in  Medical Students
arXiv:1810.09390, Title: A minimax near-optimal algorithm for adaptive rejection sampling
arXiv:1810.09414, Title: Properties of an N Time-Slice Dynamic Chain Event Graph
arXiv:1810.09433, Title: Bayesian multi-domain learning for cancer subtype discovery from  next-generation sequencing count data
arXiv:1810.09447, Title: A Method for Robust Online Classification using Dictionary Learning:  Development and Assessment for Monitoring Manual Material Handling Activities  Using Wearable Sensors
arXiv:1810.09494, Title: A Bayesian Nonparametric Method for Estimating Causal Treatment Effects  on Zero-Inflated Outcomes
arXiv:1810.09497, Title: Comparing Two Approaches in Heteroscedastic Regression Models
arXiv:1810.09498, Title: Univariate Mean Change Point Detection: Penalization, CUSUM and  Optimality
arXiv:1810.09519, Title: Adversarial Risk Bounds for Binary Classification via Function  Transformation
arXiv:1810.09521, Title: Multivariate stable distributions and their applications for modelling  cryptocurrency-returns
arXiv:1810.09533, Title: Recovery, detection and confidence sets of communities in a sparse  stochastic block model
arXiv:1810.09564, Title: Average group effect of strongly correlated predictor variables is  estimable
arXiv:1810.09583, Title: Model Selection Techniques -- An Overview
arXiv:1810.09624, Title: Calendar-based graphics for visualizing people's daily schedules
arXiv:1810.09682, Title: Bivariate modelling of precipitation and temperature using a  non-homogeneous hidden Markov model
arXiv:1810.09750, Title: Objective Bayesian Comparison of Order-Constrained Models in Contingency  Tables
arXiv:1810.09753, Title: Goodness-of-Fit Tests for Large Datasets
arXiv:1810.09762, Title: Adaptation Bounds for Confidence Bands under Self-Similarity
arXiv:1810.09781, Title: A Social Network Analysis of Articles on Social Network Analysis
arXiv:1810.09782, Title: Fixing Match-Fixing
arXiv:1810.09810, Title: Multivariate Locally Stationary Wavelet Process Analysis with the mvLSW  R Package
arXiv:1810.09880, Title: Empirical Regularized Optimal Transport: Statistical Theory and  Applications
arXiv:1810.09894, Title: Heterogeneous large datasets integration using Bayesian factor  regression
arXiv:1810.09899, Title: Dynamic Likelihood-free Inference via Ratio Estimation (DIRE)
arXiv:1810.09909, Title: Asymptotic Theory of Bayes Factor for Nonparametric Model and Variable  Selection in the Gaussian Process Framework
arXiv:1810.09912, Title: Efficient Bayesian Experimental Design for Implicit Models
arXiv:1810.09920, Title: Clustering Time Series with Nonlinear Dynamics: A Bayesian  Non-Parametric and Particle-Based Approach
arXiv:1810.09996, Title: Bayesian Model Search for Nonstationary Periodic Time Series
arXiv:1810.10041, Title: Semiparametric Analysis of Competing Risks Data Under Missing Cause of  Failure
arXiv:1810.10065, Title: Statistical mechanics of low-rank tensor decomposition
arXiv:1810.10078, Title: Model Selection for Nonnegative Matrix Factorization by Support Union  Recovery
arXiv:1810.10082, Title: A Continuous-Time View of Early Stopping for Least Squares Regression
arXiv:1810.10138, Title: Bayesian Modeling of Nonlinear Poisson Regression with Artificial Neural  Networks
arXiv:1810.10164, Title: Outcome-wide longitudinal designs for causal inference: a new template  for empirical studies
arXiv:1810.10172, Title: Modified Multidimensional Scaling and High Dimensional Clustering
arXiv:1810.10213, Title: The Langevin diffusion as a continuous-time model of animal movement and  habitat selection
arXiv:1810.10214, Title: Asymptotics of eigenstructure of sample correlation matrices for  high-dimensional spiked models
arXiv:1810.10239, Title: Extension of the Gradient Boosting Algorithm for Joint Modeling of  Longitudinal and Time-to-Event data
arXiv:1810.10276, Title: The Hellinger Correlation
arXiv:1810.10292, Title: Estimating abundance from multiple sampling capture-recapture data via a  multi-state multi-period stopover model
arXiv:1810.10368, Title: Scalable Gaussian Processes on Discrete Domains
arXiv:1810.10425, Title: A Deep Learning Mechanism for Efficient Information Dissemination in  Vehicular Floating Content
arXiv:1810.10427, Title: Notes on asymptotics of sample eigenstructure for spiked covariance  models with non-Gaussian data
arXiv:1810.10460, Title: HAKD: Hardware Aware Knowledge Distillation
arXiv:1810.10482, Title: Noisy Blackbox Optimization with Multi-Fidelity Queries: A Tree Search  Approach
arXiv:1810.10488, Title: Statistical modeling of rates and trends in Holocene relative sea level
arXiv:1810.10495, Title: Posterior Convergence of Gaussian and General Stochastic Process  Regression Under Possible Misspecifications
arXiv:1810.10520, Title: Stochastic temporal data upscaling using the generalized k-nearest  neighbor algorithm
arXiv:1810.10559, Title: Leave-one-out cross-validation for non-factorizable normal models
arXiv:1810.10572, Title: Local calibration of verbal autopsy algorithms
arXiv:1810.10598, Title: Exchangeable, Markov multi-state survival process
arXiv:1810.10625, Title: Toward Robust Neural Networks via Sparsification
arXiv:1810.10669, Title: Model Selection using Multi-Objective Optimization
arXiv:1810.10705, Title: Alzheimer's Disease Prediction Using Longitudinal and Heterogeneous  Magnetic Resonance Imaging
arXiv:1810.10722, Title: Joint modelling of progression-free and overall survival and computation  of correlation measures
arXiv:1810.10775, Title: Adversarially Robust Optimization with Gaussian Processes
arXiv:1810.10794, Title: Between a ROC and a Hard Place: Using prevalence plots to understand the  likely real world performance of biomarkers in the clinic
arXiv:1810.10798, Title: A Gaussian Process perspective on Convolutional Neural Networks
arXiv:1810.10854, Title: Structure learning of undirected graphical models for count data
arXiv:1810.10859, Title: Complementary Lipschitz continuity results for the distribution of  intersections or unions of independent random sets in finite spaces
arXiv:1810.10883, Title: Fast Exact Bayesian Inference for Sparse Signals in the Normal Sequence  Model
arXiv:1810.10930, Title: Inference in MCMC step selection models
arXiv:1810.10936, Title: Building Reality Checks into the Translational Pathway for Diagnostic  and Prognostic Models
arXiv:1810.10946, Title: Helix modelling through the Mardia-Holmes model framework and an  extension of the Mardia-Holmes model
arXiv:1810.10971, Title: Signature moments to characterize laws of stochastic processes
arXiv:1810.10972, Title: On a generalized form of subjective probability
arXiv:1810.10977, Title: Efficient Load Sampling for Worst-Case Structural Analysis Under Force  Location Uncertainty
arXiv:1810.10985, Title: Random Sampling: Practice Makes Imperfect
arXiv:1810.11010, Title: Heterogeneous Treatment Effect Estimation through Deep Learning
arXiv:1810.11042, Title: Optimal post-selection inference for sparse signals: a nonparametric  empirical-Bayes approach
arXiv:1810.11056, Title: A new look at weather-related health impacts through functional  regression
arXiv:1810.11098, Title: Provable Gaussian Embedding with One Observation
arXiv:1810.11107, Title: Adaptive Density Estimation on Bounded Domains
arXiv:1810.11130, Title: Finite-sample Guarantees for Winsorized Importance Sampling
arXiv:1810.11155, Title: Communication Efficient Parallel Algorithms for Optimization on  Manifolds
arXiv:1810.11163, Title: SQUAREM: An R Package for Off-the-Shelf Acceleration of EM, MM and Other  EM-like Monotone Algorithms
arXiv:1810.11180, Title: Hanson-Wright inequality in Hilbert spaces with application to $K$-means  clustering for non-Euclidean data
arXiv:1810.11185, Title: Beyond A/B Testing: Sequential Randomization for Developing  Interventions in Scaled Digital Learning Environments
arXiv:1810.11204, Title: Sample covariances of random-coefficient AR(1) panel model
arXiv:1810.11207, Title: Generalized Concordance for Competing Risks
arXiv:1810.11209, Title: Deep Poisson gamma dynamical systems
arXiv:1810.11223, Title: Spectral Analysis of High-dimensional Time Series
arXiv:1810.11332, Title: A fast algorithm for computing distance correlation
arXiv:1810.11347, Title: Generating equilibrium molecules with deep neural networks
arXiv:1810.11378, Title: Improving the Stability of the Knockoff Procedure: Multiple Simultaneous  Knockoffs and Entropy Maximization
arXiv:1810.11428, Title: Resampled Priors for Variational Autoencoders
arXiv:1810.11479, Title: Accumulating Knowledge for Lifelong Online Learning
arXiv:1810.11480, Title: Testing Exponentiality Against a Trend Change in Mean Time to Failure in  Age Replacement
arXiv:1810.11526, Title: Algebraic tests of general Gaussian latent tree models
arXiv:1810.11557, Title: A Note on the Expected Number of Interviews When Talent is Uniformly  Distributed
arXiv:1810.11571, Title: Analysis of KNN Information Estimators for Smooth Distributions
arXiv:1810.11589, Title: Estimating Differential Entropy under Gaussian Convolutions
arXiv:1810.11591, Title: Sensitivity indices for output on a Riemannian manifold
arXiv:1810.11630, Title: Informative Features for Model Comparison
arXiv:1810.11646, Title: Removing Hidden Confounding by Experimental Grounding
arXiv:1810.11664, Title: Calibration of imperfect mathematical models by multiple sources of data  with measurement bias
arXiv:1810.11693, Title: Stein Variational Gradient Descent as Moment Matching
arXiv:1810.11701, Title: Hull Form Optimization with Principal Component Analysis and Deep Neural  Network
arXiv:1810.11711, Title: Regularization Effect of Fast Gradient Sign Method and its  Generalization
arXiv:1810.11721, Title: The B-Exponential Divergence and its Generalizations with Applications  to Parametric Estimation
arXiv:1810.11726, Title: Towards Robust Deep Neural Networks
arXiv:1810.11746, Title: On buffered double autoregressive time series models
arXiv:1810.11776, Title: Identifying Causal Structure in Large-Scale Kinetic Systems
arXiv:1810.11783, Title: RecurJac: An Efficient Recursive Algorithm for Bounding Jacobian Matrix  of Neural Networks and Its Applications
arXiv:1810.11859, Title: Consistency of ELBO maximization for model selection
arXiv:1810.11861, Title: Change Surfaces for Expressive Multidimensional Changepoints and  Counterfactual Prediction
arXiv:1810.11881, Title: Bounded Regression with Gaussian Process Projection
arXiv:1810.11893, Title: An Efficient Implementation of Riemannian Manifold Hamiltonian Monte  Carlo for Gaussian Process Models
arXiv:1810.11900, Title: Cultural transmission modes of music sampling traditions remain stable  despite delocalization in the digital age
arXiv:1810.11917, Title: Location and scale behaviour of the quantiles of a natural exponential  family
arXiv:1810.11953, Title: Failing Loudly: An Empirical Study of Methods for Detecting Dataset  Shift
arXiv:1810.11959, Title: An Amalgamation of Classical and Quantum Machine Learning For the  Classification of Adenocarcinoma and Squamous Cell Carcinoma Patients
arXiv:1810.11971, Title: Semi-crowdsourced Clustering with Deep Generative Models
arXiv:1810.11977, Title: Identification of physical processes via combined data-driven and  data-assimilation methods
arXiv:1810.12068, Title: Modelling rankings in R: the PlackettLuce package
arXiv:1810.12105, Title: Estimating grouped data models with a binary dependent variable and  fixed effect via logit vs OLS: the impact of dropped units
arXiv:1810.12161, Title: Regularized Maximum Likelihood Estimation and Feature Selection in  Mixtures-of-Experts Models
arXiv:1810.12169, Title: Fast Computation of Genome-Metagenome Interaction Effects
arXiv:1810.12176, Title: Semi-unsupervised Learning of Human Activity using Deep Generative  Models
arXiv:1810.12177, Title: Variational Calibration of Computer Models
arXiv:1810.12184, Title: Multivariate Analysis and Visualization using R Package muvis
arXiv:1810.12233, Title: Approximate Bayesian Computation via Population Monte Carlo and  Classification
arXiv:1810.12263, Title: Learning Gaussian Processes by Minimizing PAC-Bayesian Generalization  Bounds
arXiv:1810.12273, Title: Kalman Gradient Descent: Adaptive Variance Reduction in Stochastic  Optimization
arXiv:1810.12361, Title: Global Non-convex Optimization with Discretized Diffusions
arXiv:1810.12369, Title: Learning and Inference in Hilbert Space with Quantum Graphical Models
arXiv:1810.12389, Title: A Statistical Simulation Method for Joint Time Series of Non-stationary  Hourly Wave Parameters
arXiv:1810.12401, Title: Application of Clustering Methods to Anomaly Detection in Fibrous Media
arXiv:1810.12430, Title: The Holy Grail and the Bad Sampling - A test for the homogeneity of  missing proportions for evaluating the agreement between peer review and  bibliometrics in the Italian research assessment exercises
arXiv:1810.12437, Title: Prior-preconditioned conjugate gradient for accelerated Gibbs sampling  in "large n & large p" sparse Bayesian logistic regression models
arXiv:1810.12452, Title: Complier stochastic direct effects: identification and robust estimation
arXiv:1810.12460, Title: A Novel Approach to Quantized Matrix Completion Using Huber Loss Measure
arXiv:1810.12499, Title: Predicting Sediment and Nutrient Concentrations in Rivers Using High  Frequency Water Quality Surrogates
arXiv:1810.12518, Title: Private Algorithms Can Always Be Extended
arXiv:1810.12519, Title: Semiparametric response model with nonignorable nonresponse
arXiv:1810.12609, Title: Strong consistency of the AIC, BIC, $C_p$ and KOO methods in  high-dimensional multivariate linear regression
arXiv:1810.12683, Title: Pseudo-Bayesian Learning with Kernel Fourier Transform as Prior
arXiv:1810.12743, Title: Hypergraph based semi-supervised learning algorithms applied to speech  recognition problem: a novel approach
arXiv:1810.12750, Title: Gaussian Process Conditional Density Estimation
arXiv:1810.12760, Title: Quickest Detection Of Deviations From Periodic Statistical Behavior
arXiv:1810.12862, Title: Optimally Weighted PCA for High-Dimensional Heteroscedastic Data
arXiv:1810.13014, Title: Mathematical modelling European temperature data: spatial differences in  global warming
arXiv:1810.13076, Title: A framework for automated anomaly detection in high frequency  water-quality data from in situ sensors
arXiv:1810.13094, Title: Sample size considerations for comparing dynamic treatment regimens in a  sequential multiple-assignment randomized trial with a continuous  longitudinal outcome
arXiv:1810.13163, Title: A tutorial on MDL hypothesis testing for graph analysis
